No.     Time           Source                Destination           Protocol Length Info
      1 0.000000       host                  3.28.0                USB      36     GET DESCRIPTOR Request DEVICE

Frame 1: 36 bytes on wire (288 bits), 36 bytes captured (288 bits) on interface \\.\USBPcap3, id 0
USB URB
    [Source: host]
    [Destination: 3.28.0]
    USBPcap pseudoheader length: 28
    IRP ID: 0xffffa387c69c8010
    IRP USBD_STATUS: USBD_STATUS_SUCCESS (0x00000000)
    URB Function: URB_FUNCTION_GET_DESCRIPTOR_FROM_DEVICE (0x000b)
    IRP information: 0x00, Direction: FDO -> PDO
    URB bus id: 3
    Device address: 28
    Endpoint: 0x80, Direction: IN
    URB transfer type: URB_CONTROL (0x02)
    Packet Data Length: 8
    [Response in: 2]
    Control transfer stage: Setup (0)
Setup Data

No.     Time           Source                Destination           Protocol Length Info
      2 0.027802       3.28.0                host                  USB      46     GET DESCRIPTOR Response DEVICE

Frame 2: 46 bytes on wire (368 bits), 46 bytes captured (368 bits) on interface \\.\USBPcap3, id 0
USB URB
    [Source: 3.28.0]
    [Destination: host]
    USBPcap pseudoheader length: 28
    IRP ID: 0xffffa387c69c8010
    IRP USBD_STATUS: USBD_STATUS_SUCCESS (0x00000000)
    URB Function: URB_FUNCTION_CONTROL_TRANSFER (0x0008)
    IRP information: 0x01, Direction: PDO -> FDO
    URB bus id: 3
    Device address: 28
    Endpoint: 0x80, Direction: IN
    URB transfer type: URB_CONTROL (0x02)
    Packet Data Length: 18
    [Request in: 1]
    [Time from request: 0.027802000 seconds]
    Control transfer stage: Complete (3)
DEVICE DESCRIPTOR
    bLength: 18
    bDescriptorType: 0x01 (DEVICE)
    bcdUSB: 0x0200
    bDeviceClass: Device (0x00)
    bDeviceSubClass: 0
    bDeviceProtocol: 0 (Use class code info from Interface Descriptors)
    bMaxPacketSize0: 64
    idVendor: Yubico.com (0x1050)
    idProduct: Yubikey 4/5 OTP+U2F+CCID (0x0407)
    bcdDevice: 0x0543
    iManufacturer: 1
    iProduct: 2
    iSerialNumber: 0
    bNumConfigurations: 1

No.     Time           Source                Destination           Protocol Length Info
      3 0.027833       host                  3.28.0                USB      36     GET DESCRIPTOR Request CONFIGURATION

Frame 3: 36 bytes on wire (288 bits), 36 bytes captured (288 bits) on interface \\.\USBPcap3, id 0
USB URB
    [Source: host]
    [Destination: 3.28.0]
    USBPcap pseudoheader length: 28
    IRP ID: 0xffffa387c5d15ab0
    IRP USBD_STATUS: USBD_STATUS_SUCCESS (0x00000000)
    URB Function: URB_FUNCTION_GET_DESCRIPTOR_FROM_DEVICE (0x000b)
    IRP information: 0x00, Direction: FDO -> PDO
    URB bus id: 3
    Device address: 28
    Endpoint: 0x80, Direction: IN
    URB transfer type: URB_CONTROL (0x02)
    Packet Data Length: 8
    [Response in: 4]
    Control transfer stage: Setup (0)
Setup Data

No.     Time           Source                Destination           Protocol Length Info
      4 0.030809       3.28.0                host                  USB      37     GET DESCRIPTOR Response CONFIGURATION

Frame 4: 37 bytes on wire (296 bits), 37 bytes captured (296 bits) on interface \\.\USBPcap3, id 0
USB URB
    [Source: 3.28.0]
    [Destination: host]
    USBPcap pseudoheader length: 28
    IRP ID: 0xffffa387c5d15ab0
    IRP USBD_STATUS: USBD_STATUS_SUCCESS (0x00000000)
    URB Function: URB_FUNCTION_CONTROL_TRANSFER (0x0008)
    IRP information: 0x01, Direction: PDO -> FDO
    URB bus id: 3
    Device address: 28
    Endpoint: 0x80, Direction: IN
    URB transfer type: URB_CONTROL (0x02)
    Packet Data Length: 9
    [Request in: 3]
    [Time from request: 0.002976000 seconds]
    Control transfer stage: Complete (3)
CONFIGURATION DESCRIPTOR
    bLength: 9
    bDescriptorType: 0x02 (CONFIGURATION)
    wTotalLength: 150
    bNumInterfaces: 3
    bConfigurationValue: 1
    iConfiguration: 0
    Configuration bmAttributes: 0x80  NOT SELF-POWERED  NO REMOTE-WAKEUP
    bMaxPower: 15  (30mA)

No.     Time           Source                Destination           Protocol Length Info
      5 0.030826       host                  3.28.0                USB      36     GET DESCRIPTOR Request CONFIGURATION

Frame 5: 36 bytes on wire (288 bits), 36 bytes captured (288 bits) on interface \\.\USBPcap3, id 0
USB URB
    [Source: host]
    [Destination: 3.28.0]
    USBPcap pseudoheader length: 28
    IRP ID: 0xffffa387c3b0aab0
    IRP USBD_STATUS: USBD_STATUS_SUCCESS (0x00000000)
    URB Function: URB_FUNCTION_GET_DESCRIPTOR_FROM_DEVICE (0x000b)
    IRP information: 0x00, Direction: FDO -> PDO
    URB bus id: 3
    Device address: 28
    Endpoint: 0x80, Direction: IN
    URB transfer type: URB_CONTROL (0x02)
    Packet Data Length: 8
    [Response in: 6]
    Control transfer stage: Setup (0)
Setup Data

No.     Time           Source                Destination           Protocol Length Info
      6 0.035800       3.28.0                host                  USB      178    GET DESCRIPTOR Response CONFIGURATION

Frame 6: 178 bytes on wire (1424 bits), 178 bytes captured (1424 bits) on interface \\.\USBPcap3, id 0
USB URB
    [Source: 3.28.0]
    [Destination: host]
    USBPcap pseudoheader length: 28
    IRP ID: 0xffffa387c3b0aab0
    IRP USBD_STATUS: USBD_STATUS_SUCCESS (0x00000000)
    URB Function: URB_FUNCTION_CONTROL_TRANSFER (0x0008)
    IRP information: 0x01, Direction: PDO -> FDO
    URB bus id: 3
    Device address: 28
    Endpoint: 0x80, Direction: IN
    URB transfer type: URB_CONTROL (0x02)
    Packet Data Length: 150
    [Request in: 5]
    [Time from request: 0.004974000 seconds]
    Control transfer stage: Complete (3)
CONFIGURATION DESCRIPTOR
    bLength: 9
    bDescriptorType: 0x02 (CONFIGURATION)
    wTotalLength: 150
    bNumInterfaces: 3
    bConfigurationValue: 1
    iConfiguration: 0
    Configuration bmAttributes: 0x80  NOT SELF-POWERED  NO REMOTE-WAKEUP
    bMaxPower: 15  (30mA)
INTERFACE DESCRIPTOR (0.0): class HID
    bLength: 9
    bDescriptorType: 0x04 (INTERFACE)
    bInterfaceNumber: 0
    bAlternateSetting: 0
    bNumEndpoints: 1
    bInterfaceClass: HID (0x03)
    bInterfaceSubClass: Boot Interface (0x01)
    bInterfaceProtocol: Keyboard (0x01)
    iInterface: 0
HID DESCRIPTOR
ENDPOINT DESCRIPTOR
    bLength: 7
    bDescriptorType: 0x05 (ENDPOINT)
    bEndpointAddress: 0x81  IN  Endpoint:1
    bmAttributes: 0x03
    wMaxPacketSize: 8
    bInterval: 10
INTERFACE DESCRIPTOR (1.0): class HID
    bLength: 9
    bDescriptorType: 0x04 (INTERFACE)
    bInterfaceNumber: 1
    bAlternateSetting: 0
    bNumEndpoints: 2
    bInterfaceClass: HID (0x03)
    bInterfaceSubClass: No Subclass (0x00)
    bInterfaceProtocol: 0x00
    iInterface: 0
HID DESCRIPTOR
ENDPOINT DESCRIPTOR
    bLength: 7
    bDescriptorType: 0x05 (ENDPOINT)
    bEndpointAddress: 0x04  OUT  Endpoint:4
    bmAttributes: 0x03
    wMaxPacketSize: 64
    bInterval: 2
ENDPOINT DESCRIPTOR
    bLength: 7
    bDescriptorType: 0x05 (ENDPOINT)
    bEndpointAddress: 0x84  IN  Endpoint:4
    bmAttributes: 0x03
    wMaxPacketSize: 64
    bInterval: 2
INTERFACE DESCRIPTOR (2.0): class Smart Card
    bLength: 9
    bDescriptorType: 0x04 (INTERFACE)
    bInterfaceNumber: 2
    bAlternateSetting: 0
    bNumEndpoints: 3
    bInterfaceClass: Smart Card (0x0b)
    bInterfaceSubClass: 0x00
    bInterfaceProtocol: 0x00
    iInterface: 0
SMART CARD DEVICE CLASS DESCRIPTOR
ENDPOINT DESCRIPTOR
    bLength: 7
    bDescriptorType: 0x05 (ENDPOINT)
    bEndpointAddress: 0x02  OUT  Endpoint:2
    bmAttributes: 0x02
    wMaxPacketSize: 64
    bInterval: 0
ENDPOINT DESCRIPTOR
    bLength: 7
    bDescriptorType: 0x05 (ENDPOINT)
    bEndpointAddress: 0x82  IN  Endpoint:2
    bmAttributes: 0x02
    wMaxPacketSize: 64
    bInterval: 0
ENDPOINT DESCRIPTOR
    bLength: 7
    bDescriptorType: 0x05 (ENDPOINT)
    bEndpointAddress: 0x83  IN  Endpoint:3
    bmAttributes: 0x03
    wMaxPacketSize: 8
    bInterval: 32

No.     Time           Source                Destination           Protocol Length Info
      7 0.036867       host                  3.28.0                USB      36     SET CONFIGURATION Request

Frame 7: 36 bytes on wire (288 bits), 36 bytes captured (288 bits) on interface \\.\USBPcap3, id 0
USB URB
    [Source: host]
    [Destination: 3.28.0]
    USBPcap pseudoheader length: 28
    IRP ID: 0xffffa387c65efab0
    IRP USBD_STATUS: USBD_STATUS_SUCCESS (0x00000000)
    URB Function: URB_FUNCTION_SELECT_CONFIGURATION (0x0000)
    IRP information: 0x00, Direction: FDO -> PDO
    URB bus id: 3
    Device address: 28
    Endpoint: 0x00, Direction: OUT
    URB transfer type: URB_CONTROL (0x02)
    Packet Data Length: 8
    [Response in: 8]
    Control transfer stage: Setup (0)
Setup Data

No.     Time           Source                Destination           Protocol Length Info
      8 0.044649       3.28.0                host                  USB      28     SET CONFIGURATION Response

Frame 8: 28 bytes on wire (224 bits), 28 bytes captured (224 bits) on interface \\.\USBPcap3, id 0
USB URB
    [Source: 3.28.0]
    [Destination: host]
    USBPcap pseudoheader length: 28
    IRP ID: 0xffffa387c65efab0
    IRP USBD_STATUS: USBD_STATUS_SUCCESS (0x00000000)
    URB Function: URB_FUNCTION_SELECT_CONFIGURATION (0x0000)
    IRP information: 0x01, Direction: PDO -> FDO
    URB bus id: 3
    Device address: 28
    Endpoint: 0x00, Direction: OUT
    URB transfer type: URB_CONTROL (0x02)
    Packet Data Length: 0
    [Request in: 7]
    [Time from request: 0.007782000 seconds]
    Control transfer stage: Complete (3)

No.     Time           Source                Destination           Protocol Length Info
      9 0.044700       host                  3.28.0                USB      27     Unknown type 7f

Frame 9: 27 bytes on wire (216 bits), 27 bytes captured (216 bits) on interface \\.\USBPcap3, id 0
USB URB
    [Source: host]
    [Destination: 3.28.0]
    USBPcap pseudoheader length: 27
    IRP ID: 0xffffa387c7009ab0
    IRP USBD_STATUS: USBD_STATUS_SUCCESS (0x00000000)
    URB Function: URB_FUNCTION_GET_MS_FEATURE_DESCRIPTOR (0x002a)
    IRP information: 0x00, Direction: FDO -> PDO
    URB bus id: 3
    Device address: 28
    Endpoint: 0x00, Direction: OUT
    URB transfer type: Unknown (0xff)
    Packet Data Length: 0
    [Response in: 10]

No.     Time           Source                Destination           Protocol Length Info
     10 0.044702       3.28.0                host                  USB      27     Unknown type 7f

Frame 10: 27 bytes on wire (216 bits), 27 bytes captured (216 bits) on interface \\.\USBPcap3, id 0
USB URB
    [Source: 3.28.0]
    [Destination: host]
    USBPcap pseudoheader length: 27
    IRP ID: 0xffffa387c7009ab0
    IRP USBD_STATUS: USBD_STATUS_SUCCESS (0x00000000)
    URB Function: URB_FUNCTION_GET_MS_FEATURE_DESCRIPTOR (0x002a)
    IRP information: 0x01, Direction: PDO -> FDO
    URB bus id: 3
    Device address: 28
    Endpoint: 0x00, Direction: OUT
    URB transfer type: Unknown (0xff)
    Packet Data Length: 0
    [Request in: 9]
    [Time from request: 0.000002000 seconds]

No.     Time           Source                Destination           Protocol Length Info
     11 0.044705       host                  3.28.0                USB      27     Unknown type 7f

Frame 11: 27 bytes on wire (216 bits), 27 bytes captured (216 bits) on interface \\.\USBPcap3, id 0
USB URB
    [Source: host]
    [Destination: 3.28.0]
    USBPcap pseudoheader length: 27
    IRP ID: 0xffffa387c7008ab0
    IRP USBD_STATUS: USBD_STATUS_SUCCESS (0x00000000)
    URB Function: URB_FUNCTION_GET_MS_FEATURE_DESCRIPTOR (0x002a)
    IRP information: 0x00, Direction: FDO -> PDO
    URB bus id: 3
    Device address: 28
    Endpoint: 0x00, Direction: OUT
    URB transfer type: Unknown (0xff)
    Packet Data Length: 0
    [Response in: 12]

No.     Time           Source                Destination           Protocol Length Info
     12 0.046809       3.28.0                host                  USB      44     GET STATUS Response

Frame 12: 44 bytes on wire (352 bits), 44 bytes captured (352 bits) on interface \\.\USBPcap3, id 0
USB URB
    [Source: 3.28.0]
    [Destination: host]
    USBPcap pseudoheader length: 28
    IRP ID: 0xffffa387c7008ab0
    IRP USBD_STATUS: USBD_STATUS_SUCCESS (0x00000000)
    URB Function: URB_FUNCTION_CONTROL_TRANSFER (0x0008)
    IRP information: 0x01, Direction: PDO -> FDO
    URB bus id: 3
    Device address: 28
    Endpoint: 0x80, Direction: IN
    URB transfer type: URB_CONTROL (0x02)
    Packet Data Length: 16
    [Request in: 11]
    [Time from request: 0.002104000 seconds]
    Control transfer stage: Complete (3)
wStatus: 0x0050
Leftover Capture Data: 0000000104000300000000000000

No.     Time           Source                Destination           Protocol Length Info
     13 0.047683       host                  3.28.0                USB      36     GET DESCRIPTOR Request STRING

Frame 13: 36 bytes on wire (288 bits), 36 bytes captured (288 bits) on interface \\.\USBPcap3, id 0
USB URB
    [Source: host]
    [Destination: 3.28.0]
    USBPcap pseudoheader length: 28
    IRP ID: 0xffffa387a15c4ae0
    IRP USBD_STATUS: USBD_STATUS_SUCCESS (0x00000000)
    URB Function: URB_FUNCTION_GET_DESCRIPTOR_FROM_DEVICE (0x000b)
    IRP information: 0x00, Direction: FDO -> PDO
    URB bus id: 3
    Device address: 28
    Endpoint: 0x80, Direction: IN
    URB transfer type: URB_CONTROL (0x02)
    Packet Data Length: 8
    [Response in: 14]
    Control transfer stage: Setup (0)
Setup Data

No.     Time           Source                Destination           Protocol Length Info
     14 0.049804       3.28.0                host                  USB      32     GET DESCRIPTOR Response STRING

Frame 14: 32 bytes on wire (256 bits), 32 bytes captured (256 bits) on interface \\.\USBPcap3, id 0
USB URB
    [Source: 3.28.0]
    [Destination: host]
    USBPcap pseudoheader length: 28
    IRP ID: 0xffffa387a15c4ae0
    IRP USBD_STATUS: USBD_STATUS_SUCCESS (0x00000000)
    URB Function: URB_FUNCTION_CONTROL_TRANSFER (0x0008)
    IRP information: 0x01, Direction: PDO -> FDO
    URB bus id: 3
    Device address: 28
    Endpoint: 0x80, Direction: IN
    URB transfer type: URB_CONTROL (0x02)
    Packet Data Length: 4
    [Request in: 13]
    [Time from request: 0.002121000 seconds]
    Control transfer stage: Complete (3)
STRING DESCRIPTOR
    bLength: 44
    bDescriptorType: 0x03 (STRING)
    bString: Y

No.     Time           Source                Destination           Protocol Length Info
     15 0.049827       host                  3.28.0                USB      36     GET DESCRIPTOR Request STRING

Frame 15: 36 bytes on wire (288 bits), 36 bytes captured (288 bits) on interface \\.\USBPcap3, id 0
USB URB
    [Source: host]
    [Destination: 3.28.0]
    USBPcap pseudoheader length: 28
    IRP ID: 0xffffa387ad830ae0
    IRP USBD_STATUS: USBD_STATUS_SUCCESS (0x00000000)
    URB Function: URB_FUNCTION_GET_DESCRIPTOR_FROM_DEVICE (0x000b)
    IRP information: 0x00, Direction: FDO -> PDO
    URB bus id: 3
    Device address: 28
    Endpoint: 0x80, Direction: IN
    URB transfer type: URB_CONTROL (0x02)
    Packet Data Length: 8
    [Response in: 16]
    Control transfer stage: Setup (0)
Setup Data

No.     Time           Source                Destination           Protocol Length Info
     16 0.052808       3.28.0                host                  USB      72     GET DESCRIPTOR Response STRING

Frame 16: 72 bytes on wire (576 bits), 72 bytes captured (576 bits) on interface \\.\USBPcap3, id 0
USB URB
    [Source: 3.28.0]
    [Destination: host]
    USBPcap pseudoheader length: 28
    IRP ID: 0xffffa387ad830ae0
    IRP USBD_STATUS: USBD_STATUS_SUCCESS (0x00000000)
    URB Function: URB_FUNCTION_CONTROL_TRANSFER (0x0008)
    IRP information: 0x01, Direction: PDO -> FDO
    URB bus id: 3
    Device address: 28
    Endpoint: 0x80, Direction: IN
    URB transfer type: URB_CONTROL (0x02)
    Packet Data Length: 44
    [Request in: 15]
    [Time from request: 0.002981000 seconds]
    Control transfer stage: Complete (3)
STRING DESCRIPTOR
    bLength: 44
    bDescriptorType: 0x03 (STRING)
    bString: YubiKey OTP+FIDO+CCID

No.     Time           Source                Destination           Protocol Length Info
     17 0.053897       host                  3.28.0                USB      36     GET DESCRIPTOR Request STRING

Frame 17: 36 bytes on wire (288 bits), 36 bytes captured (288 bits) on interface \\.\USBPcap3, id 0
USB URB
    [Source: host]
    [Destination: 3.28.0]
    USBPcap pseudoheader length: 28
    IRP ID: 0xffffa387b008dae0
    IRP USBD_STATUS: USBD_STATUS_SUCCESS (0x00000000)
    URB Function: URB_FUNCTION_GET_DESCRIPTOR_FROM_DEVICE (0x000b)
    IRP information: 0x00, Direction: FDO -> PDO
    URB bus id: 3
    Device address: 28
    Endpoint: 0x80, Direction: IN
    URB transfer type: URB_CONTROL (0x02)
    Packet Data Length: 8
    [Response in: 18]
    Control transfer stage: Setup (0)
Setup Data

No.     Time           Source                Destination           Protocol Length Info
     18 0.056803       3.28.0                host                  USB      32     GET DESCRIPTOR Response STRING

Frame 18: 32 bytes on wire (256 bits), 32 bytes captured (256 bits) on interface \\.\USBPcap3, id 0
USB URB
    [Source: 3.28.0]
    [Destination: host]
    USBPcap pseudoheader length: 28
    IRP ID: 0xffffa387b008dae0
    IRP USBD_STATUS: USBD_STATUS_SUCCESS (0x00000000)
    URB Function: URB_FUNCTION_CONTROL_TRANSFER (0x0008)
    IRP information: 0x01, Direction: PDO -> FDO
    URB bus id: 3
    Device address: 28
    Endpoint: 0x80, Direction: IN
    URB transfer type: URB_CONTROL (0x02)
    Packet Data Length: 4
    [Request in: 17]
    [Time from request: 0.002906000 seconds]
    Control transfer stage: Complete (3)
STRING DESCRIPTOR
    bLength: 44
    bDescriptorType: 0x03 (STRING)
    bString: Y

No.     Time           Source                Destination           Protocol Length Info
     19 0.056822       host                  3.28.0                USB      36     GET DESCRIPTOR Request STRING

Frame 19: 36 bytes on wire (288 bits), 36 bytes captured (288 bits) on interface \\.\USBPcap3, id 0
USB URB
    [Source: host]
    [Destination: 3.28.0]
    USBPcap pseudoheader length: 28
    IRP ID: 0xffffa387aeca5010
    IRP USBD_STATUS: USBD_STATUS_SUCCESS (0x00000000)
    URB Function: URB_FUNCTION_GET_DESCRIPTOR_FROM_DEVICE (0x000b)
    IRP information: 0x00, Direction: FDO -> PDO
    URB bus id: 3
    Device address: 28
    Endpoint: 0x80, Direction: IN
    URB transfer type: URB_CONTROL (0x02)
    Packet Data Length: 8
    [Response in: 20]
    Control transfer stage: Setup (0)
Setup Data

No.     Time           Source                Destination           Protocol Length Info
     20 0.059866       3.28.0                host                  USB      72     GET DESCRIPTOR Response STRING

Frame 20: 72 bytes on wire (576 bits), 72 bytes captured (576 bits) on interface \\.\USBPcap3, id 0
USB URB
    [Source: 3.28.0]
    [Destination: host]
    USBPcap pseudoheader length: 28
    IRP ID: 0xffffa387aeca5010
    IRP USBD_STATUS: USBD_STATUS_SUCCESS (0x00000000)
    URB Function: URB_FUNCTION_CONTROL_TRANSFER (0x0008)
    IRP information: 0x01, Direction: PDO -> FDO
    URB bus id: 3
    Device address: 28
    Endpoint: 0x80, Direction: IN
    URB transfer type: URB_CONTROL (0x02)
    Packet Data Length: 44
    [Request in: 19]
    [Time from request: 0.003044000 seconds]
    Control transfer stage: Complete (3)
STRING DESCRIPTOR
    bLength: 44
    bDescriptorType: 0x03 (STRING)
    bString: YubiKey OTP+FIDO+CCID

No.     Time           Source                Destination           Protocol Length Info
     21 0.060962       host                  3.28.0                USB      36     GET DESCRIPTOR Request STRING

Frame 21: 36 bytes on wire (288 bits), 36 bytes captured (288 bits) on interface \\.\USBPcap3, id 0
USB URB
    [Source: host]
    [Destination: 3.28.0]
    USBPcap pseudoheader length: 28
    IRP ID: 0xffffa387b25edae0
    IRP USBD_STATUS: USBD_STATUS_SUCCESS (0x00000000)
    URB Function: URB_FUNCTION_GET_DESCRIPTOR_FROM_DEVICE (0x000b)
    IRP information: 0x00, Direction: FDO -> PDO
    URB bus id: 3
    Device address: 28
    Endpoint: 0x80, Direction: IN
    URB transfer type: URB_CONTROL (0x02)
    Packet Data Length: 8
    [Response in: 22]
    Control transfer stage: Setup (0)
Setup Data

No.     Time           Source                Destination           Protocol Length Info
     22 0.063803       3.28.0                host                  USB      32     GET DESCRIPTOR Response STRING

Frame 22: 32 bytes on wire (256 bits), 32 bytes captured (256 bits) on interface \\.\USBPcap3, id 0
USB URB
    [Source: 3.28.0]
    [Destination: host]
    USBPcap pseudoheader length: 28
    IRP ID: 0xffffa387b25edae0
    IRP USBD_STATUS: USBD_STATUS_SUCCESS (0x00000000)
    URB Function: URB_FUNCTION_CONTROL_TRANSFER (0x0008)
    IRP information: 0x01, Direction: PDO -> FDO
    URB bus id: 3
    Device address: 28
    Endpoint: 0x80, Direction: IN
    URB transfer type: URB_CONTROL (0x02)
    Packet Data Length: 4
    [Request in: 21]
    [Time from request: 0.002841000 seconds]
    Control transfer stage: Complete (3)
STRING DESCRIPTOR
    bLength: 44
    bDescriptorType: 0x03 (STRING)
    bString: Y

No.     Time           Source                Destination           Protocol Length Info
     23 0.063822       host                  3.28.0                USB      36     GET DESCRIPTOR Request STRING

Frame 23: 36 bytes on wire (288 bits), 36 bytes captured (288 bits) on interface \\.\USBPcap3, id 0
USB URB
    [Source: host]
    [Destination: 3.28.0]
    USBPcap pseudoheader length: 28
    IRP ID: 0xffffa387ad830ae0
    IRP USBD_STATUS: USBD_STATUS_SUCCESS (0x00000000)
    URB Function: URB_FUNCTION_GET_DESCRIPTOR_FROM_DEVICE (0x000b)
    IRP information: 0x00, Direction: FDO -> PDO
    URB bus id: 3
    Device address: 28
    Endpoint: 0x80, Direction: IN
    URB transfer type: URB_CONTROL (0x02)
    Packet Data Length: 8
    [Response in: 24]
    Control transfer stage: Setup (0)
Setup Data

No.     Time           Source                Destination           Protocol Length Info
     24 0.066803       3.28.0                host                  USB      72     GET DESCRIPTOR Response STRING

Frame 24: 72 bytes on wire (576 bits), 72 bytes captured (576 bits) on interface \\.\USBPcap3, id 0
USB URB
    [Source: 3.28.0]
    [Destination: host]
    USBPcap pseudoheader length: 28
    IRP ID: 0xffffa387ad830ae0
    IRP USBD_STATUS: USBD_STATUS_SUCCESS (0x00000000)
    URB Function: URB_FUNCTION_CONTROL_TRANSFER (0x0008)
    IRP information: 0x01, Direction: PDO -> FDO
    URB bus id: 3
    Device address: 28
    Endpoint: 0x80, Direction: IN
    URB transfer type: URB_CONTROL (0x02)
    Packet Data Length: 44
    [Request in: 23]
    [Time from request: 0.002981000 seconds]
    Control transfer stage: Complete (3)
STRING DESCRIPTOR
    bLength: 44
    bDescriptorType: 0x03 (STRING)
    bString: YubiKey OTP+FIDO+CCID

No.     Time           Source                Destination           Protocol Length Info
     25 0.119810       host                  3.28.0                USBHID   36     SET_IDLE Request

Frame 25: 36 bytes on wire (288 bits), 36 bytes captured (288 bits) on interface \\.\USBPcap3, id 0
USB URB
    [Source: host]
    [Destination: 3.28.0]
    USBPcap pseudoheader length: 28
    IRP ID: 0xffffa387b03bd010
    IRP USBD_STATUS: USBD_STATUS_SUCCESS (0x00000000)
    URB Function: URB_FUNCTION_CLASS_INTERFACE (0x001b)
    IRP information: 0x00, Direction: FDO -> PDO
    URB bus id: 3
    Device address: 28
    Endpoint: 0x00, Direction: OUT
    URB transfer type: URB_CONTROL (0x02)
    Packet Data Length: 8
    [Response in: 26]
    Control transfer stage: Setup (0)
    [bInterfaceClass: HID (0x03)]
Setup Data

No.     Time           Source                Destination           Protocol Length Info
     26 0.120803       3.28.0                host                  USBHID   28     SET_IDLE Response

Frame 26: 28 bytes on wire (224 bits), 28 bytes captured (224 bits) on interface \\.\USBPcap3, id 0
USB URB
    [Source: 3.28.0]
    [Destination: host]
    USBPcap pseudoheader length: 28
    IRP ID: 0xffffa387b03bd010
    IRP USBD_STATUS: USBD_STATUS_SUCCESS (0x00000000)
    URB Function: URB_FUNCTION_CONTROL_TRANSFER (0x0008)
    IRP information: 0x01, Direction: PDO -> FDO
    URB bus id: 3
    Device address: 28
    Endpoint: 0x00, Direction: OUT
    URB transfer type: URB_CONTROL (0x02)
    Packet Data Length: 0
    [Request in: 25]
    [Time from request: 0.000993000 seconds]
    Control transfer stage: Complete (3)
    [bInterfaceClass: HID (0x03)]

No.     Time           Source                Destination           Protocol Length Info
     27 0.120864       host                  3.28.0                USBHID   36     GET DESCRIPTOR Request HID Report

Frame 27: 36 bytes on wire (288 bits), 36 bytes captured (288 bits) on interface \\.\USBPcap3, id 0
USB URB
    [Source: host]
    [Destination: 3.28.0]
    USBPcap pseudoheader length: 28
    IRP ID: 0xffffa387ae3e47c0
    IRP USBD_STATUS: USBD_STATUS_SUCCESS (0x00000000)
    URB Function: URB_FUNCTION_GET_DESCRIPTOR_FROM_INTERFACE (0x0028)
    IRP information: 0x00, Direction: FDO -> PDO
    URB bus id: 3
    Device address: 28
    Endpoint: 0x80, Direction: IN
    URB transfer type: URB_CONTROL (0x02)
    Packet Data Length: 8
    [Response in: 28]
    Control transfer stage: Setup (0)
    [bInterfaceClass: HID (0x03)]
Setup Data

No.     Time           Source                Destination           Protocol Length Info
     28 0.124810       3.28.0                host                  USBHID   99     GET DESCRIPTOR Response HID Report

Frame 28: 99 bytes on wire (792 bits), 99 bytes captured (792 bits) on interface \\.\USBPcap3, id 0
USB URB
    [Source: 3.28.0]
    [Destination: host]
    USBPcap pseudoheader length: 28
    IRP ID: 0xffffa387ae3e47c0
    IRP USBD_STATUS: USBD_STATUS_SUCCESS (0x00000000)
    URB Function: URB_FUNCTION_CONTROL_TRANSFER (0x0008)
    IRP information: 0x01, Direction: PDO -> FDO
    URB bus id: 3
    Device address: 28
    Endpoint: 0x80, Direction: IN
    URB transfer type: URB_CONTROL (0x02)
    Packet Data Length: 71
    [Request in: 27]
    [Time from request: 0.003946000 seconds]
    Control transfer stage: Complete (3)
    [bInterfaceClass: HID (0x03)]
HID Report

No.     Time           Source                Destination           Protocol Length Info
     29 0.125674       host                  3.28.1                USB      27     URB_INTERRUPT in

Frame 29: 27 bytes on wire (216 bits), 27 bytes captured (216 bits) on interface \\.\USBPcap3, id 0
USB URB
    [Source: host]
    [Destination: 3.28.1]
    USBPcap pseudoheader length: 27
    IRP ID: 0xffffa387af750a20
    IRP USBD_STATUS: USBD_STATUS_SUCCESS (0x00000000)
    URB Function: URB_FUNCTION_BULK_OR_INTERRUPT_TRANSFER (0x0009)
    IRP information: 0x00, Direction: FDO -> PDO
    URB bus id: 3
    Device address: 28
    Endpoint: 0x81, Direction: IN
    URB transfer type: URB_INTERRUPT (0x01)
    Packet Data Length: 0
    [bInterfaceClass: HID (0x03)]

No.     Time           Source                Destination           Protocol Length Info
     30 0.125694       host                  3.28.1                USB      27     URB_INTERRUPT in

Frame 30: 27 bytes on wire (216 bits), 27 bytes captured (216 bits) on interface \\.\USBPcap3, id 0
USB URB
    [Source: host]
    [Destination: 3.28.1]
    USBPcap pseudoheader length: 27
    IRP ID: 0xffffa387b30cfa20
    IRP USBD_STATUS: USBD_STATUS_SUCCESS (0x00000000)
    URB Function: URB_FUNCTION_BULK_OR_INTERRUPT_TRANSFER (0x0009)
    IRP information: 0x00, Direction: FDO -> PDO
    URB bus id: 3
    Device address: 28
    Endpoint: 0x81, Direction: IN
    URB transfer type: URB_INTERRUPT (0x01)
    Packet Data Length: 0
    [bInterfaceClass: HID (0x03)]

No.     Time           Source                Destination           Protocol Length Info
     31 0.126886       host                  3.28.0                USBHID   36     SET_IDLE Request

Frame 31: 36 bytes on wire (288 bits), 36 bytes captured (288 bits) on interface \\.\USBPcap3, id 0
USB URB
    [Source: host]
    [Destination: 3.28.0]
    USBPcap pseudoheader length: 28
    IRP ID: 0xffffa387ad872560
    IRP USBD_STATUS: USBD_STATUS_SUCCESS (0x00000000)
    URB Function: URB_FUNCTION_CLASS_INTERFACE (0x001b)
    IRP information: 0x00, Direction: FDO -> PDO
    URB bus id: 3
    Device address: 28
    Endpoint: 0x00, Direction: OUT
    URB transfer type: URB_CONTROL (0x02)
    Packet Data Length: 8
    [Response in: 32]
    Control transfer stage: Setup (0)
    [bInterfaceClass: HID (0x03)]
Setup Data

No.     Time           Source                Destination           Protocol Length Info
     32 0.127805       3.28.0                host                  USBHID   28     SET_IDLE Response

Frame 32: 28 bytes on wire (224 bits), 28 bytes captured (224 bits) on interface \\.\USBPcap3, id 0
USB URB
    [Source: 3.28.0]
    [Destination: host]
    USBPcap pseudoheader length: 28
    IRP ID: 0xffffa387ad872560
    IRP USBD_STATUS: USBD_STATUS_SUCCESS (0x00000000)
    URB Function: URB_FUNCTION_CONTROL_TRANSFER (0x0008)
    IRP information: 0x01, Direction: PDO -> FDO
    URB bus id: 3
    Device address: 28
    Endpoint: 0x00, Direction: OUT
    URB transfer type: URB_CONTROL (0x02)
    Packet Data Length: 0
    [Request in: 31]
    [Time from request: 0.000919000 seconds]
    Control transfer stage: Complete (3)
    [bInterfaceClass: HID (0x03)]

No.     Time           Source                Destination           Protocol Length Info
     33 0.127894       host                  3.28.0                USBHID   36     GET DESCRIPTOR Request HID Report

Frame 33: 36 bytes on wire (288 bits), 36 bytes captured (288 bits) on interface \\.\USBPcap3, id 0
USB URB
    [Source: host]
    [Destination: 3.28.0]
    USBPcap pseudoheader length: 28
    IRP ID: 0xffffa387b03bd010
    IRP USBD_STATUS: USBD_STATUS_SUCCESS (0x00000000)
    URB Function: URB_FUNCTION_GET_DESCRIPTOR_FROM_INTERFACE (0x0028)
    IRP information: 0x00, Direction: FDO -> PDO
    URB bus id: 3
    Device address: 28
    Endpoint: 0x80, Direction: IN
    URB transfer type: URB_CONTROL (0x02)
    Packet Data Length: 8
    [Response in: 34]
    Control transfer stage: Setup (0)
    [bInterfaceClass: HID (0x03)]
Setup Data

No.     Time           Source                Destination           Protocol Length Info
     34 0.130807       3.28.0                host                  USBHID   62     GET DESCRIPTOR Response HID Report

Frame 34: 62 bytes on wire (496 bits), 62 bytes captured (496 bits) on interface \\.\USBPcap3, id 0
USB URB
    [Source: 3.28.0]
    [Destination: host]
    USBPcap pseudoheader length: 28
    IRP ID: 0xffffa387b03bd010
    IRP USBD_STATUS: USBD_STATUS_SUCCESS (0x00000000)
    URB Function: URB_FUNCTION_CONTROL_TRANSFER (0x0008)
    IRP information: 0x01, Direction: PDO -> FDO
    URB bus id: 3
    Device address: 28
    Endpoint: 0x80, Direction: IN
    URB transfer type: URB_CONTROL (0x02)
    Packet Data Length: 34
    [Request in: 33]
    [Time from request: 0.002913000 seconds]
    Control transfer stage: Complete (3)
    [bInterfaceClass: HID (0x03)]
HID Report

No.     Time           Source                Destination           Protocol Length Info
     35 0.131690       host                  3.28.4                USB      27     URB_INTERRUPT in

Frame 35: 27 bytes on wire (216 bits), 27 bytes captured (216 bits) on interface \\.\USBPcap3, id 0
USB URB
    [Source: host]
    [Destination: 3.28.4]
    USBPcap pseudoheader length: 27
    IRP ID: 0xffffa387af6daa20
    IRP USBD_STATUS: USBD_STATUS_SUCCESS (0x00000000)
    URB Function: URB_FUNCTION_BULK_OR_INTERRUPT_TRANSFER (0x0009)
    IRP information: 0x00, Direction: FDO -> PDO
    URB bus id: 3
    Device address: 28
    Endpoint: 0x84, Direction: IN
    URB transfer type: URB_INTERRUPT (0x01)
    Packet Data Length: 0
    [Response in: 163]
    [bInterfaceClass: HID (0x03)]

No.     Time           Source                Destination           Protocol Length Info
     36 0.131707       host                  3.28.4                USB      27     URB_INTERRUPT in

Frame 36: 27 bytes on wire (216 bits), 27 bytes captured (216 bits) on interface \\.\USBPcap3, id 0
USB URB
    [Source: host]
    [Destination: 3.28.4]
    USBPcap pseudoheader length: 27
    IRP ID: 0xffffa387afb5ca20
    IRP USBD_STATUS: USBD_STATUS_SUCCESS (0x00000000)
    URB Function: URB_FUNCTION_BULK_OR_INTERRUPT_TRANSFER (0x0009)
    IRP information: 0x00, Direction: FDO -> PDO
    URB bus id: 3
    Device address: 28
    Endpoint: 0x84, Direction: IN
    URB transfer type: URB_INTERRUPT (0x01)
    Packet Data Length: 0
    [Response in: 167]
    [bInterfaceClass: HID (0x03)]

No.     Time           Source                Destination           Protocol Length Info
     37 0.132819       host                  3.28.0                USB      36     GET STATUS Request

Frame 37: 36 bytes on wire (288 bits), 36 bytes captured (288 bits) on interface \\.\USBPcap3, id 0
USB URB
    [Source: host]
    [Destination: 3.28.0]
    USBPcap pseudoheader length: 28
    IRP ID: 0xffffa387c0a2d8a0
    IRP USBD_STATUS: USBD_STATUS_SUCCESS (0x00000000)
    URB Function: URB_FUNCTION_GET_STATUS_FROM_DEVICE (0x0013)
    IRP information: 0x00, Direction: FDO -> PDO
    URB bus id: 3
    Device address: 28
    Endpoint: 0x80, Direction: IN
    URB transfer type: URB_CONTROL (0x02)
    Packet Data Length: 8
    [Response in: 38]
    Control transfer stage: Setup (0)
Setup Data

No.     Time           Source                Destination           Protocol Length Info
     38 0.134805       3.28.0                host                  USB      30     GET STATUS Response

Frame 38: 30 bytes on wire (240 bits), 30 bytes captured (240 bits) on interface \\.\USBPcap3, id 0
USB URB
    [Source: 3.28.0]
    [Destination: host]
    USBPcap pseudoheader length: 28
    IRP ID: 0xffffa387c0a2d8a0
    IRP USBD_STATUS: USBD_STATUS_SUCCESS (0x00000000)
    URB Function: URB_FUNCTION_CONTROL_TRANSFER (0x0008)
    IRP information: 0x01, Direction: PDO -> FDO
    URB bus id: 3
    Device address: 28
    Endpoint: 0x80, Direction: IN
    URB transfer type: URB_CONTROL (0x02)
    Packet Data Length: 2
    [Request in: 37]
    [Time from request: 0.001986000 seconds]
    Control transfer stage: Complete (3)
wStatus: 0x0000

No.     Time           Source                Destination           Protocol Length Info
     39 0.135366       host                  3.28.0                USB      36     GET DESCRIPTOR Request STRING

Frame 39: 36 bytes on wire (288 bits), 36 bytes captured (288 bits) on interface \\.\USBPcap3, id 0
USB URB
    [Source: host]
    [Destination: 3.28.0]
    USBPcap pseudoheader length: 28
    IRP ID: 0xffffa387c7442620
    IRP USBD_STATUS: USBD_STATUS_SUCCESS (0x00000000)
    URB Function: URB_FUNCTION_GET_DESCRIPTOR_FROM_DEVICE (0x000b)
    IRP information: 0x00, Direction: FDO -> PDO
    URB bus id: 3
    Device address: 28
    Endpoint: 0x80, Direction: IN
    URB transfer type: URB_CONTROL (0x02)
    Packet Data Length: 8
    [Response in: 40]
    Control transfer stage: Setup (0)
Setup Data

No.     Time           Source                Destination           Protocol Length Info
     40 0.137810       3.28.0                host                  USB      32     GET DESCRIPTOR Response STRING

Frame 40: 32 bytes on wire (256 bits), 32 bytes captured (256 bits) on interface \\.\USBPcap3, id 0
USB URB
    [Source: 3.28.0]
    [Destination: host]
    USBPcap pseudoheader length: 28
    IRP ID: 0xffffa387c7442620
    IRP USBD_STATUS: USBD_STATUS_SUCCESS (0x00000000)
    URB Function: URB_FUNCTION_CONTROL_TRANSFER (0x0008)
    IRP information: 0x01, Direction: PDO -> FDO
    URB bus id: 3
    Device address: 28
    Endpoint: 0x80, Direction: IN
    URB transfer type: URB_CONTROL (0x02)
    Packet Data Length: 4
    [Request in: 39]
    [Time from request: 0.002444000 seconds]
    Control transfer stage: Complete (3)
STRING DESCRIPTOR
    bLength: 14
    bDescriptorType: 0x03 (STRING)
    bString: Y

No.     Time           Source                Destination           Protocol Length Info
     41 0.137865       host                  3.28.0                USB      36     GET DESCRIPTOR Request STRING

Frame 41: 36 bytes on wire (288 bits), 36 bytes captured (288 bits) on interface \\.\USBPcap3, id 0
USB URB
    [Source: host]
    [Destination: 3.28.0]
    USBPcap pseudoheader length: 28
    IRP ID: 0xffffa387c7443620
    IRP USBD_STATUS: USBD_STATUS_SUCCESS (0x00000000)
    URB Function: URB_FUNCTION_GET_DESCRIPTOR_FROM_DEVICE (0x000b)
    IRP information: 0x00, Direction: FDO -> PDO
    URB bus id: 3
    Device address: 28
    Endpoint: 0x80, Direction: IN
    URB transfer type: URB_CONTROL (0x02)
    Packet Data Length: 8
    [Response in: 42]
    Control transfer stage: Setup (0)
Setup Data

No.     Time           Source                Destination           Protocol Length Info
     42 0.140806       3.28.0                host                  USB      42     GET DESCRIPTOR Response STRING

Frame 42: 42 bytes on wire (336 bits), 42 bytes captured (336 bits) on interface \\.\USBPcap3, id 0
USB URB
    [Source: 3.28.0]
    [Destination: host]
    USBPcap pseudoheader length: 28
    IRP ID: 0xffffa387c7443620
    IRP USBD_STATUS: USBD_STATUS_SUCCESS (0x00000000)
    URB Function: URB_FUNCTION_CONTROL_TRANSFER (0x0008)
    IRP information: 0x01, Direction: PDO -> FDO
    URB bus id: 3
    Device address: 28
    Endpoint: 0x80, Direction: IN
    URB transfer type: URB_CONTROL (0x02)
    Packet Data Length: 14
    [Request in: 41]
    [Time from request: 0.002941000 seconds]
    Control transfer stage: Complete (3)
STRING DESCRIPTOR
    bLength: 14
    bDescriptorType: 0x03 (STRING)
    bString: Yubico

No.     Time           Source                Destination           Protocol Length Info
     43 0.140866       host                  3.28.0                USB      36     GET DESCRIPTOR Request STRING

Frame 43: 36 bytes on wire (288 bits), 36 bytes captured (288 bits) on interface \\.\USBPcap3, id 0
USB URB
    [Source: host]
    [Destination: 3.28.0]
    USBPcap pseudoheader length: 28
    IRP ID: 0xffffa387c7444620
    IRP USBD_STATUS: USBD_STATUS_SUCCESS (0x00000000)
    URB Function: URB_FUNCTION_GET_DESCRIPTOR_FROM_DEVICE (0x000b)
    IRP information: 0x00, Direction: FDO -> PDO
    URB bus id: 3
    Device address: 28
    Endpoint: 0x80, Direction: IN
    URB transfer type: URB_CONTROL (0x02)
    Packet Data Length: 8
    [Response in: 44]
    Control transfer stage: Setup (0)
Setup Data

No.     Time           Source                Destination           Protocol Length Info
     44 0.143812       3.28.0                host                  USB      32     GET DESCRIPTOR Response STRING

Frame 44: 32 bytes on wire (256 bits), 32 bytes captured (256 bits) on interface \\.\USBPcap3, id 0
USB URB
    [Source: 3.28.0]
    [Destination: host]
    USBPcap pseudoheader length: 28
    IRP ID: 0xffffa387c7444620
    IRP USBD_STATUS: USBD_STATUS_SUCCESS (0x00000000)
    URB Function: URB_FUNCTION_CONTROL_TRANSFER (0x0008)
    IRP information: 0x01, Direction: PDO -> FDO
    URB bus id: 3
    Device address: 28
    Endpoint: 0x80, Direction: IN
    URB transfer type: URB_CONTROL (0x02)
    Packet Data Length: 4
    [Request in: 43]
    [Time from request: 0.002946000 seconds]
    Control transfer stage: Complete (3)
STRING DESCRIPTOR
    bLength: 44
    bDescriptorType: 0x03 (STRING)
    bString: Y

No.     Time           Source                Destination           Protocol Length Info
     45 0.143870       host                  3.28.0                USB      36     GET DESCRIPTOR Request STRING

Frame 45: 36 bytes on wire (288 bits), 36 bytes captured (288 bits) on interface \\.\USBPcap3, id 0
USB URB
    [Source: host]
    [Destination: 3.28.0]
    USBPcap pseudoheader length: 28
    IRP ID: 0xffffa387c74a8660
    IRP USBD_STATUS: USBD_STATUS_SUCCESS (0x00000000)
    URB Function: URB_FUNCTION_GET_DESCRIPTOR_FROM_DEVICE (0x000b)
    IRP information: 0x00, Direction: FDO -> PDO
    URB bus id: 3
    Device address: 28
    Endpoint: 0x80, Direction: IN
    URB transfer type: URB_CONTROL (0x02)
    Packet Data Length: 8
    [Response in: 46]
    Control transfer stage: Setup (0)
Setup Data

No.     Time           Source                Destination           Protocol Length Info
     46 0.146804       3.28.0                host                  USB      72     GET DESCRIPTOR Response STRING

Frame 46: 72 bytes on wire (576 bits), 72 bytes captured (576 bits) on interface \\.\USBPcap3, id 0
USB URB
    [Source: 3.28.0]
    [Destination: host]
    USBPcap pseudoheader length: 28
    IRP ID: 0xffffa387c74a8660
    IRP USBD_STATUS: USBD_STATUS_SUCCESS (0x00000000)
    URB Function: URB_FUNCTION_CONTROL_TRANSFER (0x0008)
    IRP information: 0x01, Direction: PDO -> FDO
    URB bus id: 3
    Device address: 28
    Endpoint: 0x80, Direction: IN
    URB transfer type: URB_CONTROL (0x02)
    Packet Data Length: 44
    [Request in: 45]
    [Time from request: 0.002934000 seconds]
    Control transfer stage: Complete (3)
STRING DESCRIPTOR
    bLength: 44
    bDescriptorType: 0x03 (STRING)
    bString: YubiKey OTP+FIDO+CCID

No.     Time           Source                Destination           Protocol Length Info
     47 0.146855       host                  3.28.0                USB      36     GET DESCRIPTOR Request STRING

Frame 47: 36 bytes on wire (288 bits), 36 bytes captured (288 bits) on interface \\.\USBPcap3, id 0
USB URB
    [Source: host]
    [Destination: 3.28.0]
    USBPcap pseudoheader length: 28
    IRP ID: 0xffffa387c74a9620
    IRP USBD_STATUS: USBD_STATUS_SUCCESS (0x00000000)
    URB Function: URB_FUNCTION_GET_DESCRIPTOR_FROM_DEVICE (0x000b)
    IRP information: 0x00, Direction: FDO -> PDO
    URB bus id: 3
    Device address: 28
    Endpoint: 0x80, Direction: IN
    URB transfer type: URB_CONTROL (0x02)
    Packet Data Length: 8
    [Response in: 48]
    Control transfer stage: Setup (0)
Setup Data

No.     Time           Source                Destination           Protocol Length Info
     48 0.149817       3.28.0                host                  USB      32     GET DESCRIPTOR Response STRING

Frame 48: 32 bytes on wire (256 bits), 32 bytes captured (256 bits) on interface \\.\USBPcap3, id 0
USB URB
    [Source: 3.28.0]
    [Destination: host]
    USBPcap pseudoheader length: 28
    IRP ID: 0xffffa387c74a9620
    IRP USBD_STATUS: USBD_STATUS_SUCCESS (0x00000000)
    URB Function: URB_FUNCTION_CONTROL_TRANSFER (0x0008)
    IRP information: 0x01, Direction: PDO -> FDO
    URB bus id: 3
    Device address: 28
    Endpoint: 0x80, Direction: IN
    URB transfer type: URB_CONTROL (0x02)
    Packet Data Length: 4
    [Request in: 47]
    [Time from request: 0.002962000 seconds]
    Control transfer stage: Complete (3)
STRING DESCRIPTOR
    bLength: 4
    bDescriptorType: 0x03 (STRING)
    wLANGID: English (United States) (0x0409)

No.     Time           Source                Destination           Protocol Length Info
     49 0.149882       host                  3.28.0                USB      36     GET DESCRIPTOR Request STRING

Frame 49: 36 bytes on wire (288 bits), 36 bytes captured (288 bits) on interface \\.\USBPcap3, id 0
USB URB
    [Source: host]
    [Destination: 3.28.0]
    USBPcap pseudoheader length: 28
    IRP ID: 0xffffa387c5615870
    IRP USBD_STATUS: USBD_STATUS_SUCCESS (0x00000000)
    URB Function: URB_FUNCTION_GET_DESCRIPTOR_FROM_DEVICE (0x000b)
    IRP information: 0x00, Direction: FDO -> PDO
    URB bus id: 3
    Device address: 28
    Endpoint: 0x80, Direction: IN
    URB transfer type: URB_CONTROL (0x02)
    Packet Data Length: 8
    [Response in: 50]
    Control transfer stage: Setup (0)
Setup Data

No.     Time           Source                Destination           Protocol Length Info
     50 0.152804       3.28.0                host                  USB      32     GET DESCRIPTOR Response STRING

Frame 50: 32 bytes on wire (256 bits), 32 bytes captured (256 bits) on interface \\.\USBPcap3, id 0
USB URB
    [Source: 3.28.0]
    [Destination: host]
    USBPcap pseudoheader length: 28
    IRP ID: 0xffffa387c5615870
    IRP USBD_STATUS: USBD_STATUS_SUCCESS (0x00000000)
    URB Function: URB_FUNCTION_CONTROL_TRANSFER (0x0008)
    IRP information: 0x01, Direction: PDO -> FDO
    URB bus id: 3
    Device address: 28
    Endpoint: 0x80, Direction: IN
    URB transfer type: URB_CONTROL (0x02)
    Packet Data Length: 4
    [Request in: 49]
    [Time from request: 0.002922000 seconds]
    Control transfer stage: Complete (3)
STRING DESCRIPTOR
    bLength: 4
    bDescriptorType: 0x03 (STRING)
    wLANGID: English (United States) (0x0409)

No.     Time           Source                Destination           Protocol Length Info
     51 0.154006       host                  3.28.3                USB      27     URB_INTERRUPT in

Frame 51: 27 bytes on wire (216 bits), 27 bytes captured (216 bits) on interface \\.\USBPcap3, id 0
USB URB
    [Source: host]
    [Destination: 3.28.3]
    USBPcap pseudoheader length: 27
    IRP ID: 0xffffa387c743f620
    IRP USBD_STATUS: USBD_STATUS_SUCCESS (0x00000000)
    URB Function: URB_FUNCTION_BULK_OR_INTERRUPT_TRANSFER (0x0009)
    IRP information: 0x00, Direction: FDO -> PDO
    URB bus id: 3
    Device address: 28
    Endpoint: 0x83, Direction: IN
    URB transfer type: URB_INTERRUPT (0x01)
    Packet Data Length: 0
    [Response in: 64]
    [bInterfaceClass: Smart Card (0x0b)]

No.     Time           Source                Destination           Protocol Length Info
     52 0.154044       host                  3.28.2                USBCCID  37     CCID Packet - PC to Reader: Get Slot Status

Frame 52: 37 bytes on wire (296 bits), 37 bytes captured (296 bits) on interface \\.\USBPcap3, id 0
USB URB
    [Source: host]
    [Destination: 3.28.2]
    USBPcap pseudoheader length: 27
    IRP ID: 0xffffa387c743f010
    IRP USBD_STATUS: USBD_STATUS_SUCCESS (0x00000000)
    URB Function: URB_FUNCTION_BULK_OR_INTERRUPT_TRANSFER (0x0009)
    IRP information: 0x00, Direction: FDO -> PDO
    URB bus id: 3
    Device address: 28
    Endpoint: 0x02, Direction: OUT
    URB transfer type: URB_BULK (0x03)
    Packet Data Length: 10
    [Response in: 53]
    [bInterfaceClass: Smart Card (0x0b)]
USB CCID

No.     Time           Source                Destination           Protocol Length Info
     53 0.154113       3.28.2                host                  USB      27     URB_BULK out

Frame 53: 27 bytes on wire (216 bits), 27 bytes captured (216 bits) on interface \\.\USBPcap3, id 0
USB URB
    [Source: 3.28.2]
    [Destination: host]
    USBPcap pseudoheader length: 27
    IRP ID: 0xffffa387c743f010
    IRP USBD_STATUS: USBD_STATUS_SUCCESS (0x00000000)
    URB Function: URB_FUNCTION_BULK_OR_INTERRUPT_TRANSFER (0x0009)
    IRP information: 0x01, Direction: PDO -> FDO
    URB bus id: 3
    Device address: 28
    Endpoint: 0x02, Direction: OUT
    URB transfer type: URB_BULK (0x03)
    Packet Data Length: 0
    [Request in: 52]
    [Time from request: 0.000069000 seconds]
    [bInterfaceClass: Smart Card (0x0b)]

No.     Time           Source                Destination           Protocol Length Info
     54 0.154204       host                  3.28.2                USB      27     URB_BULK in

Frame 54: 27 bytes on wire (216 bits), 27 bytes captured (216 bits) on interface \\.\USBPcap3, id 0
USB URB
    [Source: host]
    [Destination: 3.28.2]
    USBPcap pseudoheader length: 27
    IRP ID: 0xffffa387c72a6720
    IRP USBD_STATUS: USBD_STATUS_SUCCESS (0x00000000)
    URB Function: URB_FUNCTION_BULK_OR_INTERRUPT_TRANSFER (0x0009)
    IRP information: 0x00, Direction: FDO -> PDO
    URB bus id: 3
    Device address: 28
    Endpoint: 0x82, Direction: IN
    URB transfer type: URB_BULK (0x03)
    Packet Data Length: 0
    [Response in: 55]
    [bInterfaceClass: Smart Card (0x0b)]

No.     Time           Source                Destination           Protocol Length Info
     55 0.154289       3.28.2                host                  USBCCID  37     CCID Packet - Reader to PC: Slot Status

Frame 55: 37 bytes on wire (296 bits), 37 bytes captured (296 bits) on interface \\.\USBPcap3, id 0
USB URB
    [Source: 3.28.2]
    [Destination: host]
    USBPcap pseudoheader length: 27
    IRP ID: 0xffffa387c72a6720
    IRP USBD_STATUS: USBD_STATUS_SUCCESS (0x00000000)
    URB Function: URB_FUNCTION_BULK_OR_INTERRUPT_TRANSFER (0x0009)
    IRP information: 0x01, Direction: PDO -> FDO
    URB bus id: 3
    Device address: 28
    Endpoint: 0x82, Direction: IN
    URB transfer type: URB_BULK (0x03)
    Packet Data Length: 10
    [Request in: 54]
    [Time from request: 0.000085000 seconds]
    [bInterfaceClass: Smart Card (0x0b)]
USB CCID

No.     Time           Source                Destination           Protocol Length Info
     56 0.160049       host                  3.28.0                USB      36     GET DESCRIPTOR Request STRING

Frame 56: 36 bytes on wire (288 bits), 36 bytes captured (288 bits) on interface \\.\USBPcap3, id 0
USB URB
    [Source: host]
    [Destination: 3.28.0]
    USBPcap pseudoheader length: 28
    IRP ID: 0xffffa387c743d010
    IRP USBD_STATUS: USBD_STATUS_SUCCESS (0x00000000)
    URB Function: URB_FUNCTION_GET_DESCRIPTOR_FROM_DEVICE (0x000b)
    IRP information: 0x00, Direction: FDO -> PDO
    URB bus id: 3
    Device address: 28
    Endpoint: 0x80, Direction: IN
    URB transfer type: URB_CONTROL (0x02)
    Packet Data Length: 8
    [Response in: 57]
    Control transfer stage: Setup (0)
Setup Data

No.     Time           Source                Destination           Protocol Length Info
     57 0.161811       3.28.0                host                  USB      72     GET DESCRIPTOR Response STRING

Frame 57: 72 bytes on wire (576 bits), 72 bytes captured (576 bits) on interface \\.\USBPcap3, id 0
USB URB
    [Source: 3.28.0]
    [Destination: host]
    USBPcap pseudoheader length: 28
    IRP ID: 0xffffa387c743d010
    IRP USBD_STATUS: USBD_STATUS_SUCCESS (0x00000000)
    URB Function: URB_FUNCTION_CONTROL_TRANSFER (0x0008)
    IRP information: 0x01, Direction: PDO -> FDO
    URB bus id: 3
    Device address: 28
    Endpoint: 0x80, Direction: IN
    URB transfer type: URB_CONTROL (0x02)
    Packet Data Length: 44
    [Request in: 56]
    [Time from request: 0.001762000 seconds]
    Control transfer stage: Complete (3)
STRING DESCRIPTOR
    bLength: 44
    bDescriptorType: 0x03 (STRING)
    bString: YubiKey OTP+FIDO+CCID

No.     Time           Source                Destination           Protocol Length Info
     58 0.163401       host                  3.28.0                USBHID   37     SET_REPORT Request

Frame 58: 37 bytes on wire (296 bits), 37 bytes captured (296 bits) on interface \\.\USBPcap3, id 0
USB URB
    [Source: host]
    [Destination: 3.28.0]
    USBPcap pseudoheader length: 28
    IRP ID: 0xffffa387b095e8a0
    IRP USBD_STATUS: USBD_STATUS_SUCCESS (0x00000000)
    URB Function: URB_FUNCTION_CONTROL_TRANSFER_EX (0x0032)
    IRP information: 0x00, Direction: FDO -> PDO
    URB bus id: 3
    Device address: 28
    Endpoint: 0x00, Direction: OUT
    URB transfer type: URB_CONTROL (0x02)
    Packet Data Length: 9
    [Response in: 59]
    Control transfer stage: Setup (0)
    [bInterfaceClass: HID (0x03)]
Setup Data

No.     Time           Source                Destination           Protocol Length Info
     59 0.165817       3.28.0                host                  USBHID   28     SET_REPORT Response

Frame 59: 28 bytes on wire (224 bits), 28 bytes captured (224 bits) on interface \\.\USBPcap3, id 0
USB URB
    [Source: 3.28.0]
    [Destination: host]
    USBPcap pseudoheader length: 28
    IRP ID: 0xffffa387b095e8a0
    IRP USBD_STATUS: USBD_STATUS_SUCCESS (0x00000000)
    URB Function: URB_FUNCTION_CONTROL_TRANSFER_EX (0x0032)
    IRP information: 0x01, Direction: PDO -> FDO
    URB bus id: 3
    Device address: 28
    Endpoint: 0x00, Direction: OUT
    URB transfer type: URB_CONTROL (0x02)
    Packet Data Length: 0
    [Request in: 58]
    [Time from request: 0.002416000 seconds]
    Control transfer stage: Complete (3)
    [bInterfaceClass: HID (0x03)]

No.     Time           Source                Destination           Protocol Length Info
     60 0.171732       host                  3.28.2                USBCCID  37     CCID Packet - PC to Reader: ICC Power On

Frame 60: 37 bytes on wire (296 bits), 37 bytes captured (296 bits) on interface \\.\USBPcap3, id 0
USB URB
    [Source: host]
    [Destination: 3.28.2]
    USBPcap pseudoheader length: 27
    IRP ID: 0xffffa387c743f010
    IRP USBD_STATUS: USBD_STATUS_SUCCESS (0x00000000)
    URB Function: URB_FUNCTION_BULK_OR_INTERRUPT_TRANSFER (0x0009)
    IRP information: 0x00, Direction: FDO -> PDO
    URB bus id: 3
    Device address: 28
    Endpoint: 0x02, Direction: OUT
    URB transfer type: URB_BULK (0x03)
    Packet Data Length: 10
    [Response in: 61]
    [bInterfaceClass: Smart Card (0x0b)]
USB CCID

No.     Time           Source                Destination           Protocol Length Info
     61 0.171822       3.28.2                host                  USB      27     URB_BULK out

Frame 61: 27 bytes on wire (216 bits), 27 bytes captured (216 bits) on interface \\.\USBPcap3, id 0
USB URB
    [Source: 3.28.2]
    [Destination: host]
    USBPcap pseudoheader length: 27
    IRP ID: 0xffffa387c743f010
    IRP USBD_STATUS: USBD_STATUS_SUCCESS (0x00000000)
    URB Function: URB_FUNCTION_BULK_OR_INTERRUPT_TRANSFER (0x0009)
    IRP information: 0x01, Direction: PDO -> FDO
    URB bus id: 3
    Device address: 28
    Endpoint: 0x02, Direction: OUT
    URB transfer type: URB_BULK (0x03)
    Packet Data Length: 0
    [Request in: 60]
    [Time from request: 0.000090000 seconds]
    [bInterfaceClass: Smart Card (0x0b)]

No.     Time           Source                Destination           Protocol Length Info
     62 0.171882       host                  3.28.2                USB      27     URB_BULK in

Frame 62: 27 bytes on wire (216 bits), 27 bytes captured (216 bits) on interface \\.\USBPcap3, id 0
USB URB
    [Source: host]
    [Destination: 3.28.2]
    USBPcap pseudoheader length: 27
    IRP ID: 0xffffa387c72a6720
    IRP USBD_STATUS: USBD_STATUS_SUCCESS (0x00000000)
    URB Function: URB_FUNCTION_BULK_OR_INTERRUPT_TRANSFER (0x0009)
    IRP information: 0x00, Direction: FDO -> PDO
    URB bus id: 3
    Device address: 28
    Endpoint: 0x82, Direction: IN
    URB transfer type: URB_BULK (0x03)
    Packet Data Length: 0
    [Response in: 63]
    [bInterfaceClass: Smart Card (0x0b)]

No.     Time           Source                Destination           Protocol Length Info
     63 0.172829       3.28.2                host                  USBCCID  60     CCID Packet - Reader to PC: Data Block

Frame 63: 60 bytes on wire (480 bits), 60 bytes captured (480 bits) on interface \\.\USBPcap3, id 0
USB URB
    [Source: 3.28.2]
    [Destination: host]
    USBPcap pseudoheader length: 27
    IRP ID: 0xffffa387c72a6720
    IRP USBD_STATUS: USBD_STATUS_SUCCESS (0x00000000)
    URB Function: URB_FUNCTION_BULK_OR_INTERRUPT_TRANSFER (0x0009)
    IRP information: 0x01, Direction: PDO -> FDO
    URB bus id: 3
    Device address: 28
    Endpoint: 0x82, Direction: IN
    URB transfer type: URB_BULK (0x03)
    Packet Data Length: 33
    [Request in: 62]
    [Time from request: 0.000947000 seconds]
    [bInterfaceClass: Smart Card (0x0b)]
USB CCID
Data (23 bytes)

0000  3b fd 13 00 00 81 31 fe 15 80 73 c0 21 c0 57 59   ;.....1...s.!.WY
0010  75 62 69 4b 65 79 40                              ubiKey@

No.     Time           Source                Destination           Protocol Length Info
     64 0.173817       3.28.3                host                  USB      29     URB_INTERRUPT in

Frame 64: 29 bytes on wire (232 bits), 29 bytes captured (232 bits) on interface \\.\USBPcap3, id 0
USB URB
    [Source: 3.28.3]
    [Destination: host]
    USBPcap pseudoheader length: 27
    IRP ID: 0xffffa387c743f620
    IRP USBD_STATUS: USBD_STATUS_SUCCESS (0x00000000)
    URB Function: URB_FUNCTION_BULK_OR_INTERRUPT_TRANSFER (0x0009)
    IRP information: 0x01, Direction: PDO -> FDO
    URB bus id: 3
    Device address: 28
    Endpoint: 0x83, Direction: IN
    URB transfer type: URB_INTERRUPT (0x01)
    Packet Data Length: 2
    [Request in: 51]
    [Time from request: 0.019811000 seconds]
    [bInterfaceClass: Smart Card (0x0b)]
Leftover Capture Data: 5003

No.     Time           Source                Destination           Protocol Length Info
     65 0.173840       host                  3.28.3                USB      27     URB_INTERRUPT in

Frame 65: 27 bytes on wire (216 bits), 27 bytes captured (216 bits) on interface \\.\USBPcap3, id 0
USB URB
    [Source: host]
    [Destination: 3.28.3]
    USBPcap pseudoheader length: 27
    IRP ID: 0xffffa387c743f620
    IRP USBD_STATUS: USBD_STATUS_SUCCESS (0x00000000)
    URB Function: URB_FUNCTION_BULK_OR_INTERRUPT_TRANSFER (0x0009)
    IRP information: 0x00, Direction: FDO -> PDO
    URB bus id: 3
    Device address: 28
    Endpoint: 0x83, Direction: IN
    URB transfer type: URB_INTERRUPT (0x01)
    Packet Data Length: 0
    [Response in: 152]
    [bInterfaceClass: Smart Card (0x0b)]

No.     Time           Source                Destination           Protocol Length Info
     66 0.174593       host                  3.28.2                USBCCID  37     CCID Packet - PC to Reader: ICC Power Off

Frame 66: 37 bytes on wire (296 bits), 37 bytes captured (296 bits) on interface \\.\USBPcap3, id 0
USB URB
    [Source: host]
    [Destination: 3.28.2]
    USBPcap pseudoheader length: 27
    IRP ID: 0xffffa387c74aa620
    IRP USBD_STATUS: USBD_STATUS_SUCCESS (0x00000000)
    URB Function: URB_FUNCTION_BULK_OR_INTERRUPT_TRANSFER (0x0009)
    IRP information: 0x00, Direction: FDO -> PDO
    URB bus id: 3
    Device address: 28
    Endpoint: 0x02, Direction: OUT
    URB transfer type: URB_BULK (0x03)
    Packet Data Length: 10
    [Response in: 67]
    [bInterfaceClass: Smart Card (0x0b)]
USB CCID

No.     Time           Source                Destination           Protocol Length Info
     67 0.174673       3.28.2                host                  USB      27     URB_BULK out

Frame 67: 27 bytes on wire (216 bits), 27 bytes captured (216 bits) on interface \\.\USBPcap3, id 0
USB URB
    [Source: 3.28.2]
    [Destination: host]
    USBPcap pseudoheader length: 27
    IRP ID: 0xffffa387c74aa620
    IRP USBD_STATUS: USBD_STATUS_SUCCESS (0x00000000)
    URB Function: URB_FUNCTION_BULK_OR_INTERRUPT_TRANSFER (0x0009)
    IRP information: 0x01, Direction: PDO -> FDO
    URB bus id: 3
    Device address: 28
    Endpoint: 0x02, Direction: OUT
    URB transfer type: URB_BULK (0x03)
    Packet Data Length: 0
    [Request in: 66]
    [Time from request: 0.000080000 seconds]
    [bInterfaceClass: Smart Card (0x0b)]

No.     Time           Source                Destination           Protocol Length Info
     68 0.174734       host                  3.28.2                USB      27     URB_BULK in

Frame 68: 27 bytes on wire (216 bits), 27 bytes captured (216 bits) on interface \\.\USBPcap3, id 0
USB URB
    [Source: host]
    [Destination: 3.28.2]
    USBPcap pseudoheader length: 27
    IRP ID: 0xffffa387c72a6720
    IRP USBD_STATUS: USBD_STATUS_SUCCESS (0x00000000)
    URB Function: URB_FUNCTION_BULK_OR_INTERRUPT_TRANSFER (0x0009)
    IRP information: 0x00, Direction: FDO -> PDO
    URB bus id: 3
    Device address: 28
    Endpoint: 0x82, Direction: IN
    URB transfer type: URB_BULK (0x03)
    Packet Data Length: 0
    [Response in: 70]
    [bInterfaceClass: Smart Card (0x0b)]

No.     Time           Source                Destination           Protocol Length Info
     69 0.175341       host                  3.28.0                USB      36     GET DESCRIPTOR Request STRING

Frame 69: 36 bytes on wire (288 bits), 36 bytes captured (288 bits) on interface \\.\USBPcap3, id 0
USB URB
    [Source: host]
    [Destination: 3.28.0]
    USBPcap pseudoheader length: 28
    IRP ID: 0xffffa387c743f010
    IRP USBD_STATUS: USBD_STATUS_SUCCESS (0x00000000)
    URB Function: URB_FUNCTION_GET_DESCRIPTOR_FROM_DEVICE (0x000b)
    IRP information: 0x00, Direction: FDO -> PDO
    URB bus id: 3
    Device address: 28
    Endpoint: 0x80, Direction: IN
    URB transfer type: URB_CONTROL (0x02)
    Packet Data Length: 8
    [Response in: 71]
    Control transfer stage: Setup (0)
Setup Data

No.     Time           Source                Destination           Protocol Length Info
     70 0.175376       3.28.2                host                  USBCCID  37     CCID Packet - Reader to PC: Slot Status

Frame 70: 37 bytes on wire (296 bits), 37 bytes captured (296 bits) on interface \\.\USBPcap3, id 0
USB URB
    [Source: 3.28.2]
    [Destination: host]
    USBPcap pseudoheader length: 27
    IRP ID: 0xffffa387c72a6720
    IRP USBD_STATUS: USBD_STATUS_SUCCESS (0x00000000)
    URB Function: URB_FUNCTION_BULK_OR_INTERRUPT_TRANSFER (0x0009)
    IRP information: 0x01, Direction: PDO -> FDO
    URB bus id: 3
    Device address: 28
    Endpoint: 0x82, Direction: IN
    URB transfer type: URB_BULK (0x03)
    Packet Data Length: 10
    [Request in: 68]
    [Time from request: 0.000642000 seconds]
    [bInterfaceClass: Smart Card (0x0b)]
USB CCID

No.     Time           Source                Destination           Protocol Length Info
     71 0.176808       3.28.0                host                  USB      72     GET DESCRIPTOR Response STRING

Frame 71: 72 bytes on wire (576 bits), 72 bytes captured (576 bits) on interface \\.\USBPcap3, id 0
USB URB
    [Source: 3.28.0]
    [Destination: host]
    USBPcap pseudoheader length: 28
    IRP ID: 0xffffa387c743f010
    IRP USBD_STATUS: USBD_STATUS_SUCCESS (0x00000000)
    URB Function: URB_FUNCTION_CONTROL_TRANSFER (0x0008)
    IRP information: 0x01, Direction: PDO -> FDO
    URB bus id: 3
    Device address: 28
    Endpoint: 0x80, Direction: IN
    URB transfer type: URB_CONTROL (0x02)
    Packet Data Length: 44
    [Request in: 69]
    [Time from request: 0.001467000 seconds]
    Control transfer stage: Complete (3)
STRING DESCRIPTOR
    bLength: 44
    bDescriptorType: 0x03 (STRING)
    bString: YubiKey OTP+FIDO+CCID

No.     Time           Source                Destination           Protocol Length Info
     72 0.189948       host                  3.28.2                USBCCID  37     CCID Packet - PC to Reader: ICC Power On

Frame 72: 37 bytes on wire (296 bits), 37 bytes captured (296 bits) on interface \\.\USBPcap3, id 0
USB URB
    [Source: host]
    [Destination: 3.28.2]
    USBPcap pseudoheader length: 27
    IRP ID: 0xffffa387c7441010
    IRP USBD_STATUS: USBD_STATUS_SUCCESS (0x00000000)
    URB Function: URB_FUNCTION_BULK_OR_INTERRUPT_TRANSFER (0x0009)
    IRP information: 0x00, Direction: FDO -> PDO
    URB bus id: 3
    Device address: 28
    Endpoint: 0x02, Direction: OUT
    URB transfer type: URB_BULK (0x03)
    Packet Data Length: 10
    [Response in: 73]
    [bInterfaceClass: Smart Card (0x0b)]
USB CCID

No.     Time           Source                Destination           Protocol Length Info
     73 0.190054       3.28.2                host                  USB      27     URB_BULK out

Frame 73: 27 bytes on wire (216 bits), 27 bytes captured (216 bits) on interface \\.\USBPcap3, id 0
USB URB
    [Source: 3.28.2]
    [Destination: host]
    USBPcap pseudoheader length: 27
    IRP ID: 0xffffa387c7441010
    IRP USBD_STATUS: USBD_STATUS_SUCCESS (0x00000000)
    URB Function: URB_FUNCTION_BULK_OR_INTERRUPT_TRANSFER (0x0009)
    IRP information: 0x01, Direction: PDO -> FDO
    URB bus id: 3
    Device address: 28
    Endpoint: 0x02, Direction: OUT
    URB transfer type: URB_BULK (0x03)
    Packet Data Length: 0
    [Request in: 72]
    [Time from request: 0.000106000 seconds]
    [bInterfaceClass: Smart Card (0x0b)]

No.     Time           Source                Destination           Protocol Length Info
     74 0.190112       host                  3.28.2                USB      27     URB_BULK in

Frame 74: 27 bytes on wire (216 bits), 27 bytes captured (216 bits) on interface \\.\USBPcap3, id 0
USB URB
    [Source: host]
    [Destination: 3.28.2]
    USBPcap pseudoheader length: 27
    IRP ID: 0xffffa387c72a6720
    IRP USBD_STATUS: USBD_STATUS_SUCCESS (0x00000000)
    URB Function: URB_FUNCTION_BULK_OR_INTERRUPT_TRANSFER (0x0009)
    IRP information: 0x00, Direction: FDO -> PDO
    URB bus id: 3
    Device address: 28
    Endpoint: 0x82, Direction: IN
    URB transfer type: URB_BULK (0x03)
    Packet Data Length: 0
    [Response in: 75]
    [bInterfaceClass: Smart Card (0x0b)]

No.     Time           Source                Destination           Protocol Length Info
     75 0.190829       3.28.2                host                  USBCCID  60     CCID Packet - Reader to PC: Data Block

Frame 75: 60 bytes on wire (480 bits), 60 bytes captured (480 bits) on interface \\.\USBPcap3, id 0
USB URB
    [Source: 3.28.2]
    [Destination: host]
    USBPcap pseudoheader length: 27
    IRP ID: 0xffffa387c72a6720
    IRP USBD_STATUS: USBD_STATUS_SUCCESS (0x00000000)
    URB Function: URB_FUNCTION_BULK_OR_INTERRUPT_TRANSFER (0x0009)
    IRP information: 0x01, Direction: PDO -> FDO
    URB bus id: 3
    Device address: 28
    Endpoint: 0x82, Direction: IN
    URB transfer type: URB_BULK (0x03)
    Packet Data Length: 33
    [Request in: 74]
    [Time from request: 0.000717000 seconds]
    [bInterfaceClass: Smart Card (0x0b)]
USB CCID
Data (23 bytes)

0000  3b fd 13 00 00 81 31 fe 15 80 73 c0 21 c0 57 59   ;.....1...s.!.WY
0010  75 62 69 4b 65 79 40                              ubiKey@

No.     Time           Source                Destination           Protocol Length Info
     76 0.205690       host                  3.28.2                USBCCID  37     CCID Packet - PC to Reader: Get Parameters

Frame 76: 37 bytes on wire (296 bits), 37 bytes captured (296 bits) on interface \\.\USBPcap3, id 0
USB URB
    [Source: host]
    [Destination: 3.28.2]
    USBPcap pseudoheader length: 27
    IRP ID: 0xffffa387c7443010
    IRP USBD_STATUS: USBD_STATUS_SUCCESS (0x00000000)
    URB Function: URB_FUNCTION_BULK_OR_INTERRUPT_TRANSFER (0x0009)
    IRP information: 0x00, Direction: FDO -> PDO
    URB bus id: 3
    Device address: 28
    Endpoint: 0x02, Direction: OUT
    URB transfer type: URB_BULK (0x03)
    Packet Data Length: 10
    [Response in: 77]
    [bInterfaceClass: Smart Card (0x0b)]
USB CCID

No.     Time           Source                Destination           Protocol Length Info
     77 0.205761       3.28.2                host                  USB      27     URB_BULK out

Frame 77: 27 bytes on wire (216 bits), 27 bytes captured (216 bits) on interface \\.\USBPcap3, id 0
USB URB
    [Source: 3.28.2]
    [Destination: host]
    USBPcap pseudoheader length: 27
    IRP ID: 0xffffa387c7443010
    IRP USBD_STATUS: USBD_STATUS_SUCCESS (0x00000000)
    URB Function: URB_FUNCTION_BULK_OR_INTERRUPT_TRANSFER (0x0009)
    IRP information: 0x01, Direction: PDO -> FDO
    URB bus id: 3
    Device address: 28
    Endpoint: 0x02, Direction: OUT
    URB transfer type: URB_BULK (0x03)
    Packet Data Length: 0
    [Request in: 76]
    [Time from request: 0.000071000 seconds]
    [bInterfaceClass: Smart Card (0x0b)]

No.     Time           Source                Destination           Protocol Length Info
     78 0.205813       host                  3.28.2                USB      27     URB_BULK in

Frame 78: 27 bytes on wire (216 bits), 27 bytes captured (216 bits) on interface \\.\USBPcap3, id 0
USB URB
    [Source: host]
    [Destination: 3.28.2]
    USBPcap pseudoheader length: 27
    IRP ID: 0xffffa387c72a6720
    IRP USBD_STATUS: USBD_STATUS_SUCCESS (0x00000000)
    URB Function: URB_FUNCTION_BULK_OR_INTERRUPT_TRANSFER (0x0009)
    IRP information: 0x00, Direction: FDO -> PDO
    URB bus id: 3
    Device address: 28
    Endpoint: 0x82, Direction: IN
    URB transfer type: URB_BULK (0x03)
    Packet Data Length: 0
    [Response in: 79]
    [bInterfaceClass: Smart Card (0x0b)]

No.     Time           Source                Destination           Protocol Length Info
     79 0.205897       3.28.2                host                  USBCCID  44     CCID Packet - Reader to PC: Parameters

Frame 79: 44 bytes on wire (352 bits), 44 bytes captured (352 bits) on interface \\.\USBPcap3, id 0
USB URB
    [Source: 3.28.2]
    [Destination: host]
    USBPcap pseudoheader length: 27
    IRP ID: 0xffffa387c72a6720
    IRP USBD_STATUS: USBD_STATUS_SUCCESS (0x00000000)
    URB Function: URB_FUNCTION_BULK_OR_INTERRUPT_TRANSFER (0x0009)
    IRP information: 0x01, Direction: PDO -> FDO
    URB bus id: 3
    Device address: 28
    Endpoint: 0x82, Direction: IN
    URB transfer type: URB_BULK (0x03)
    Packet Data Length: 17
    [Request in: 78]
    [Time from request: 0.000084000 seconds]
    [bInterfaceClass: Smart Card (0x0b)]
USB CCID
Protocol Data Structure for Protocol T=1

No.     Time           Source                Destination           Protocol Length Info
     80 0.206429       host                  3.28.2                USBCCID  53     CCID Packet - PC to Reader: Transfer Block

Frame 80: 53 bytes on wire (424 bits), 53 bytes captured (424 bits) on interface \\.\USBPcap3, id 0
USB URB
    [Source: host]
    [Destination: 3.28.2]
    USBPcap pseudoheader length: 27
    IRP ID: 0xffffa387c7444010
    IRP USBD_STATUS: USBD_STATUS_SUCCESS (0x00000000)
    URB Function: URB_FUNCTION_BULK_OR_INTERRUPT_TRANSFER (0x0009)
    IRP information: 0x00, Direction: FDO -> PDO
    URB bus id: 3
    Device address: 28
    Endpoint: 0x02, Direction: OUT
    URB transfer type: URB_BULK (0x03)
    Packet Data Length: 26
    [Response in: 81]
    [bInterfaceClass: Smart Card (0x0b)]
USB CCID
Data (16 bytes)

0000  00 a4 04 00 0b a0 00 00 03 97 43 49 44 5f 01 00   ..........CID_..

No.     Time           Source                Destination           Protocol Length Info
     81 0.206494       3.28.2                host                  USB      27     URB_BULK out

Frame 81: 27 bytes on wire (216 bits), 27 bytes captured (216 bits) on interface \\.\USBPcap3, id 0
USB URB
    [Source: 3.28.2]
    [Destination: host]
    USBPcap pseudoheader length: 27
    IRP ID: 0xffffa387c7444010
    IRP USBD_STATUS: USBD_STATUS_SUCCESS (0x00000000)
    URB Function: URB_FUNCTION_BULK_OR_INTERRUPT_TRANSFER (0x0009)
    IRP information: 0x01, Direction: PDO -> FDO
    URB bus id: 3
    Device address: 28
    Endpoint: 0x02, Direction: OUT
    URB transfer type: URB_BULK (0x03)
    Packet Data Length: 0
    [Request in: 80]
    [Time from request: 0.000065000 seconds]
    [bInterfaceClass: Smart Card (0x0b)]

No.     Time           Source                Destination           Protocol Length Info
     82 0.206530       host                  3.28.2                USB      27     URB_BULK in

Frame 82: 27 bytes on wire (216 bits), 27 bytes captured (216 bits) on interface \\.\USBPcap3, id 0
USB URB
    [Source: host]
    [Destination: 3.28.2]
    USBPcap pseudoheader length: 27
    IRP ID: 0xffffa387c72a6720
    IRP USBD_STATUS: USBD_STATUS_SUCCESS (0x00000000)
    URB Function: URB_FUNCTION_BULK_OR_INTERRUPT_TRANSFER (0x0009)
    IRP information: 0x00, Direction: FDO -> PDO
    URB bus id: 3
    Device address: 28
    Endpoint: 0x82, Direction: IN
    URB transfer type: URB_BULK (0x03)
    Packet Data Length: 0
    [Response in: 83]
    [bInterfaceClass: Smart Card (0x0b)]

No.     Time           Source                Destination           Protocol Length Info
     83 0.206954       3.28.2                host                  USBCCID  39     CCID Packet - Reader to PC: Data Block

Frame 83: 39 bytes on wire (312 bits), 39 bytes captured (312 bits) on interface \\.\USBPcap3, id 0
USB URB
    [Source: 3.28.2]
    [Destination: host]
    USBPcap pseudoheader length: 27
    IRP ID: 0xffffa387c72a6720
    IRP USBD_STATUS: USBD_STATUS_SUCCESS (0x00000000)
    URB Function: URB_FUNCTION_BULK_OR_INTERRUPT_TRANSFER (0x0009)
    IRP information: 0x01, Direction: PDO -> FDO
    URB bus id: 3
    Device address: 28
    Endpoint: 0x82, Direction: IN
    URB transfer type: URB_BULK (0x03)
    Packet Data Length: 12
    [Request in: 82]
    [Time from request: 0.000424000 seconds]
    [bInterfaceClass: Smart Card (0x0b)]
USB CCID
Data (2 bytes)

0000  6a 82                                             j.

No.     Time           Source                Destination           Protocol Length Info
     84 0.207152       host                  3.28.2                USBCCID  42     CCID Packet - PC to Reader: Transfer Block

Frame 84: 42 bytes on wire (336 bits), 42 bytes captured (336 bits) on interface \\.\USBPcap3, id 0
USB URB
    [Source: host]
    [Destination: 3.28.2]
    USBPcap pseudoheader length: 27
    IRP ID: 0xffffa387c74ae010
    IRP USBD_STATUS: USBD_STATUS_SUCCESS (0x00000000)
    URB Function: URB_FUNCTION_BULK_OR_INTERRUPT_TRANSFER (0x0009)
    IRP information: 0x00, Direction: FDO -> PDO
    URB bus id: 3
    Device address: 28
    Endpoint: 0x02, Direction: OUT
    URB transfer type: URB_BULK (0x03)
    Packet Data Length: 15
    [Response in: 85]
    [bInterfaceClass: Smart Card (0x0b)]
USB CCID
Data (5 bytes)

0000  00 ca 7f 68 00                                    ...h.

No.     Time           Source                Destination           Protocol Length Info
     85 0.207233       3.28.2                host                  USB      27     URB_BULK out

Frame 85: 27 bytes on wire (216 bits), 27 bytes captured (216 bits) on interface \\.\USBPcap3, id 0
USB URB
    [Source: 3.28.2]
    [Destination: host]
    USBPcap pseudoheader length: 27
    IRP ID: 0xffffa387c74ae010
    IRP USBD_STATUS: USBD_STATUS_SUCCESS (0x00000000)
    URB Function: URB_FUNCTION_BULK_OR_INTERRUPT_TRANSFER (0x0009)
    IRP information: 0x01, Direction: PDO -> FDO
    URB bus id: 3
    Device address: 28
    Endpoint: 0x02, Direction: OUT
    URB transfer type: URB_BULK (0x03)
    Packet Data Length: 0
    [Request in: 84]
    [Time from request: 0.000081000 seconds]
    [bInterfaceClass: Smart Card (0x0b)]

No.     Time           Source                Destination           Protocol Length Info
     86 0.207283       host                  3.28.2                USB      27     URB_BULK in

Frame 86: 27 bytes on wire (216 bits), 27 bytes captured (216 bits) on interface \\.\USBPcap3, id 0
USB URB
    [Source: host]
    [Destination: 3.28.2]
    USBPcap pseudoheader length: 27
    IRP ID: 0xffffa387c72a6720
    IRP USBD_STATUS: USBD_STATUS_SUCCESS (0x00000000)
    URB Function: URB_FUNCTION_BULK_OR_INTERRUPT_TRANSFER (0x0009)
    IRP information: 0x00, Direction: FDO -> PDO
    URB bus id: 3
    Device address: 28
    Endpoint: 0x82, Direction: IN
    URB transfer type: URB_BULK (0x03)
    Packet Data Length: 0
    [Response in: 87]
    [bInterfaceClass: Smart Card (0x0b)]

No.     Time           Source                Destination           Protocol Length Info
     87 0.207820       3.28.2                host                  USBCCID  39     CCID Packet - Reader to PC: Data Block

Frame 87: 39 bytes on wire (312 bits), 39 bytes captured (312 bits) on interface \\.\USBPcap3, id 0
USB URB
    [Source: 3.28.2]
    [Destination: host]
    USBPcap pseudoheader length: 27
    IRP ID: 0xffffa387c72a6720
    IRP USBD_STATUS: USBD_STATUS_SUCCESS (0x00000000)
    URB Function: URB_FUNCTION_BULK_OR_INTERRUPT_TRANSFER (0x0009)
    IRP information: 0x01, Direction: PDO -> FDO
    URB bus id: 3
    Device address: 28
    Endpoint: 0x82, Direction: IN
    URB transfer type: URB_BULK (0x03)
    Packet Data Length: 12
    [Request in: 86]
    [Time from request: 0.000537000 seconds]
    [bInterfaceClass: Smart Card (0x0b)]
USB CCID
Data (2 bytes)

0000  6d 00                                             m.

No.     Time           Source                Destination           Protocol Length Info
     88 0.208032       host                  3.28.2                USBCCID  51     CCID Packet - PC to Reader: Transfer Block

Frame 88: 51 bytes on wire (408 bits), 51 bytes captured (408 bits) on interface \\.\USBPcap3, id 0
USB URB
    [Source: host]
    [Destination: 3.28.2]
    USBPcap pseudoheader length: 27
    IRP ID: 0xffffa387c74af8a0
    IRP USBD_STATUS: USBD_STATUS_SUCCESS (0x00000000)
    URB Function: URB_FUNCTION_BULK_OR_INTERRUPT_TRANSFER (0x0009)
    IRP information: 0x00, Direction: FDO -> PDO
    URB bus id: 3
    Device address: 28
    Endpoint: 0x02, Direction: OUT
    URB transfer type: URB_BULK (0x03)
    Packet Data Length: 24
    [Response in: 89]
    [bInterfaceClass: Smart Card (0x0b)]
USB CCID
Data (14 bytes)

0000  00 a4 04 00 09 a0 00 00 03 08 00 00 10 00         ..............

No.     Time           Source                Destination           Protocol Length Info
     89 0.208121       3.28.2                host                  USB      27     URB_BULK out

Frame 89: 27 bytes on wire (216 bits), 27 bytes captured (216 bits) on interface \\.\USBPcap3, id 0
USB URB
    [Source: 3.28.2]
    [Destination: host]
    USBPcap pseudoheader length: 27
    IRP ID: 0xffffa387c74af8a0
    IRP USBD_STATUS: USBD_STATUS_SUCCESS (0x00000000)
    URB Function: URB_FUNCTION_BULK_OR_INTERRUPT_TRANSFER (0x0009)
    IRP information: 0x01, Direction: PDO -> FDO
    URB bus id: 3
    Device address: 28
    Endpoint: 0x02, Direction: OUT
    URB transfer type: URB_BULK (0x03)
    Packet Data Length: 0
    [Request in: 88]
    [Time from request: 0.000089000 seconds]
    [bInterfaceClass: Smart Card (0x0b)]

No.     Time           Source                Destination           Protocol Length Info
     90 0.208167       host                  3.28.2                USB      27     URB_BULK in

Frame 90: 27 bytes on wire (216 bits), 27 bytes captured (216 bits) on interface \\.\USBPcap3, id 0
USB URB
    [Source: host]
    [Destination: 3.28.2]
    USBPcap pseudoheader length: 27
    IRP ID: 0xffffa387c72a6720
    IRP USBD_STATUS: USBD_STATUS_SUCCESS (0x00000000)
    URB Function: URB_FUNCTION_BULK_OR_INTERRUPT_TRANSFER (0x0009)
    IRP information: 0x00, Direction: FDO -> PDO
    URB bus id: 3
    Device address: 28
    Endpoint: 0x82, Direction: IN
    URB transfer type: URB_BULK (0x03)
    Packet Data Length: 0
    [Response in: 91]
    [bInterfaceClass: Smart Card (0x0b)]

No.     Time           Source                Destination           Protocol Length Info
     91 0.209412       3.28.2                host                  USBCCID  58     CCID Packet - Reader to PC: Data Block

Frame 91: 58 bytes on wire (464 bits), 58 bytes captured (464 bits) on interface \\.\USBPcap3, id 0
USB URB
    [Source: 3.28.2]
    [Destination: host]
    USBPcap pseudoheader length: 27
    IRP ID: 0xffffa387c72a6720
    IRP USBD_STATUS: USBD_STATUS_SUCCESS (0x00000000)
    URB Function: URB_FUNCTION_BULK_OR_INTERRUPT_TRANSFER (0x0009)
    IRP information: 0x01, Direction: PDO -> FDO
    URB bus id: 3
    Device address: 28
    Endpoint: 0x82, Direction: IN
    URB transfer type: URB_BULK (0x03)
    Packet Data Length: 31
    [Request in: 90]
    [Time from request: 0.001245000 seconds]
    [bInterfaceClass: Smart Card (0x0b)]
USB CCID
Data (21 bytes)

0000  61 11 4f 06 00 00 10 00 01 00 79 07 4f 05 a0 00   a.O.......y.O...
0010  00 03 08 90 00                                    .....

No.     Time           Source                Destination           Protocol Length Info
     92 0.210812       host                  3.28.2                USBCCID  51     CCID Packet - PC to Reader: Transfer Block

Frame 92: 51 bytes on wire (408 bits), 51 bytes captured (408 bits) on interface \\.\USBPcap3, id 0
USB URB
    [Source: host]
    [Destination: 3.28.2]
    USBPcap pseudoheader length: 27
    IRP ID: 0xffffa387c74b18a0
    IRP USBD_STATUS: USBD_STATUS_SUCCESS (0x00000000)
    URB Function: URB_FUNCTION_BULK_OR_INTERRUPT_TRANSFER (0x0009)
    IRP information: 0x00, Direction: FDO -> PDO
    URB bus id: 3
    Device address: 28
    Endpoint: 0x02, Direction: OUT
    URB transfer type: URB_BULK (0x03)
    Packet Data Length: 24
    [Response in: 93]
    [bInterfaceClass: Smart Card (0x0b)]
USB CCID
Data (14 bytes)

0000  00 a4 04 00 09 a0 00 00 03 08 00 00 10 00         ..............

No.     Time           Source                Destination           Protocol Length Info
     93 0.210875       3.28.2                host                  USB      27     URB_BULK out

Frame 93: 27 bytes on wire (216 bits), 27 bytes captured (216 bits) on interface \\.\USBPcap3, id 0
USB URB
    [Source: 3.28.2]
    [Destination: host]
    USBPcap pseudoheader length: 27
    IRP ID: 0xffffa387c74b18a0
    IRP USBD_STATUS: USBD_STATUS_SUCCESS (0x00000000)
    URB Function: URB_FUNCTION_BULK_OR_INTERRUPT_TRANSFER (0x0009)
    IRP information: 0x01, Direction: PDO -> FDO
    URB bus id: 3
    Device address: 28
    Endpoint: 0x02, Direction: OUT
    URB transfer type: URB_BULK (0x03)
    Packet Data Length: 0
    [Request in: 92]
    [Time from request: 0.000063000 seconds]
    [bInterfaceClass: Smart Card (0x0b)]

No.     Time           Source                Destination           Protocol Length Info
     94 0.210921       host                  3.28.2                USB      27     URB_BULK in

Frame 94: 27 bytes on wire (216 bits), 27 bytes captured (216 bits) on interface \\.\USBPcap3, id 0
USB URB
    [Source: host]
    [Destination: 3.28.2]
    USBPcap pseudoheader length: 27
    IRP ID: 0xffffa387c72a6720
    IRP USBD_STATUS: USBD_STATUS_SUCCESS (0x00000000)
    URB Function: URB_FUNCTION_BULK_OR_INTERRUPT_TRANSFER (0x0009)
    IRP information: 0x00, Direction: FDO -> PDO
    URB bus id: 3
    Device address: 28
    Endpoint: 0x82, Direction: IN
    URB transfer type: URB_BULK (0x03)
    Packet Data Length: 0
    [Response in: 95]
    [bInterfaceClass: Smart Card (0x0b)]

No.     Time           Source                Destination           Protocol Length Info
     95 0.211969       3.28.2                host                  USBCCID  58     CCID Packet - Reader to PC: Data Block

Frame 95: 58 bytes on wire (464 bits), 58 bytes captured (464 bits) on interface \\.\USBPcap3, id 0
USB URB
    [Source: 3.28.2]
    [Destination: host]
    USBPcap pseudoheader length: 27
    IRP ID: 0xffffa387c72a6720
    IRP USBD_STATUS: USBD_STATUS_SUCCESS (0x00000000)
    URB Function: URB_FUNCTION_BULK_OR_INTERRUPT_TRANSFER (0x0009)
    IRP information: 0x01, Direction: PDO -> FDO
    URB bus id: 3
    Device address: 28
    Endpoint: 0x82, Direction: IN
    URB transfer type: URB_BULK (0x03)
    Packet Data Length: 31
    [Request in: 94]
    [Time from request: 0.001048000 seconds]
    [bInterfaceClass: Smart Card (0x0b)]
USB CCID
Data (21 bytes)

0000  61 11 4f 06 00 00 10 00 01 00 79 07 4f 05 a0 00   a.O.......y.O...
0010  00 03 08 90 00                                    .....

No.     Time           Source                Destination           Protocol Length Info
     96 0.212257       host                  3.28.2                USBCCID  48     CCID Packet - PC to Reader: Transfer Block

Frame 96: 48 bytes on wire (384 bits), 48 bytes captured (384 bits) on interface \\.\USBPcap3, id 0
USB URB
    [Source: host]
    [Destination: 3.28.2]
    USBPcap pseudoheader length: 27
    IRP ID: 0xffffa387c74ad010
    IRP USBD_STATUS: USBD_STATUS_SUCCESS (0x00000000)
    URB Function: URB_FUNCTION_BULK_OR_INTERRUPT_TRANSFER (0x0009)
    IRP information: 0x00, Direction: FDO -> PDO
    URB bus id: 3
    Device address: 28
    Endpoint: 0x02, Direction: OUT
    URB transfer type: URB_BULK (0x03)
    Packet Data Length: 21
    [Response in: 97]
    [bInterfaceClass: Smart Card (0x0b)]
USB CCID
Data (11 bytes)

0000  00 cb 3f ff 05 5c 03 5f c1 02 00                  ..?..\._...

No.     Time           Source                Destination           Protocol Length Info
     97 0.212362       3.28.2                host                  USB      27     URB_BULK out

Frame 97: 27 bytes on wire (216 bits), 27 bytes captured (216 bits) on interface \\.\USBPcap3, id 0
USB URB
    [Source: 3.28.2]
    [Destination: host]
    USBPcap pseudoheader length: 27
    IRP ID: 0xffffa387c74ad010
    IRP USBD_STATUS: USBD_STATUS_SUCCESS (0x00000000)
    URB Function: URB_FUNCTION_BULK_OR_INTERRUPT_TRANSFER (0x0009)
    IRP information: 0x01, Direction: PDO -> FDO
    URB bus id: 3
    Device address: 28
    Endpoint: 0x02, Direction: OUT
    URB transfer type: URB_BULK (0x03)
    Packet Data Length: 0
    [Request in: 96]
    [Time from request: 0.000105000 seconds]
    [bInterfaceClass: Smart Card (0x0b)]

No.     Time           Source                Destination           Protocol Length Info
     98 0.212422       host                  3.28.2                USB      27     URB_BULK in

Frame 98: 27 bytes on wire (216 bits), 27 bytes captured (216 bits) on interface \\.\USBPcap3, id 0
USB URB
    [Source: host]
    [Destination: 3.28.2]
    USBPcap pseudoheader length: 27
    IRP ID: 0xffffa387c72a6720
    IRP USBD_STATUS: USBD_STATUS_SUCCESS (0x00000000)
    URB Function: URB_FUNCTION_BULK_OR_INTERRUPT_TRANSFER (0x0009)
    IRP information: 0x00, Direction: FDO -> PDO
    URB bus id: 3
    Device address: 28
    Endpoint: 0x82, Direction: IN
    URB transfer type: URB_BULK (0x03)
    Packet Data Length: 0
    [Response in: 99]
    [bInterfaceClass: Smart Card (0x0b)]

No.     Time           Source                Destination           Protocol Length Info
     99 0.212816       3.28.2                host                  USBCCID  39     CCID Packet - Reader to PC: Data Block

Frame 99: 39 bytes on wire (312 bits), 39 bytes captured (312 bits) on interface \\.\USBPcap3, id 0
USB URB
    [Source: 3.28.2]
    [Destination: host]
    USBPcap pseudoheader length: 27
    IRP ID: 0xffffa387c72a6720
    IRP USBD_STATUS: USBD_STATUS_SUCCESS (0x00000000)
    URB Function: URB_FUNCTION_BULK_OR_INTERRUPT_TRANSFER (0x0009)
    IRP information: 0x01, Direction: PDO -> FDO
    URB bus id: 3
    Device address: 28
    Endpoint: 0x82, Direction: IN
    URB transfer type: URB_BULK (0x03)
    Packet Data Length: 12
    [Request in: 98]
    [Time from request: 0.000394000 seconds]
    [bInterfaceClass: Smart Card (0x0b)]
USB CCID
Data (2 bytes)

0000  6a 82                                             j.

No.     Time           Source                Destination           Protocol Length Info
    100 0.217594       host                  3.28.2                USBCCID  48     CCID Packet - PC to Reader: Transfer Block

Frame 100: 48 bytes on wire (384 bits), 48 bytes captured (384 bits) on interface \\.\USBPcap3, id 0
USB URB
    [Source: host]
    [Destination: 3.28.2]
    USBPcap pseudoheader length: 27
    IRP ID: 0xffffa387c74b08a0
    IRP USBD_STATUS: USBD_STATUS_SUCCESS (0x00000000)
    URB Function: URB_FUNCTION_BULK_OR_INTERRUPT_TRANSFER (0x0009)
    IRP information: 0x00, Direction: FDO -> PDO
    URB bus id: 3
    Device address: 28
    Endpoint: 0x02, Direction: OUT
    URB transfer type: URB_BULK (0x03)
    Packet Data Length: 21
    [Response in: 101]
    [bInterfaceClass: Smart Card (0x0b)]
USB CCID
Data (11 bytes)

0000  00 cb 3f ff 05 5c 03 5f c1 05 00                  ..?..\._...

No.     Time           Source                Destination           Protocol Length Info
    101 0.217711       3.28.2                host                  USB      27     URB_BULK out

Frame 101: 27 bytes on wire (216 bits), 27 bytes captured (216 bits) on interface \\.\USBPcap3, id 0
USB URB
    [Source: 3.28.2]
    [Destination: host]
    USBPcap pseudoheader length: 27
    IRP ID: 0xffffa387c74b08a0
    IRP USBD_STATUS: USBD_STATUS_SUCCESS (0x00000000)
    URB Function: URB_FUNCTION_BULK_OR_INTERRUPT_TRANSFER (0x0009)
    IRP information: 0x01, Direction: PDO -> FDO
    URB bus id: 3
    Device address: 28
    Endpoint: 0x02, Direction: OUT
    URB transfer type: URB_BULK (0x03)
    Packet Data Length: 0
    [Request in: 100]
    [Time from request: 0.000117000 seconds]
    [bInterfaceClass: Smart Card (0x0b)]

No.     Time           Source                Destination           Protocol Length Info
    102 0.217758       host                  3.28.2                USB      27     URB_BULK in

Frame 102: 27 bytes on wire (216 bits), 27 bytes captured (216 bits) on interface \\.\USBPcap3, id 0
USB URB
    [Source: host]
    [Destination: 3.28.2]
    USBPcap pseudoheader length: 27
    IRP ID: 0xffffa387c72a6720
    IRP USBD_STATUS: USBD_STATUS_SUCCESS (0x00000000)
    URB Function: URB_FUNCTION_BULK_OR_INTERRUPT_TRANSFER (0x0009)
    IRP information: 0x00, Direction: FDO -> PDO
    URB bus id: 3
    Device address: 28
    Endpoint: 0x82, Direction: IN
    URB transfer type: URB_BULK (0x03)
    Packet Data Length: 0
    [Response in: 103]
    [bInterfaceClass: Smart Card (0x0b)]

No.     Time           Source                Destination           Protocol Length Info
    103 0.218378       3.28.2                host                  USBCCID  39     CCID Packet - Reader to PC: Data Block

Frame 103: 39 bytes on wire (312 bits), 39 bytes captured (312 bits) on interface \\.\USBPcap3, id 0
USB URB
    [Source: 3.28.2]
    [Destination: host]
    USBPcap pseudoheader length: 27
    IRP ID: 0xffffa387c72a6720
    IRP USBD_STATUS: USBD_STATUS_SUCCESS (0x00000000)
    URB Function: URB_FUNCTION_BULK_OR_INTERRUPT_TRANSFER (0x0009)
    IRP information: 0x01, Direction: PDO -> FDO
    URB bus id: 3
    Device address: 28
    Endpoint: 0x82, Direction: IN
    URB transfer type: URB_BULK (0x03)
    Packet Data Length: 12
    [Request in: 102]
    [Time from request: 0.000620000 seconds]
    [bInterfaceClass: Smart Card (0x0b)]
USB CCID
Data (2 bytes)

0000  6a 82                                             j.

No.     Time           Source                Destination           Protocol Length Info
    104 0.219219       host                  3.28.2                USBCCID  48     CCID Packet - PC to Reader: Transfer Block

Frame 104: 48 bytes on wire (384 bits), 48 bytes captured (384 bits) on interface \\.\USBPcap3, id 0
USB URB
    [Source: host]
    [Destination: 3.28.2]
    USBPcap pseudoheader length: 27
    IRP ID: 0xffffa387c5615870
    IRP USBD_STATUS: USBD_STATUS_SUCCESS (0x00000000)
    URB Function: URB_FUNCTION_BULK_OR_INTERRUPT_TRANSFER (0x0009)
    IRP information: 0x00, Direction: FDO -> PDO
    URB bus id: 3
    Device address: 28
    Endpoint: 0x02, Direction: OUT
    URB transfer type: URB_BULK (0x03)
    Packet Data Length: 21
    [Response in: 105]
    [bInterfaceClass: Smart Card (0x0b)]
USB CCID
Data (11 bytes)

0000  00 cb 3f ff 05 5c 03 5f c1 0a 00                  ..?..\._...

No.     Time           Source                Destination           Protocol Length Info
    105 0.219293       3.28.2                host                  USB      27     URB_BULK out

Frame 105: 27 bytes on wire (216 bits), 27 bytes captured (216 bits) on interface \\.\USBPcap3, id 0
USB URB
    [Source: 3.28.2]
    [Destination: host]
    USBPcap pseudoheader length: 27
    IRP ID: 0xffffa387c5615870
    IRP USBD_STATUS: USBD_STATUS_SUCCESS (0x00000000)
    URB Function: URB_FUNCTION_BULK_OR_INTERRUPT_TRANSFER (0x0009)
    IRP information: 0x01, Direction: PDO -> FDO
    URB bus id: 3
    Device address: 28
    Endpoint: 0x02, Direction: OUT
    URB transfer type: URB_BULK (0x03)
    Packet Data Length: 0
    [Request in: 104]
    [Time from request: 0.000074000 seconds]
    [bInterfaceClass: Smart Card (0x0b)]

No.     Time           Source                Destination           Protocol Length Info
    106 0.219334       host                  3.28.2                USB      27     URB_BULK in

Frame 106: 27 bytes on wire (216 bits), 27 bytes captured (216 bits) on interface \\.\USBPcap3, id 0
USB URB
    [Source: host]
    [Destination: 3.28.2]
    USBPcap pseudoheader length: 27
    IRP ID: 0xffffa387c72a6720
    IRP USBD_STATUS: USBD_STATUS_SUCCESS (0x00000000)
    URB Function: URB_FUNCTION_BULK_OR_INTERRUPT_TRANSFER (0x0009)
    IRP information: 0x00, Direction: FDO -> PDO
    URB bus id: 3
    Device address: 28
    Endpoint: 0x82, Direction: IN
    URB transfer type: URB_BULK (0x03)
    Packet Data Length: 0
    [Response in: 107]
    [bInterfaceClass: Smart Card (0x0b)]

No.     Time           Source                Destination           Protocol Length Info
    107 0.219820       3.28.2                host                  USBCCID  39     CCID Packet - Reader to PC: Data Block

Frame 107: 39 bytes on wire (312 bits), 39 bytes captured (312 bits) on interface \\.\USBPcap3, id 0
USB URB
    [Source: 3.28.2]
    [Destination: host]
    USBPcap pseudoheader length: 27
    IRP ID: 0xffffa387c72a6720
    IRP USBD_STATUS: USBD_STATUS_SUCCESS (0x00000000)
    URB Function: URB_FUNCTION_BULK_OR_INTERRUPT_TRANSFER (0x0009)
    IRP information: 0x01, Direction: PDO -> FDO
    URB bus id: 3
    Device address: 28
    Endpoint: 0x82, Direction: IN
    URB transfer type: URB_BULK (0x03)
    Packet Data Length: 12
    [Request in: 106]
    [Time from request: 0.000486000 seconds]
    [bInterfaceClass: Smart Card (0x0b)]
USB CCID
Data (2 bytes)

0000  6a 82                                             j.

No.     Time           Source                Destination           Protocol Length Info
    108 0.220396       host                  3.28.2                USBCCID  48     CCID Packet - PC to Reader: Transfer Block

Frame 108: 48 bytes on wire (384 bits), 48 bytes captured (384 bits) on interface \\.\USBPcap3, id 0
USB URB
    [Source: host]
    [Destination: 3.28.2]
    USBPcap pseudoheader length: 27
    IRP ID: 0xffffa387c743d010
    IRP USBD_STATUS: USBD_STATUS_SUCCESS (0x00000000)
    URB Function: URB_FUNCTION_BULK_OR_INTERRUPT_TRANSFER (0x0009)
    IRP information: 0x00, Direction: FDO -> PDO
    URB bus id: 3
    Device address: 28
    Endpoint: 0x02, Direction: OUT
    URB transfer type: URB_BULK (0x03)
    Packet Data Length: 21
    [Response in: 109]
    [bInterfaceClass: Smart Card (0x0b)]
USB CCID
Data (11 bytes)

0000  00 cb 3f ff 05 5c 03 5f c1 0b 00                  ..?..\._...

No.     Time           Source                Destination           Protocol Length Info
    109 0.220480       3.28.2                host                  USB      27     URB_BULK out

Frame 109: 27 bytes on wire (216 bits), 27 bytes captured (216 bits) on interface \\.\USBPcap3, id 0
USB URB
    [Source: 3.28.2]
    [Destination: host]
    USBPcap pseudoheader length: 27
    IRP ID: 0xffffa387c743d010
    IRP USBD_STATUS: USBD_STATUS_SUCCESS (0x00000000)
    URB Function: URB_FUNCTION_BULK_OR_INTERRUPT_TRANSFER (0x0009)
    IRP information: 0x01, Direction: PDO -> FDO
    URB bus id: 3
    Device address: 28
    Endpoint: 0x02, Direction: OUT
    URB transfer type: URB_BULK (0x03)
    Packet Data Length: 0
    [Request in: 108]
    [Time from request: 0.000084000 seconds]
    [bInterfaceClass: Smart Card (0x0b)]

No.     Time           Source                Destination           Protocol Length Info
    110 0.220527       host                  3.28.2                USB      27     URB_BULK in

Frame 110: 27 bytes on wire (216 bits), 27 bytes captured (216 bits) on interface \\.\USBPcap3, id 0
USB URB
    [Source: host]
    [Destination: 3.28.2]
    USBPcap pseudoheader length: 27
    IRP ID: 0xffffa387c72a6720
    IRP USBD_STATUS: USBD_STATUS_SUCCESS (0x00000000)
    URB Function: URB_FUNCTION_BULK_OR_INTERRUPT_TRANSFER (0x0009)
    IRP information: 0x00, Direction: FDO -> PDO
    URB bus id: 3
    Device address: 28
    Endpoint: 0x82, Direction: IN
    URB transfer type: URB_BULK (0x03)
    Packet Data Length: 0
    [Response in: 111]
    [bInterfaceClass: Smart Card (0x0b)]

No.     Time           Source                Destination           Protocol Length Info
    111 0.220957       3.28.2                host                  USBCCID  39     CCID Packet - Reader to PC: Data Block

Frame 111: 39 bytes on wire (312 bits), 39 bytes captured (312 bits) on interface \\.\USBPcap3, id 0
USB URB
    [Source: 3.28.2]
    [Destination: host]
    USBPcap pseudoheader length: 27
    IRP ID: 0xffffa387c72a6720
    IRP USBD_STATUS: USBD_STATUS_SUCCESS (0x00000000)
    URB Function: URB_FUNCTION_BULK_OR_INTERRUPT_TRANSFER (0x0009)
    IRP information: 0x01, Direction: PDO -> FDO
    URB bus id: 3
    Device address: 28
    Endpoint: 0x82, Direction: IN
    URB transfer type: URB_BULK (0x03)
    Packet Data Length: 12
    [Request in: 110]
    [Time from request: 0.000430000 seconds]
    [bInterfaceClass: Smart Card (0x0b)]
USB CCID
Data (2 bytes)

0000  6a 82                                             j.

No.     Time           Source                Destination           Protocol Length Info
    112 0.221653       host                  3.28.2                USBCCID  48     CCID Packet - PC to Reader: Transfer Block

Frame 112: 48 bytes on wire (384 bits), 48 bytes captured (384 bits) on interface \\.\USBPcap3, id 0
USB URB
    [Source: host]
    [Destination: 3.28.2]
    USBPcap pseudoheader length: 27
    IRP ID: 0xffffa387c7444010
    IRP USBD_STATUS: USBD_STATUS_SUCCESS (0x00000000)
    URB Function: URB_FUNCTION_BULK_OR_INTERRUPT_TRANSFER (0x0009)
    IRP information: 0x00, Direction: FDO -> PDO
    URB bus id: 3
    Device address: 28
    Endpoint: 0x02, Direction: OUT
    URB transfer type: URB_BULK (0x03)
    Packet Data Length: 21
    [Response in: 113]
    [bInterfaceClass: Smart Card (0x0b)]
USB CCID
Data (11 bytes)

0000  00 cb 3f ff 05 5c 03 5f c1 01 00                  ..?..\._...

No.     Time           Source                Destination           Protocol Length Info
    113 0.221714       3.28.2                host                  USB      27     URB_BULK out

Frame 113: 27 bytes on wire (216 bits), 27 bytes captured (216 bits) on interface \\.\USBPcap3, id 0
USB URB
    [Source: 3.28.2]
    [Destination: host]
    USBPcap pseudoheader length: 27
    IRP ID: 0xffffa387c7444010
    IRP USBD_STATUS: USBD_STATUS_SUCCESS (0x00000000)
    URB Function: URB_FUNCTION_BULK_OR_INTERRUPT_TRANSFER (0x0009)
    IRP information: 0x01, Direction: PDO -> FDO
    URB bus id: 3
    Device address: 28
    Endpoint: 0x02, Direction: OUT
    URB transfer type: URB_BULK (0x03)
    Packet Data Length: 0
    [Request in: 112]
    [Time from request: 0.000061000 seconds]
    [bInterfaceClass: Smart Card (0x0b)]

No.     Time           Source                Destination           Protocol Length Info
    114 0.221791       host                  3.28.2                USB      27     URB_BULK in

Frame 114: 27 bytes on wire (216 bits), 27 bytes captured (216 bits) on interface \\.\USBPcap3, id 0
USB URB
    [Source: host]
    [Destination: 3.28.2]
    USBPcap pseudoheader length: 27
    IRP ID: 0xffffa387c72a6720
    IRP USBD_STATUS: USBD_STATUS_SUCCESS (0x00000000)
    URB Function: URB_FUNCTION_BULK_OR_INTERRUPT_TRANSFER (0x0009)
    IRP information: 0x00, Direction: FDO -> PDO
    URB bus id: 3
    Device address: 28
    Endpoint: 0x82, Direction: IN
    URB transfer type: URB_BULK (0x03)
    Packet Data Length: 0
    [Response in: 115]
    [bInterfaceClass: Smart Card (0x0b)]

No.     Time           Source                Destination           Protocol Length Info
    115 0.222379       3.28.2                host                  USBCCID  39     CCID Packet - Reader to PC: Data Block

Frame 115: 39 bytes on wire (312 bits), 39 bytes captured (312 bits) on interface \\.\USBPcap3, id 0
USB URB
    [Source: 3.28.2]
    [Destination: host]
    USBPcap pseudoheader length: 27
    IRP ID: 0xffffa387c72a6720
    IRP USBD_STATUS: USBD_STATUS_SUCCESS (0x00000000)
    URB Function: URB_FUNCTION_BULK_OR_INTERRUPT_TRANSFER (0x0009)
    IRP information: 0x01, Direction: PDO -> FDO
    URB bus id: 3
    Device address: 28
    Endpoint: 0x82, Direction: IN
    URB transfer type: URB_BULK (0x03)
    Packet Data Length: 12
    [Request in: 114]
    [Time from request: 0.000588000 seconds]
    [bInterfaceClass: Smart Card (0x0b)]
USB CCID
Data (2 bytes)

0000  6a 82                                             j.

No.     Time           Source                Destination           Protocol Length Info
    116 0.222625       host                  3.28.2                USBCCID  48     CCID Packet - PC to Reader: Transfer Block

Frame 116: 48 bytes on wire (384 bits), 48 bytes captured (384 bits) on interface \\.\USBPcap3, id 0
USB URB
    [Source: host]
    [Destination: 3.28.2]
    USBPcap pseudoheader length: 27
    IRP ID: 0xffffa387c72aa010
    IRP USBD_STATUS: USBD_STATUS_SUCCESS (0x00000000)
    URB Function: URB_FUNCTION_BULK_OR_INTERRUPT_TRANSFER (0x0009)
    IRP information: 0x00, Direction: FDO -> PDO
    URB bus id: 3
    Device address: 28
    Endpoint: 0x02, Direction: OUT
    URB transfer type: URB_BULK (0x03)
    Packet Data Length: 21
    [Response in: 117]
    [bInterfaceClass: Smart Card (0x0b)]
USB CCID
Data (11 bytes)

0000  00 cb 3f ff 05 5c 03 5f c1 0c 00                  ..?..\._...

No.     Time           Source                Destination           Protocol Length Info
    117 0.222721       3.28.2                host                  USB      27     URB_BULK out

Frame 117: 27 bytes on wire (216 bits), 27 bytes captured (216 bits) on interface \\.\USBPcap3, id 0
USB URB
    [Source: 3.28.2]
    [Destination: host]
    USBPcap pseudoheader length: 27
    IRP ID: 0xffffa387c72aa010
    IRP USBD_STATUS: USBD_STATUS_SUCCESS (0x00000000)
    URB Function: URB_FUNCTION_BULK_OR_INTERRUPT_TRANSFER (0x0009)
    IRP information: 0x01, Direction: PDO -> FDO
    URB bus id: 3
    Device address: 28
    Endpoint: 0x02, Direction: OUT
    URB transfer type: URB_BULK (0x03)
    Packet Data Length: 0
    [Request in: 116]
    [Time from request: 0.000096000 seconds]
    [bInterfaceClass: Smart Card (0x0b)]

No.     Time           Source                Destination           Protocol Length Info
    118 0.222779       host                  3.28.2                USB      27     URB_BULK in

Frame 118: 27 bytes on wire (216 bits), 27 bytes captured (216 bits) on interface \\.\USBPcap3, id 0
USB URB
    [Source: host]
    [Destination: 3.28.2]
    USBPcap pseudoheader length: 27
    IRP ID: 0xffffa387c72a6720
    IRP USBD_STATUS: USBD_STATUS_SUCCESS (0x00000000)
    URB Function: URB_FUNCTION_BULK_OR_INTERRUPT_TRANSFER (0x0009)
    IRP information: 0x00, Direction: FDO -> PDO
    URB bus id: 3
    Device address: 28
    Endpoint: 0x82, Direction: IN
    URB transfer type: URB_BULK (0x03)
    Packet Data Length: 0
    [Response in: 119]
    [bInterfaceClass: Smart Card (0x0b)]

No.     Time           Source                Destination           Protocol Length Info
    119 0.223376       3.28.2                host                  USBCCID  39     CCID Packet - Reader to PC: Data Block

Frame 119: 39 bytes on wire (312 bits), 39 bytes captured (312 bits) on interface \\.\USBPcap3, id 0
USB URB
    [Source: 3.28.2]
    [Destination: host]
    USBPcap pseudoheader length: 27
    IRP ID: 0xffffa387c72a6720
    IRP USBD_STATUS: USBD_STATUS_SUCCESS (0x00000000)
    URB Function: URB_FUNCTION_BULK_OR_INTERRUPT_TRANSFER (0x0009)
    IRP information: 0x01, Direction: PDO -> FDO
    URB bus id: 3
    Device address: 28
    Endpoint: 0x82, Direction: IN
    URB transfer type: URB_BULK (0x03)
    Packet Data Length: 12
    [Request in: 118]
    [Time from request: 0.000597000 seconds]
    [bInterfaceClass: Smart Card (0x0b)]
USB CCID
Data (2 bytes)

0000  6a 82                                             j.

No.     Time           Source                Destination           Protocol Length Info
    120 0.232088       host                  3.28.2                USBCCID  51     CCID Packet - PC to Reader: Transfer Block

Frame 120: 51 bytes on wire (408 bits), 51 bytes captured (408 bits) on interface \\.\USBPcap3, id 0
USB URB
    [Source: host]
    [Destination: 3.28.2]
    USBPcap pseudoheader length: 27
    IRP ID: 0xffffa387c743f010
    IRP USBD_STATUS: USBD_STATUS_SUCCESS (0x00000000)
    URB Function: URB_FUNCTION_BULK_OR_INTERRUPT_TRANSFER (0x0009)
    IRP information: 0x00, Direction: FDO -> PDO
    URB bus id: 3
    Device address: 28
    Endpoint: 0x02, Direction: OUT
    URB transfer type: URB_BULK (0x03)
    Packet Data Length: 24
    [Response in: 121]
    [bInterfaceClass: Smart Card (0x0b)]
USB CCID
Data (14 bytes)

0000  00 a4 04 00 09 a0 00 00 03 08 00 00 10 00         ..............

No.     Time           Source                Destination           Protocol Length Info
    121 0.232182       3.28.2                host                  USB      27     URB_BULK out

Frame 121: 27 bytes on wire (216 bits), 27 bytes captured (216 bits) on interface \\.\USBPcap3, id 0
USB URB
    [Source: 3.28.2]
    [Destination: host]
    USBPcap pseudoheader length: 27
    IRP ID: 0xffffa387c743f010
    IRP USBD_STATUS: USBD_STATUS_SUCCESS (0x00000000)
    URB Function: URB_FUNCTION_BULK_OR_INTERRUPT_TRANSFER (0x0009)
    IRP information: 0x01, Direction: PDO -> FDO
    URB bus id: 3
    Device address: 28
    Endpoint: 0x02, Direction: OUT
    URB transfer type: URB_BULK (0x03)
    Packet Data Length: 0
    [Request in: 120]
    [Time from request: 0.000094000 seconds]
    [bInterfaceClass: Smart Card (0x0b)]

No.     Time           Source                Destination           Protocol Length Info
    122 0.232232       host                  3.28.2                USB      27     URB_BULK in

Frame 122: 27 bytes on wire (216 bits), 27 bytes captured (216 bits) on interface \\.\USBPcap3, id 0
USB URB
    [Source: host]
    [Destination: 3.28.2]
    USBPcap pseudoheader length: 27
    IRP ID: 0xffffa387c72a6720
    IRP USBD_STATUS: USBD_STATUS_SUCCESS (0x00000000)
    URB Function: URB_FUNCTION_BULK_OR_INTERRUPT_TRANSFER (0x0009)
    IRP information: 0x00, Direction: FDO -> PDO
    URB bus id: 3
    Device address: 28
    Endpoint: 0x82, Direction: IN
    URB transfer type: URB_BULK (0x03)
    Packet Data Length: 0
    [Response in: 123]
    [bInterfaceClass: Smart Card (0x0b)]

No.     Time           Source                Destination           Protocol Length Info
    123 0.233394       3.28.2                host                  USBCCID  58     CCID Packet - Reader to PC: Data Block

Frame 123: 58 bytes on wire (464 bits), 58 bytes captured (464 bits) on interface \\.\USBPcap3, id 0
USB URB
    [Source: 3.28.2]
    [Destination: host]
    USBPcap pseudoheader length: 27
    IRP ID: 0xffffa387c72a6720
    IRP USBD_STATUS: USBD_STATUS_SUCCESS (0x00000000)
    URB Function: URB_FUNCTION_BULK_OR_INTERRUPT_TRANSFER (0x0009)
    IRP information: 0x01, Direction: PDO -> FDO
    URB bus id: 3
    Device address: 28
    Endpoint: 0x82, Direction: IN
    URB transfer type: URB_BULK (0x03)
    Packet Data Length: 31
    [Request in: 122]
    [Time from request: 0.001162000 seconds]
    [bInterfaceClass: Smart Card (0x0b)]
USB CCID
Data (21 bytes)

0000  61 11 4f 06 00 00 10 00 01 00 79 07 4f 05 a0 00   a.O.......y.O...
0010  00 03 08 90 00                                    .....

No.     Time           Source                Destination           Protocol Length Info
    124 0.233676       host                  3.28.2                USBCCID  48     CCID Packet - PC to Reader: Transfer Block

Frame 124: 48 bytes on wire (384 bits), 48 bytes captured (384 bits) on interface \\.\USBPcap3, id 0
USB URB
    [Source: host]
    [Destination: 3.28.2]
    USBPcap pseudoheader length: 27
    IRP ID: 0xffffa387c74b08a0
    IRP USBD_STATUS: USBD_STATUS_SUCCESS (0x00000000)
    URB Function: URB_FUNCTION_BULK_OR_INTERRUPT_TRANSFER (0x0009)
    IRP information: 0x00, Direction: FDO -> PDO
    URB bus id: 3
    Device address: 28
    Endpoint: 0x02, Direction: OUT
    URB transfer type: URB_BULK (0x03)
    Packet Data Length: 21
    [Response in: 125]
    [bInterfaceClass: Smart Card (0x0b)]
USB CCID
Data (11 bytes)

0000  00 cb 3f ff 05 5c 03 5f c1 02 00                  ..?..\._...

No.     Time           Source                Destination           Protocol Length Info
    125 0.233805       3.28.2                host                  USB      27     URB_BULK out

Frame 125: 27 bytes on wire (216 bits), 27 bytes captured (216 bits) on interface \\.\USBPcap3, id 0
USB URB
    [Source: 3.28.2]
    [Destination: host]
    USBPcap pseudoheader length: 27
    IRP ID: 0xffffa387c74b08a0
    IRP USBD_STATUS: USBD_STATUS_SUCCESS (0x00000000)
    URB Function: URB_FUNCTION_BULK_OR_INTERRUPT_TRANSFER (0x0009)
    IRP information: 0x01, Direction: PDO -> FDO
    URB bus id: 3
    Device address: 28
    Endpoint: 0x02, Direction: OUT
    URB transfer type: URB_BULK (0x03)
    Packet Data Length: 0
    [Request in: 124]
    [Time from request: 0.000129000 seconds]
    [bInterfaceClass: Smart Card (0x0b)]

No.     Time           Source                Destination           Protocol Length Info
    126 0.233860       host                  3.28.2                USB      27     URB_BULK in

Frame 126: 27 bytes on wire (216 bits), 27 bytes captured (216 bits) on interface \\.\USBPcap3, id 0
USB URB
    [Source: host]
    [Destination: 3.28.2]
    USBPcap pseudoheader length: 27
    IRP ID: 0xffffa387c72a6720
    IRP USBD_STATUS: USBD_STATUS_SUCCESS (0x00000000)
    URB Function: URB_FUNCTION_BULK_OR_INTERRUPT_TRANSFER (0x0009)
    IRP information: 0x00, Direction: FDO -> PDO
    URB bus id: 3
    Device address: 28
    Endpoint: 0x82, Direction: IN
    URB transfer type: URB_BULK (0x03)
    Packet Data Length: 0
    [Response in: 127]
    [bInterfaceClass: Smart Card (0x0b)]

No.     Time           Source                Destination           Protocol Length Info
    127 0.234396       3.28.2                host                  USBCCID  39     CCID Packet - Reader to PC: Data Block

Frame 127: 39 bytes on wire (312 bits), 39 bytes captured (312 bits) on interface \\.\USBPcap3, id 0
USB URB
    [Source: 3.28.2]
    [Destination: host]
    USBPcap pseudoheader length: 27
    IRP ID: 0xffffa387c72a6720
    IRP USBD_STATUS: USBD_STATUS_SUCCESS (0x00000000)
    URB Function: URB_FUNCTION_BULK_OR_INTERRUPT_TRANSFER (0x0009)
    IRP information: 0x01, Direction: PDO -> FDO
    URB bus id: 3
    Device address: 28
    Endpoint: 0x82, Direction: IN
    URB transfer type: URB_BULK (0x03)
    Packet Data Length: 12
    [Request in: 126]
    [Time from request: 0.000536000 seconds]
    [bInterfaceClass: Smart Card (0x0b)]
USB CCID
Data (2 bytes)

0000  6a 82                                             j.

No.     Time           Source                Destination           Protocol Length Info
    128 0.238526       host                  3.28.2                USBCCID  48     CCID Packet - PC to Reader: Transfer Block

Frame 128: 48 bytes on wire (384 bits), 48 bytes captured (384 bits) on interface \\.\USBPcap3, id 0
USB URB
    [Source: host]
    [Destination: 3.28.2]
    USBPcap pseudoheader length: 27
    IRP ID: 0xffffa387c74ad010
    IRP USBD_STATUS: USBD_STATUS_SUCCESS (0x00000000)
    URB Function: URB_FUNCTION_BULK_OR_INTERRUPT_TRANSFER (0x0009)
    IRP information: 0x00, Direction: FDO -> PDO
    URB bus id: 3
    Device address: 28
    Endpoint: 0x02, Direction: OUT
    URB transfer type: URB_BULK (0x03)
    Packet Data Length: 21
    [Response in: 129]
    [bInterfaceClass: Smart Card (0x0b)]
USB CCID
Data (11 bytes)

0000  00 cb 3f ff 05 5c 03 5f c1 05 00                  ..?..\._...

No.     Time           Source                Destination           Protocol Length Info
    129 0.238609       3.28.2                host                  USB      27     URB_BULK out

Frame 129: 27 bytes on wire (216 bits), 27 bytes captured (216 bits) on interface \\.\USBPcap3, id 0
USB URB
    [Source: 3.28.2]
    [Destination: host]
    USBPcap pseudoheader length: 27
    IRP ID: 0xffffa387c74ad010
    IRP USBD_STATUS: USBD_STATUS_SUCCESS (0x00000000)
    URB Function: URB_FUNCTION_BULK_OR_INTERRUPT_TRANSFER (0x0009)
    IRP information: 0x01, Direction: PDO -> FDO
    URB bus id: 3
    Device address: 28
    Endpoint: 0x02, Direction: OUT
    URB transfer type: URB_BULK (0x03)
    Packet Data Length: 0
    [Request in: 128]
    [Time from request: 0.000083000 seconds]
    [bInterfaceClass: Smart Card (0x0b)]

No.     Time           Source                Destination           Protocol Length Info
    130 0.238661       host                  3.28.2                USB      27     URB_BULK in

Frame 130: 27 bytes on wire (216 bits), 27 bytes captured (216 bits) on interface \\.\USBPcap3, id 0
USB URB
    [Source: host]
    [Destination: 3.28.2]
    USBPcap pseudoheader length: 27
    IRP ID: 0xffffa387c72a6720
    IRP USBD_STATUS: USBD_STATUS_SUCCESS (0x00000000)
    URB Function: URB_FUNCTION_BULK_OR_INTERRUPT_TRANSFER (0x0009)
    IRP information: 0x00, Direction: FDO -> PDO
    URB bus id: 3
    Device address: 28
    Endpoint: 0x82, Direction: IN
    URB transfer type: URB_BULK (0x03)
    Packet Data Length: 0
    [Response in: 131]
    [bInterfaceClass: Smart Card (0x0b)]

No.     Time           Source                Destination           Protocol Length Info
    131 0.239380       3.28.2                host                  USBCCID  39     CCID Packet - Reader to PC: Data Block

Frame 131: 39 bytes on wire (312 bits), 39 bytes captured (312 bits) on interface \\.\USBPcap3, id 0
USB URB
    [Source: 3.28.2]
    [Destination: host]
    USBPcap pseudoheader length: 27
    IRP ID: 0xffffa387c72a6720
    IRP USBD_STATUS: USBD_STATUS_SUCCESS (0x00000000)
    URB Function: URB_FUNCTION_BULK_OR_INTERRUPT_TRANSFER (0x0009)
    IRP information: 0x01, Direction: PDO -> FDO
    URB bus id: 3
    Device address: 28
    Endpoint: 0x82, Direction: IN
    URB transfer type: URB_BULK (0x03)
    Packet Data Length: 12
    [Request in: 130]
    [Time from request: 0.000719000 seconds]
    [bInterfaceClass: Smart Card (0x0b)]
USB CCID
Data (2 bytes)

0000  6a 82                                             j.

No.     Time           Source                Destination           Protocol Length Info
    132 0.240132       host                  3.28.2                USBCCID  48     CCID Packet - PC to Reader: Transfer Block

Frame 132: 48 bytes on wire (384 bits), 48 bytes captured (384 bits) on interface \\.\USBPcap3, id 0
USB URB
    [Source: host]
    [Destination: 3.28.2]
    USBPcap pseudoheader length: 27
    IRP ID: 0xffffa387c7442010
    IRP USBD_STATUS: USBD_STATUS_SUCCESS (0x00000000)
    URB Function: URB_FUNCTION_BULK_OR_INTERRUPT_TRANSFER (0x0009)
    IRP information: 0x00, Direction: FDO -> PDO
    URB bus id: 3
    Device address: 28
    Endpoint: 0x02, Direction: OUT
    URB transfer type: URB_BULK (0x03)
    Packet Data Length: 21
    [Response in: 133]
    [bInterfaceClass: Smart Card (0x0b)]
USB CCID
Data (11 bytes)

0000  00 cb 3f ff 05 5c 03 5f c1 0a 00                  ..?..\._...

No.     Time           Source                Destination           Protocol Length Info
    133 0.240238       3.28.2                host                  USB      27     URB_BULK out

Frame 133: 27 bytes on wire (216 bits), 27 bytes captured (216 bits) on interface \\.\USBPcap3, id 0
USB URB
    [Source: 3.28.2]
    [Destination: host]
    USBPcap pseudoheader length: 27
    IRP ID: 0xffffa387c7442010
    IRP USBD_STATUS: USBD_STATUS_SUCCESS (0x00000000)
    URB Function: URB_FUNCTION_BULK_OR_INTERRUPT_TRANSFER (0x0009)
    IRP information: 0x01, Direction: PDO -> FDO
    URB bus id: 3
    Device address: 28
    Endpoint: 0x02, Direction: OUT
    URB transfer type: URB_BULK (0x03)
    Packet Data Length: 0
    [Request in: 132]
    [Time from request: 0.000106000 seconds]
    [bInterfaceClass: Smart Card (0x0b)]

No.     Time           Source                Destination           Protocol Length Info
    134 0.240294       host                  3.28.2                USB      27     URB_BULK in

Frame 134: 27 bytes on wire (216 bits), 27 bytes captured (216 bits) on interface \\.\USBPcap3, id 0
USB URB
    [Source: host]
    [Destination: 3.28.2]
    USBPcap pseudoheader length: 27
    IRP ID: 0xffffa387c72a6720
    IRP USBD_STATUS: USBD_STATUS_SUCCESS (0x00000000)
    URB Function: URB_FUNCTION_BULK_OR_INTERRUPT_TRANSFER (0x0009)
    IRP information: 0x00, Direction: FDO -> PDO
    URB bus id: 3
    Device address: 28
    Endpoint: 0x82, Direction: IN
    URB transfer type: URB_BULK (0x03)
    Packet Data Length: 0
    [Response in: 135]
    [bInterfaceClass: Smart Card (0x0b)]

No.     Time           Source                Destination           Protocol Length Info
    135 0.240833       3.28.2                host                  USBCCID  39     CCID Packet - Reader to PC: Data Block

Frame 135: 39 bytes on wire (312 bits), 39 bytes captured (312 bits) on interface \\.\USBPcap3, id 0
USB URB
    [Source: 3.28.2]
    [Destination: host]
    USBPcap pseudoheader length: 27
    IRP ID: 0xffffa387c72a6720
    IRP USBD_STATUS: USBD_STATUS_SUCCESS (0x00000000)
    URB Function: URB_FUNCTION_BULK_OR_INTERRUPT_TRANSFER (0x0009)
    IRP information: 0x01, Direction: PDO -> FDO
    URB bus id: 3
    Device address: 28
    Endpoint: 0x82, Direction: IN
    URB transfer type: URB_BULK (0x03)
    Packet Data Length: 12
    [Request in: 134]
    [Time from request: 0.000539000 seconds]
    [bInterfaceClass: Smart Card (0x0b)]
USB CCID
Data (2 bytes)

0000  6a 82                                             j.

No.     Time           Source                Destination           Protocol Length Info
    136 0.241620       host                  3.28.2                USBCCID  48     CCID Packet - PC to Reader: Transfer Block

Frame 136: 48 bytes on wire (384 bits), 48 bytes captured (384 bits) on interface \\.\USBPcap3, id 0
USB URB
    [Source: host]
    [Destination: 3.28.2]
    USBPcap pseudoheader length: 27
    IRP ID: 0xffffa387c74c0620
    IRP USBD_STATUS: USBD_STATUS_SUCCESS (0x00000000)
    URB Function: URB_FUNCTION_BULK_OR_INTERRUPT_TRANSFER (0x0009)
    IRP information: 0x00, Direction: FDO -> PDO
    URB bus id: 3
    Device address: 28
    Endpoint: 0x02, Direction: OUT
    URB transfer type: URB_BULK (0x03)
    Packet Data Length: 21
    [Response in: 137]
    [bInterfaceClass: Smart Card (0x0b)]
USB CCID
Data (11 bytes)

0000  00 cb 3f ff 05 5c 03 5f c1 0b 00                  ..?..\._...

No.     Time           Source                Destination           Protocol Length Info
    137 0.241714       3.28.2                host                  USB      27     URB_BULK out

Frame 137: 27 bytes on wire (216 bits), 27 bytes captured (216 bits) on interface \\.\USBPcap3, id 0
USB URB
    [Source: 3.28.2]
    [Destination: host]
    USBPcap pseudoheader length: 27
    IRP ID: 0xffffa387c74c0620
    IRP USBD_STATUS: USBD_STATUS_SUCCESS (0x00000000)
    URB Function: URB_FUNCTION_BULK_OR_INTERRUPT_TRANSFER (0x0009)
    IRP information: 0x01, Direction: PDO -> FDO
    URB bus id: 3
    Device address: 28
    Endpoint: 0x02, Direction: OUT
    URB transfer type: URB_BULK (0x03)
    Packet Data Length: 0
    [Request in: 136]
    [Time from request: 0.000094000 seconds]
    [bInterfaceClass: Smart Card (0x0b)]

No.     Time           Source                Destination           Protocol Length Info
    138 0.241774       host                  3.28.2                USB      27     URB_BULK in

Frame 138: 27 bytes on wire (216 bits), 27 bytes captured (216 bits) on interface \\.\USBPcap3, id 0
USB URB
    [Source: host]
    [Destination: 3.28.2]
    USBPcap pseudoheader length: 27
    IRP ID: 0xffffa387c72a6720
    IRP USBD_STATUS: USBD_STATUS_SUCCESS (0x00000000)
    URB Function: URB_FUNCTION_BULK_OR_INTERRUPT_TRANSFER (0x0009)
    IRP information: 0x00, Direction: FDO -> PDO
    URB bus id: 3
    Device address: 28
    Endpoint: 0x82, Direction: IN
    URB transfer type: URB_BULK (0x03)
    Packet Data Length: 0
    [Response in: 139]
    [bInterfaceClass: Smart Card (0x0b)]

No.     Time           Source                Destination           Protocol Length Info
    139 0.242381       3.28.2                host                  USBCCID  39     CCID Packet - Reader to PC: Data Block

Frame 139: 39 bytes on wire (312 bits), 39 bytes captured (312 bits) on interface \\.\USBPcap3, id 0
USB URB
    [Source: 3.28.2]
    [Destination: host]
    USBPcap pseudoheader length: 27
    IRP ID: 0xffffa387c72a6720
    IRP USBD_STATUS: USBD_STATUS_SUCCESS (0x00000000)
    URB Function: URB_FUNCTION_BULK_OR_INTERRUPT_TRANSFER (0x0009)
    IRP information: 0x01, Direction: PDO -> FDO
    URB bus id: 3
    Device address: 28
    Endpoint: 0x82, Direction: IN
    URB transfer type: URB_BULK (0x03)
    Packet Data Length: 12
    [Request in: 138]
    [Time from request: 0.000607000 seconds]
    [bInterfaceClass: Smart Card (0x0b)]
USB CCID
Data (2 bytes)

0000  6a 82                                             j.

No.     Time           Source                Destination           Protocol Length Info
    140 0.243110       host                  3.28.2                USBCCID  48     CCID Packet - PC to Reader: Transfer Block

Frame 140: 48 bytes on wire (384 bits), 48 bytes captured (384 bits) on interface \\.\USBPcap3, id 0
USB URB
    [Source: host]
    [Destination: 3.28.2]
    USBPcap pseudoheader length: 27
    IRP ID: 0xffffa387c74c1620
    IRP USBD_STATUS: USBD_STATUS_SUCCESS (0x00000000)
    URB Function: URB_FUNCTION_BULK_OR_INTERRUPT_TRANSFER (0x0009)
    IRP information: 0x00, Direction: FDO -> PDO
    URB bus id: 3
    Device address: 28
    Endpoint: 0x02, Direction: OUT
    URB transfer type: URB_BULK (0x03)
    Packet Data Length: 21
    [Response in: 141]
    [bInterfaceClass: Smart Card (0x0b)]
USB CCID
Data (11 bytes)

0000  00 cb 3f ff 05 5c 03 5f c1 01 00                  ..?..\._...

No.     Time           Source                Destination           Protocol Length Info
    141 0.243257       3.28.2                host                  USB      27     URB_BULK out

Frame 141: 27 bytes on wire (216 bits), 27 bytes captured (216 bits) on interface \\.\USBPcap3, id 0
USB URB
    [Source: 3.28.2]
    [Destination: host]
    USBPcap pseudoheader length: 27
    IRP ID: 0xffffa387c74c1620
    IRP USBD_STATUS: USBD_STATUS_SUCCESS (0x00000000)
    URB Function: URB_FUNCTION_BULK_OR_INTERRUPT_TRANSFER (0x0009)
    IRP information: 0x01, Direction: PDO -> FDO
    URB bus id: 3
    Device address: 28
    Endpoint: 0x02, Direction: OUT
    URB transfer type: URB_BULK (0x03)
    Packet Data Length: 0
    [Request in: 140]
    [Time from request: 0.000147000 seconds]
    [bInterfaceClass: Smart Card (0x0b)]

No.     Time           Source                Destination           Protocol Length Info
    142 0.243313       host                  3.28.2                USB      27     URB_BULK in

Frame 142: 27 bytes on wire (216 bits), 27 bytes captured (216 bits) on interface \\.\USBPcap3, id 0
USB URB
    [Source: host]
    [Destination: 3.28.2]
    USBPcap pseudoheader length: 27
    IRP ID: 0xffffa387c72a6720
    IRP USBD_STATUS: USBD_STATUS_SUCCESS (0x00000000)
    URB Function: URB_FUNCTION_BULK_OR_INTERRUPT_TRANSFER (0x0009)
    IRP information: 0x00, Direction: FDO -> PDO
    URB bus id: 3
    Device address: 28
    Endpoint: 0x82, Direction: IN
    URB transfer type: URB_BULK (0x03)
    Packet Data Length: 0
    [Response in: 143]
    [bInterfaceClass: Smart Card (0x0b)]

No.     Time           Source                Destination           Protocol Length Info
    143 0.243826       3.28.2                host                  USBCCID  39     CCID Packet - Reader to PC: Data Block

Frame 143: 39 bytes on wire (312 bits), 39 bytes captured (312 bits) on interface \\.\USBPcap3, id 0
USB URB
    [Source: 3.28.2]
    [Destination: host]
    USBPcap pseudoheader length: 27
    IRP ID: 0xffffa387c72a6720
    IRP USBD_STATUS: USBD_STATUS_SUCCESS (0x00000000)
    URB Function: URB_FUNCTION_BULK_OR_INTERRUPT_TRANSFER (0x0009)
    IRP information: 0x01, Direction: PDO -> FDO
    URB bus id: 3
    Device address: 28
    Endpoint: 0x82, Direction: IN
    URB transfer type: URB_BULK (0x03)
    Packet Data Length: 12
    [Request in: 142]
    [Time from request: 0.000513000 seconds]
    [bInterfaceClass: Smart Card (0x0b)]
USB CCID
Data (2 bytes)

0000  6a 82                                             j.

No.     Time           Source                Destination           Protocol Length Info
    144 0.244094       host                  3.28.2                USBCCID  48     CCID Packet - PC to Reader: Transfer Block

Frame 144: 48 bytes on wire (384 bits), 48 bytes captured (384 bits) on interface \\.\USBPcap3, id 0
USB URB
    [Source: host]
    [Destination: 3.28.2]
    USBPcap pseudoheader length: 27
    IRP ID: 0xffffa387c74c2620
    IRP USBD_STATUS: USBD_STATUS_SUCCESS (0x00000000)
    URB Function: URB_FUNCTION_BULK_OR_INTERRUPT_TRANSFER (0x0009)
    IRP information: 0x00, Direction: FDO -> PDO
    URB bus id: 3
    Device address: 28
    Endpoint: 0x02, Direction: OUT
    URB transfer type: URB_BULK (0x03)
    Packet Data Length: 21
    [Response in: 145]
    [bInterfaceClass: Smart Card (0x0b)]
USB CCID
Data (11 bytes)

0000  00 cb 3f ff 05 5c 03 5f c1 0c 00                  ..?..\._...

No.     Time           Source                Destination           Protocol Length Info
    145 0.244186       3.28.2                host                  USB      27     URB_BULK out

Frame 145: 27 bytes on wire (216 bits), 27 bytes captured (216 bits) on interface \\.\USBPcap3, id 0
USB URB
    [Source: 3.28.2]
    [Destination: host]
    USBPcap pseudoheader length: 27
    IRP ID: 0xffffa387c74c2620
    IRP USBD_STATUS: USBD_STATUS_SUCCESS (0x00000000)
    URB Function: URB_FUNCTION_BULK_OR_INTERRUPT_TRANSFER (0x0009)
    IRP information: 0x01, Direction: PDO -> FDO
    URB bus id: 3
    Device address: 28
    Endpoint: 0x02, Direction: OUT
    URB transfer type: URB_BULK (0x03)
    Packet Data Length: 0
    [Request in: 144]
    [Time from request: 0.000092000 seconds]
    [bInterfaceClass: Smart Card (0x0b)]

No.     Time           Source                Destination           Protocol Length Info
    146 0.244250       host                  3.28.2                USB      27     URB_BULK in

Frame 146: 27 bytes on wire (216 bits), 27 bytes captured (216 bits) on interface \\.\USBPcap3, id 0
USB URB
    [Source: host]
    [Destination: 3.28.2]
    USBPcap pseudoheader length: 27
    IRP ID: 0xffffa387c72a6720
    IRP USBD_STATUS: USBD_STATUS_SUCCESS (0x00000000)
    URB Function: URB_FUNCTION_BULK_OR_INTERRUPT_TRANSFER (0x0009)
    IRP information: 0x00, Direction: FDO -> PDO
    URB bus id: 3
    Device address: 28
    Endpoint: 0x82, Direction: IN
    URB transfer type: URB_BULK (0x03)
    Packet Data Length: 0
    [Response in: 147]
    [bInterfaceClass: Smart Card (0x0b)]

No.     Time           Source                Destination           Protocol Length Info
    147 0.244859       3.28.2                host                  USBCCID  39     CCID Packet - Reader to PC: Data Block

Frame 147: 39 bytes on wire (312 bits), 39 bytes captured (312 bits) on interface \\.\USBPcap3, id 0
USB URB
    [Source: 3.28.2]
    [Destination: host]
    USBPcap pseudoheader length: 27
    IRP ID: 0xffffa387c72a6720
    IRP USBD_STATUS: USBD_STATUS_SUCCESS (0x00000000)
    URB Function: URB_FUNCTION_BULK_OR_INTERRUPT_TRANSFER (0x0009)
    IRP information: 0x01, Direction: PDO -> FDO
    URB bus id: 3
    Device address: 28
    Endpoint: 0x82, Direction: IN
    URB transfer type: URB_BULK (0x03)
    Packet Data Length: 12
    [Request in: 146]
    [Time from request: 0.000609000 seconds]
    [bInterfaceClass: Smart Card (0x0b)]
USB CCID
Data (2 bytes)

0000  6a 82                                             j.

No.     Time           Source                Destination           Protocol Length Info
    148 10.253660      host                  3.28.2                USBCCID  37     CCID Packet - PC to Reader: ICC Power Off

Frame 148: 37 bytes on wire (296 bits), 37 bytes captured (296 bits) on interface \\.\USBPcap3, id 0
USB URB
    [Source: host]
    [Destination: 3.28.2]
    USBPcap pseudoheader length: 27
    IRP ID: 0xffffa387c74e5010
    IRP USBD_STATUS: USBD_STATUS_SUCCESS (0x00000000)
    URB Function: URB_FUNCTION_BULK_OR_INTERRUPT_TRANSFER (0x0009)
    IRP information: 0x00, Direction: FDO -> PDO
    URB bus id: 3
    Device address: 28
    Endpoint: 0x02, Direction: OUT
    URB transfer type: URB_BULK (0x03)
    Packet Data Length: 10
    [Response in: 149]
    [bInterfaceClass: Smart Card (0x0b)]
USB CCID

No.     Time           Source                Destination           Protocol Length Info
    149 10.253843      3.28.2                host                  USB      27     URB_BULK out

Frame 149: 27 bytes on wire (216 bits), 27 bytes captured (216 bits) on interface \\.\USBPcap3, id 0
USB URB
    [Source: 3.28.2]
    [Destination: host]
    USBPcap pseudoheader length: 27
    IRP ID: 0xffffa387c74e5010
    IRP USBD_STATUS: USBD_STATUS_SUCCESS (0x00000000)
    URB Function: URB_FUNCTION_BULK_OR_INTERRUPT_TRANSFER (0x0009)
    IRP information: 0x01, Direction: PDO -> FDO
    URB bus id: 3
    Device address: 28
    Endpoint: 0x02, Direction: OUT
    URB transfer type: URB_BULK (0x03)
    Packet Data Length: 0
    [Request in: 148]
    [Time from request: 0.000183000 seconds]
    [bInterfaceClass: Smart Card (0x0b)]

No.     Time           Source                Destination           Protocol Length Info
    150 10.253909      host                  3.28.2                USB      27     URB_BULK in

Frame 150: 27 bytes on wire (216 bits), 27 bytes captured (216 bits) on interface \\.\USBPcap3, id 0
USB URB
    [Source: host]
    [Destination: 3.28.2]
    USBPcap pseudoheader length: 27
    IRP ID: 0xffffa387c72a6720
    IRP USBD_STATUS: USBD_STATUS_SUCCESS (0x00000000)
    URB Function: URB_FUNCTION_BULK_OR_INTERRUPT_TRANSFER (0x0009)
    IRP information: 0x00, Direction: FDO -> PDO
    URB bus id: 3
    Device address: 28
    Endpoint: 0x82, Direction: IN
    URB transfer type: URB_BULK (0x03)
    Packet Data Length: 0
    [Response in: 151]
    [bInterfaceClass: Smart Card (0x0b)]

No.     Time           Source                Destination           Protocol Length Info
    151 10.254649      3.28.2                host                  USBCCID  37     CCID Packet - Reader to PC: Slot Status

Frame 151: 37 bytes on wire (296 bits), 37 bytes captured (296 bits) on interface \\.\USBPcap3, id 0
USB URB
    [Source: 3.28.2]
    [Destination: host]
    USBPcap pseudoheader length: 27
    IRP ID: 0xffffa387c72a6720
    IRP USBD_STATUS: USBD_STATUS_SUCCESS (0x00000000)
    URB Function: URB_FUNCTION_BULK_OR_INTERRUPT_TRANSFER (0x0009)
    IRP information: 0x01, Direction: PDO -> FDO
    URB bus id: 3
    Device address: 28
    Endpoint: 0x82, Direction: IN
    URB transfer type: URB_BULK (0x03)
    Packet Data Length: 10
    [Request in: 150]
    [Time from request: 0.000740000 seconds]
    [bInterfaceClass: Smart Card (0x0b)]
USB CCID

No.     Time           Source                Destination           Protocol Length Info
    152 15.266317      3.28.3                host                  USB      27     URB_INTERRUPT in

Frame 152: 27 bytes on wire (216 bits), 27 bytes captured (216 bits) on interface \\.\USBPcap3, id 0
USB URB
    [Source: 3.28.3]
    [Destination: host]
    USBPcap pseudoheader length: 27
    IRP ID: 0xffffa387c743f620
    IRP USBD_STATUS: USBD_STATUS_CANCELED (0xc0010000)
    URB Function: URB_FUNCTION_BULK_OR_INTERRUPT_TRANSFER (0x0009)
    IRP information: 0x01, Direction: PDO -> FDO
    URB bus id: 3
    Device address: 28
    Endpoint: 0x83, Direction: IN
    URB transfer type: URB_INTERRUPT (0x01)
    Packet Data Length: 0
    [Request in: 65]
    [Time from request: 15.092477000 seconds]
    [bInterfaceClass: Smart Card (0x0b)]

No.     Time           Source                Destination           Protocol Length Info
    153 18.711163      host                  3.28.0                USB      36     GET DESCRIPTOR Request STRING

Frame 153: 36 bytes on wire (288 bits), 36 bytes captured (288 bits) on interface \\.\USBPcap3, id 0
USB URB
    [Source: host]
    [Destination: 3.28.0]
    USBPcap pseudoheader length: 28
    IRP ID: 0xffffa387c75e8010
    IRP USBD_STATUS: USBD_STATUS_SUCCESS (0x00000000)
    URB Function: URB_FUNCTION_GET_DESCRIPTOR_FROM_DEVICE (0x000b)
    IRP information: 0x00, Direction: FDO -> PDO
    URB bus id: 3
    Device address: 28
    Endpoint: 0x80, Direction: IN
    URB transfer type: URB_CONTROL (0x02)
    Packet Data Length: 8
    [Response in: 155]
    Control transfer stage: Setup (0)
Setup Data

No.     Time           Source                Destination           Protocol Length Info
    154 18.711225      host                  3.28.0                USB      36     GET DESCRIPTOR Request STRING

Frame 154: 36 bytes on wire (288 bits), 36 bytes captured (288 bits) on interface \\.\USBPcap3, id 0
USB URB
    [Source: host]
    [Destination: 3.28.0]
    USBPcap pseudoheader length: 28
    IRP ID: 0xffffa387c6902050
    IRP USBD_STATUS: USBD_STATUS_SUCCESS (0x00000000)
    URB Function: URB_FUNCTION_GET_DESCRIPTOR_FROM_DEVICE (0x000b)
    IRP information: 0x00, Direction: FDO -> PDO
    URB bus id: 3
    Device address: 28
    Endpoint: 0x80, Direction: IN
    URB transfer type: URB_CONTROL (0x02)
    Packet Data Length: 8
    [Response in: 157]
    Control transfer stage: Setup (0)
Setup Data

No.     Time           Source                Destination           Protocol Length Info
    155 18.713287      3.28.0                host                  USB      42     GET DESCRIPTOR Response STRING

Frame 155: 42 bytes on wire (336 bits), 42 bytes captured (336 bits) on interface \\.\USBPcap3, id 0
USB URB
    [Source: 3.28.0]
    [Destination: host]
    USBPcap pseudoheader length: 28
    IRP ID: 0xffffa387c75e8010
    IRP USBD_STATUS: USBD_STATUS_SUCCESS (0x00000000)
    URB Function: URB_FUNCTION_CONTROL_TRANSFER (0x0008)
    IRP information: 0x01, Direction: PDO -> FDO
    URB bus id: 3
    Device address: 28
    Endpoint: 0x80, Direction: IN
    URB transfer type: URB_CONTROL (0x02)
    Packet Data Length: 14
    [Request in: 153]
    [Time from request: 0.002124000 seconds]
    Control transfer stage: Complete (3)
STRING DESCRIPTOR
    bLength: 14
    bDescriptorType: 0x03 (STRING)
    bString: Yubico

No.     Time           Source                Destination           Protocol Length Info
    156 18.713317      host                  3.28.0                USB      36     GET DESCRIPTOR Request STRING

Frame 156: 36 bytes on wire (288 bits), 36 bytes captured (288 bits) on interface \\.\USBPcap3, id 0
USB URB
    [Source: host]
    [Destination: 3.28.0]
    USBPcap pseudoheader length: 28
    IRP ID: 0xffffa387c75ea010
    IRP USBD_STATUS: USBD_STATUS_SUCCESS (0x00000000)
    URB Function: URB_FUNCTION_GET_DESCRIPTOR_FROM_DEVICE (0x000b)
    IRP information: 0x00, Direction: FDO -> PDO
    URB bus id: 3
    Device address: 28
    Endpoint: 0x80, Direction: IN
    URB transfer type: URB_CONTROL (0x02)
    Packet Data Length: 8
    [Response in: 159]
    Control transfer stage: Setup (0)
Setup Data

No.     Time           Source                Destination           Protocol Length Info
    157 18.716293      3.28.0                host                  USB      42     GET DESCRIPTOR Response STRING

Frame 157: 42 bytes on wire (336 bits), 42 bytes captured (336 bits) on interface \\.\USBPcap3, id 0
USB URB
    [Source: 3.28.0]
    [Destination: host]
    USBPcap pseudoheader length: 28
    IRP ID: 0xffffa387c6902050
    IRP USBD_STATUS: USBD_STATUS_SUCCESS (0x00000000)
    URB Function: URB_FUNCTION_CONTROL_TRANSFER (0x0008)
    IRP information: 0x01, Direction: PDO -> FDO
    URB bus id: 3
    Device address: 28
    Endpoint: 0x80, Direction: IN
    URB transfer type: URB_CONTROL (0x02)
    Packet Data Length: 14
    [Request in: 154]
    [Time from request: 0.005068000 seconds]
    Control transfer stage: Complete (3)
STRING DESCRIPTOR
    bLength: 14
    bDescriptorType: 0x03 (STRING)
    bString: Yubico

No.     Time           Source                Destination           Protocol Length Info
    158 18.716322      host                  3.28.0                USB      36     GET DESCRIPTOR Request STRING

Frame 158: 36 bytes on wire (288 bits), 36 bytes captured (288 bits) on interface \\.\USBPcap3, id 0
USB URB
    [Source: host]
    [Destination: 3.28.0]
    USBPcap pseudoheader length: 28
    IRP ID: 0xffffa387c611c8a0
    IRP USBD_STATUS: USBD_STATUS_SUCCESS (0x00000000)
    URB Function: URB_FUNCTION_GET_DESCRIPTOR_FROM_DEVICE (0x000b)
    IRP information: 0x00, Direction: FDO -> PDO
    URB bus id: 3
    Device address: 28
    Endpoint: 0x80, Direction: IN
    URB transfer type: URB_CONTROL (0x02)
    Packet Data Length: 8
    [Response in: 160]
    Control transfer stage: Setup (0)
Setup Data

No.     Time           Source                Destination           Protocol Length Info
    159 18.719287      3.28.0                host                  USB      72     GET DESCRIPTOR Response STRING

Frame 159: 72 bytes on wire (576 bits), 72 bytes captured (576 bits) on interface \\.\USBPcap3, id 0
USB URB
    [Source: 3.28.0]
    [Destination: host]
    USBPcap pseudoheader length: 28
    IRP ID: 0xffffa387c75ea010
    IRP USBD_STATUS: USBD_STATUS_SUCCESS (0x00000000)
    URB Function: URB_FUNCTION_CONTROL_TRANSFER (0x0008)
    IRP information: 0x01, Direction: PDO -> FDO
    URB bus id: 3
    Device address: 28
    Endpoint: 0x80, Direction: IN
    URB transfer type: URB_CONTROL (0x02)
    Packet Data Length: 44
    [Request in: 156]
    [Time from request: 0.005970000 seconds]
    Control transfer stage: Complete (3)
STRING DESCRIPTOR
    bLength: 44
    bDescriptorType: 0x03 (STRING)
    bString: YubiKey OTP+FIDO+CCID

No.     Time           Source                Destination           Protocol Length Info
    160 18.722306      3.28.0                host                  USB      72     GET DESCRIPTOR Response STRING

Frame 160: 72 bytes on wire (576 bits), 72 bytes captured (576 bits) on interface \\.\USBPcap3, id 0
USB URB
    [Source: 3.28.0]
    [Destination: host]
    USBPcap pseudoheader length: 28
    IRP ID: 0xffffa387c611c8a0
    IRP USBD_STATUS: USBD_STATUS_SUCCESS (0x00000000)
    URB Function: URB_FUNCTION_CONTROL_TRANSFER (0x0008)
    IRP information: 0x01, Direction: PDO -> FDO
    URB bus id: 3
    Device address: 28
    Endpoint: 0x80, Direction: IN
    URB transfer type: URB_CONTROL (0x02)
    Packet Data Length: 44
    [Request in: 158]
    [Time from request: 0.005984000 seconds]
    Control transfer stage: Complete (3)
STRING DESCRIPTOR
    bLength: 44
    bDescriptorType: 0x03 (STRING)
    bString: YubiKey OTP+FIDO+CCID

No.     Time           Source                Destination           Protocol Length Info
    161 18.722414      host                  3.28.4                USB      91     URB_INTERRUPT out

Frame 161: 91 bytes on wire (728 bits), 91 bytes captured (728 bits) on interface \\.\USBPcap3, id 0
USB URB
    [Source: host]
    [Destination: 3.28.4]
    USBPcap pseudoheader length: 27
    IRP ID: 0xffffa387c5dc9560
    IRP USBD_STATUS: USBD_STATUS_SUCCESS (0x00000000)
    URB Function: URB_FUNCTION_BULK_OR_INTERRUPT_TRANSFER (0x0009)
    IRP information: 0x00, Direction: FDO -> PDO
    URB bus id: 3
    Device address: 28
    Endpoint: 0x04, Direction: OUT
    URB transfer type: URB_INTERRUPT (0x01)
    Packet Data Length: 64
    [Response in: 162]
    [bInterfaceClass: HID (0x03)]
HID Data: ffffffff860008ed46b11ffcad30e600000000000000000000000000000000000000000000000000000000000000000000000000000000000000000000000000

No.     Time           Source                Destination           Protocol Length Info
    162 18.726250      3.28.4                host                  USB      27     URB_INTERRUPT out

Frame 162: 27 bytes on wire (216 bits), 27 bytes captured (216 bits) on interface \\.\USBPcap3, id 0
USB URB
    [Source: 3.28.4]
    [Destination: host]
    USBPcap pseudoheader length: 27
    IRP ID: 0xffffa387c5dc9560
    IRP USBD_STATUS: USBD_STATUS_SUCCESS (0x00000000)
    URB Function: URB_FUNCTION_BULK_OR_INTERRUPT_TRANSFER (0x0009)
    IRP information: 0x01, Direction: PDO -> FDO
    URB bus id: 3
    Device address: 28
    Endpoint: 0x04, Direction: OUT
    URB transfer type: URB_INTERRUPT (0x01)
    Packet Data Length: 0
    [Request in: 161]
    [Time from request: 0.003836000 seconds]
    [bInterfaceClass: HID (0x03)]

No.     Time           Source                Destination           Protocol Length Info
    163 18.728285      3.28.4                host                  USB      91     URB_INTERRUPT in

Frame 163: 91 bytes on wire (728 bits), 91 bytes captured (728 bits) on interface \\.\USBPcap3, id 0
USB URB
    [Source: 3.28.4]
    [Destination: host]
    USBPcap pseudoheader length: 27
    IRP ID: 0xffffa387af6daa20
    IRP USBD_STATUS: USBD_STATUS_SUCCESS (0x00000000)
    URB Function: URB_FUNCTION_BULK_OR_INTERRUPT_TRANSFER (0x0009)
    IRP information: 0x01, Direction: PDO -> FDO
    URB bus id: 3
    Device address: 28
    Endpoint: 0x84, Direction: IN
    URB transfer type: URB_INTERRUPT (0x01)
    Packet Data Length: 64
    [Request in: 35]
    [Time from request: 18.596595000 seconds]
    [bInterfaceClass: HID (0x03)]
HID Data: ffffffff860011ed46b11ffcad30e6aa65678b020504030500000000000000000000000000000000000000000000000000000000000000000000000000000000

No.     Time           Source                Destination           Protocol Length Info
    164 18.728299      host                  3.28.4                USB      27     URB_INTERRUPT in

Frame 164: 27 bytes on wire (216 bits), 27 bytes captured (216 bits) on interface \\.\USBPcap3, id 0
USB URB
    [Source: host]
    [Destination: 3.28.4]
    USBPcap pseudoheader length: 27
    IRP ID: 0xffffa387af6daa20
    IRP USBD_STATUS: USBD_STATUS_SUCCESS (0x00000000)
    URB Function: URB_FUNCTION_BULK_OR_INTERRUPT_TRANSFER (0x0009)
    IRP information: 0x00, Direction: FDO -> PDO
    URB bus id: 3
    Device address: 28
    Endpoint: 0x84, Direction: IN
    URB transfer type: URB_INTERRUPT (0x01)
    Packet Data Length: 0
    [Response in: 169]
    [bInterfaceClass: HID (0x03)]

No.     Time           Source                Destination           Protocol Length Info
    165 18.728324      host                  3.28.4                USB      91     URB_INTERRUPT out

Frame 165: 91 bytes on wire (728 bits), 91 bytes captured (728 bits) on interface \\.\USBPcap3, id 0
USB URB
    [Source: host]
    [Destination: 3.28.4]
    USBPcap pseudoheader length: 27
    IRP ID: 0xffffa387c611c660
    IRP USBD_STATUS: USBD_STATUS_SUCCESS (0x00000000)
    URB Function: URB_FUNCTION_BULK_OR_INTERRUPT_TRANSFER (0x0009)
    IRP information: 0x00, Direction: FDO -> PDO
    URB bus id: 3
    Device address: 28
    Endpoint: 0x04, Direction: OUT
    URB transfer type: URB_INTERRUPT (0x01)
    Packet Data Length: 64
    [Response in: 166]
    [bInterfaceClass: HID (0x03)]
HID Data: aa65678b900001040000000000000000000000000000000000000000000000000000000000000000000000000000000000000000000000000000000000000000

No.     Time           Source                Destination           Protocol Length Info
    166 18.732248      3.28.4                host                  USB      27     URB_INTERRUPT out

Frame 166: 27 bytes on wire (216 bits), 27 bytes captured (216 bits) on interface \\.\USBPcap3, id 0
USB URB
    [Source: 3.28.4]
    [Destination: host]
    USBPcap pseudoheader length: 27
    IRP ID: 0xffffa387c611c660
    IRP USBD_STATUS: USBD_STATUS_SUCCESS (0x00000000)
    URB Function: URB_FUNCTION_BULK_OR_INTERRUPT_TRANSFER (0x0009)
    IRP information: 0x01, Direction: PDO -> FDO
    URB bus id: 3
    Device address: 28
    Endpoint: 0x04, Direction: OUT
    URB transfer type: URB_INTERRUPT (0x01)
    Packet Data Length: 0
    [Request in: 165]
    [Time from request: 0.003924000 seconds]
    [bInterfaceClass: HID (0x03)]

No.     Time           Source                Destination           Protocol Length Info
    167 18.734320      3.28.4                host                  USB      91     URB_INTERRUPT in

Frame 167: 91 bytes on wire (728 bits), 91 bytes captured (728 bits) on interface \\.\USBPcap3, id 0
USB URB
    [Source: 3.28.4]
    [Destination: host]
    USBPcap pseudoheader length: 27
    IRP ID: 0xffffa387afb5ca20
    IRP USBD_STATUS: USBD_STATUS_SUCCESS (0x00000000)
    URB Function: URB_FUNCTION_BULK_OR_INTERRUPT_TRANSFER (0x0009)
    IRP information: 0x01, Direction: PDO -> FDO
    URB bus id: 3
    Device address: 28
    Endpoint: 0x84, Direction: IN
    URB transfer type: URB_INTERRUPT (0x01)
    Packet Data Length: 64
    [Request in: 36]
    [Time from request: 18.602613000 seconds]
    [bInterfaceClass: HID (0x03)]
HID Data: aa65678b9000cc00ac0183665532465f5632684649444f5f325f306c4649444f5f325f315f50524502826b6372656450726f746563746b686d61632d73656372

No.     Time           Source                Destination           Protocol Length Info
    168 18.734337      host                  3.28.4                USB      27     URB_INTERRUPT in

Frame 168: 27 bytes on wire (216 bits), 27 bytes captured (216 bits) on interface \\.\USBPcap3, id 0
USB URB
    [Source: host]
    [Destination: 3.28.4]
    USBPcap pseudoheader length: 27
    IRP ID: 0xffffa387afb5ca20
    IRP USBD_STATUS: USBD_STATUS_SUCCESS (0x00000000)
    URB Function: URB_FUNCTION_BULK_OR_INTERRUPT_TRANSFER (0x0009)
    IRP information: 0x00, Direction: FDO -> PDO
    URB bus id: 3
    Device address: 28
    Endpoint: 0x84, Direction: IN
    URB transfer type: URB_INTERRUPT (0x01)
    Packet Data Length: 0
    [Response in: 171]
    [bInterfaceClass: HID (0x03)]

No.     Time           Source                Destination           Protocol Length Info
    169 18.736284      3.28.4                host                  USB      91     URB_INTERRUPT in

Frame 169: 91 bytes on wire (728 bits), 91 bytes captured (728 bits) on interface \\.\USBPcap3, id 0
USB URB
    [Source: 3.28.4]
    [Destination: host]
    USBPcap pseudoheader length: 27
    IRP ID: 0xffffa387af6daa20
    IRP USBD_STATUS: USBD_STATUS_SUCCESS (0x00000000)
    URB Function: URB_FUNCTION_BULK_OR_INTERRUPT_TRANSFER (0x0009)
    IRP information: 0x01, Direction: PDO -> FDO
    URB bus id: 3
    Device address: 28
    Endpoint: 0x84, Direction: IN
    URB transfer type: URB_INTERRUPT (0x01)
    Packet Data Length: 64
    [Request in: 164]
    [Time from request: 0.007985000 seconds]
    [bInterfaceClass: HID (0x03)]
HID Data: aa65678b00657403502fc0579f811347eab116bb5a8db9202a04a562726bf5627570f564706c6174f469636c69656e7450696ef57563726564656e7469616c4d

No.     Time           Source                Destination           Protocol Length Info
    170 18.736297      host                  3.28.4                USB      27     URB_INTERRUPT in

Frame 170: 27 bytes on wire (216 bits), 27 bytes captured (216 bits) on interface \\.\USBPcap3, id 0
USB URB
    [Source: host]
    [Destination: 3.28.4]
    USBPcap pseudoheader length: 27
    IRP ID: 0xffffa387af6daa20
    IRP USBD_STATUS: USBD_STATUS_SUCCESS (0x00000000)
    URB Function: URB_FUNCTION_BULK_OR_INTERRUPT_TRANSFER (0x0009)
    IRP information: 0x00, Direction: FDO -> PDO
    URB bus id: 3
    Device address: 28
    Endpoint: 0x84, Direction: IN
    URB transfer type: URB_INTERRUPT (0x01)
    Packet Data Length: 0
    [Response in: 173]
    [bInterfaceClass: HID (0x03)]

No.     Time           Source                Destination           Protocol Length Info
    171 18.738277      3.28.4                host                  USB      91     URB_INTERRUPT in

Frame 171: 91 bytes on wire (728 bits), 91 bytes captured (728 bits) on interface \\.\USBPcap3, id 0
USB URB
    [Source: 3.28.4]
    [Destination: host]
    USBPcap pseudoheader length: 27
    IRP ID: 0xffffa387afb5ca20
    IRP USBD_STATUS: USBD_STATUS_SUCCESS (0x00000000)
    URB Function: URB_FUNCTION_BULK_OR_INTERRUPT_TRANSFER (0x0009)
    IRP information: 0x01, Direction: PDO -> FDO
    URB bus id: 3
    Device address: 28
    Endpoint: 0x84, Direction: IN
    URB transfer type: URB_INTERRUPT (0x01)
    Packet Data Length: 64
    [Request in: 168]
    [Time from request: 0.003940000 seconds]
    [bInterfaceClass: HID (0x03)]
HID Data: aa65678b01676d7450726576696577f5051904b00682020107080818800982636e6663637573620a82a263616c672664747970656a7075626c69632d6b6579a2

No.     Time           Source                Destination           Protocol Length Info
    172 18.738290      host                  3.28.4                USB      27     URB_INTERRUPT in

Frame 172: 27 bytes on wire (216 bits), 27 bytes captured (216 bits) on interface \\.\USBPcap3, id 0
USB URB
    [Source: host]
    [Destination: 3.28.4]
    USBPcap pseudoheader length: 27
    IRP ID: 0xffffa387afb5ca20
    IRP USBD_STATUS: USBD_STATUS_SUCCESS (0x00000000)
    URB Function: URB_FUNCTION_BULK_OR_INTERRUPT_TRANSFER (0x0009)
    IRP information: 0x00, Direction: FDO -> PDO
    URB bus id: 3
    Device address: 28
    Endpoint: 0x84, Direction: IN
    URB transfer type: URB_INTERRUPT (0x01)
    Packet Data Length: 0
    [Response in: 177]
    [bInterfaceClass: HID (0x03)]

No.     Time           Source                Destination           Protocol Length Info
    173 18.740282      3.28.4                host                  USB      91     URB_INTERRUPT in

Frame 173: 91 bytes on wire (728 bits), 91 bytes captured (728 bits) on interface \\.\USBPcap3, id 0
USB URB
    [Source: 3.28.4]
    [Destination: host]
    USBPcap pseudoheader length: 27
    IRP ID: 0xffffa387af6daa20
    IRP USBD_STATUS: USBD_STATUS_SUCCESS (0x00000000)
    URB Function: URB_FUNCTION_BULK_OR_INTERRUPT_TRANSFER (0x0009)
    IRP information: 0x01, Direction: PDO -> FDO
    URB bus id: 3
    Device address: 28
    Endpoint: 0x84, Direction: IN
    URB transfer type: URB_INTERRUPT (0x01)
    Packet Data Length: 64
    [Request in: 170]
    [Time from request: 0.003985000 seconds]
    [bInterfaceClass: HID (0x03)]
HID Data: aa65678b0263616c672764747970656a7075626c69632d6b65790d040e1a00050403000000000000000000000000000000000000000000000000000000000000

No.     Time           Source                Destination           Protocol Length Info
    174 18.740295      host                  3.28.4                USB      27     URB_INTERRUPT in

Frame 174: 27 bytes on wire (216 bits), 27 bytes captured (216 bits) on interface \\.\USBPcap3, id 0
USB URB
    [Source: host]
    [Destination: 3.28.4]
    USBPcap pseudoheader length: 27
    IRP ID: 0xffffa387af6daa20
    IRP USBD_STATUS: USBD_STATUS_SUCCESS (0x00000000)
    URB Function: URB_FUNCTION_BULK_OR_INTERRUPT_TRANSFER (0x0009)
    IRP information: 0x00, Direction: FDO -> PDO
    URB bus id: 3
    Device address: 28
    Endpoint: 0x84, Direction: IN
    URB transfer type: URB_INTERRUPT (0x01)
    Packet Data Length: 0
    [Response in: 181]
    [bInterfaceClass: HID (0x03)]

No.     Time           Source                Destination           Protocol Length Info
    175 18.740359      host                  3.28.4                USB      91     URB_INTERRUPT out

Frame 175: 91 bytes on wire (728 bits), 91 bytes captured (728 bits) on interface \\.\USBPcap3, id 0
USB URB
    [Source: host]
    [Destination: 3.28.4]
    USBPcap pseudoheader length: 27
    IRP ID: 0xffffa387c26dc2d0
    IRP USBD_STATUS: USBD_STATUS_SUCCESS (0x00000000)
    URB Function: URB_FUNCTION_BULK_OR_INTERRUPT_TRANSFER (0x0009)
    IRP information: 0x00, Direction: FDO -> PDO
    URB bus id: 3
    Device address: 28
    Endpoint: 0x04, Direction: OUT
    URB transfer type: URB_INTERRUPT (0x01)
    Packet Data Length: 64
    [Response in: 176]
    [bInterfaceClass: HID (0x03)]
HID Data: aa65678b90000606a201020201000000000000000000000000000000000000000000000000000000000000000000000000000000000000000000000000000000

No.     Time           Source                Destination           Protocol Length Info
    176 18.744248      3.28.4                host                  USB      27     URB_INTERRUPT out

Frame 176: 27 bytes on wire (216 bits), 27 bytes captured (216 bits) on interface \\.\USBPcap3, id 0
USB URB
    [Source: 3.28.4]
    [Destination: host]
    USBPcap pseudoheader length: 27
    IRP ID: 0xffffa387c26dc2d0
    IRP USBD_STATUS: USBD_STATUS_SUCCESS (0x00000000)
    URB Function: URB_FUNCTION_BULK_OR_INTERRUPT_TRANSFER (0x0009)
    IRP information: 0x01, Direction: PDO -> FDO
    URB bus id: 3
    Device address: 28
    Endpoint: 0x04, Direction: OUT
    URB transfer type: URB_INTERRUPT (0x01)
    Packet Data Length: 0
    [Request in: 175]
    [Time from request: 0.003889000 seconds]
    [bInterfaceClass: HID (0x03)]

No.     Time           Source                Destination           Protocol Length Info
    177 18.746277      3.28.4                host                  USB      91     URB_INTERRUPT in

Frame 177: 91 bytes on wire (728 bits), 91 bytes captured (728 bits) on interface \\.\USBPcap3, id 0
USB URB
    [Source: 3.28.4]
    [Destination: host]
    USBPcap pseudoheader length: 27
    IRP ID: 0xffffa387afb5ca20
    IRP USBD_STATUS: USBD_STATUS_SUCCESS (0x00000000)
    URB Function: URB_FUNCTION_BULK_OR_INTERRUPT_TRANSFER (0x0009)
    IRP information: 0x01, Direction: PDO -> FDO
    URB bus id: 3
    Device address: 28
    Endpoint: 0x84, Direction: IN
    URB transfer type: URB_INTERRUPT (0x01)
    Packet Data Length: 64
    [Request in: 172]
    [Time from request: 0.007987000 seconds]
    [bInterfaceClass: HID (0x03)]
HID Data: aa65678b90000400a103080000000000000000000000000000000000000000000000000000000000000000000000000000000000000000000000000000000000

No.     Time           Source                Destination           Protocol Length Info
    178 18.746289      host                  3.28.4                USB      27     URB_INTERRUPT in

Frame 178: 27 bytes on wire (216 bits), 27 bytes captured (216 bits) on interface \\.\USBPcap3, id 0
USB URB
    [Source: host]
    [Destination: 3.28.4]
    USBPcap pseudoheader length: 27
    IRP ID: 0xffffa387afb5ca20
    IRP USBD_STATUS: USBD_STATUS_SUCCESS (0x00000000)
    URB Function: URB_FUNCTION_BULK_OR_INTERRUPT_TRANSFER (0x0009)
    IRP information: 0x00, Direction: FDO -> PDO
    URB bus id: 3
    Device address: 28
    Endpoint: 0x84, Direction: IN
    URB transfer type: URB_INTERRUPT (0x01)
    Packet Data Length: 0
    [Response in: 185]
    [bInterfaceClass: HID (0x03)]

No.     Time           Source                Destination           Protocol Length Info
    179 22.346112      host                  3.28.4                USB      91     URB_INTERRUPT out

Frame 179: 91 bytes on wire (728 bits), 91 bytes captured (728 bits) on interface \\.\USBPcap3, id 0
USB URB
    [Source: host]
    [Destination: 3.28.4]
    USBPcap pseudoheader length: 27
    IRP ID: 0xffffa387bf6e2660
    IRP USBD_STATUS: USBD_STATUS_SUCCESS (0x00000000)
    URB Function: URB_FUNCTION_BULK_OR_INTERRUPT_TRANSFER (0x0009)
    IRP information: 0x00, Direction: FDO -> PDO
    URB bus id: 3
    Device address: 28
    Endpoint: 0x04, Direction: OUT
    URB transfer type: URB_INTERRUPT (0x01)
    Packet Data Length: 64
    [Response in: 180]
    [bInterfaceClass: HID (0x03)]
HID Data: ffffffff860008483a2cd033776bc200000000000000000000000000000000000000000000000000000000000000000000000000000000000000000000000000

No.     Time           Source                Destination           Protocol Length Info
    180 22.348343      3.28.4                host                  USB      27     URB_INTERRUPT out

Frame 180: 27 bytes on wire (216 bits), 27 bytes captured (216 bits) on interface \\.\USBPcap3, id 0
USB URB
    [Source: 3.28.4]
    [Destination: host]
    USBPcap pseudoheader length: 27
    IRP ID: 0xffffa387bf6e2660
    IRP USBD_STATUS: USBD_STATUS_SUCCESS (0x00000000)
    URB Function: URB_FUNCTION_BULK_OR_INTERRUPT_TRANSFER (0x0009)
    IRP information: 0x01, Direction: PDO -> FDO
    URB bus id: 3
    Device address: 28
    Endpoint: 0x04, Direction: OUT
    URB transfer type: URB_INTERRUPT (0x01)
    Packet Data Length: 0
    [Request in: 179]
    [Time from request: 0.002231000 seconds]
    [bInterfaceClass: HID (0x03)]

No.     Time           Source                Destination           Protocol Length Info
    181 22.350380      3.28.4                host                  USB      91     URB_INTERRUPT in

Frame 181: 91 bytes on wire (728 bits), 91 bytes captured (728 bits) on interface \\.\USBPcap3, id 0
USB URB
    [Source: 3.28.4]
    [Destination: host]
    USBPcap pseudoheader length: 27
    IRP ID: 0xffffa387af6daa20
    IRP USBD_STATUS: USBD_STATUS_SUCCESS (0x00000000)
    URB Function: URB_FUNCTION_BULK_OR_INTERRUPT_TRANSFER (0x0009)
    IRP information: 0x01, Direction: PDO -> FDO
    URB bus id: 3
    Device address: 28
    Endpoint: 0x84, Direction: IN
    URB transfer type: URB_INTERRUPT (0x01)
    Packet Data Length: 64
    [Request in: 174]
    [Time from request: 3.610085000 seconds]
    [bInterfaceClass: HID (0x03)]
HID Data: ffffffff860011483a2cd033776bc2876e91ac020504030500000000000000000000000000000000000000000000000000000000000000000000000000000000

No.     Time           Source                Destination           Protocol Length Info
    182 22.350395      host                  3.28.4                USB      27     URB_INTERRUPT in

Frame 182: 27 bytes on wire (216 bits), 27 bytes captured (216 bits) on interface \\.\USBPcap3, id 0
USB URB
    [Source: host]
    [Destination: 3.28.4]
    USBPcap pseudoheader length: 27
    IRP ID: 0xffffa387af6daa20
    IRP USBD_STATUS: USBD_STATUS_SUCCESS (0x00000000)
    URB Function: URB_FUNCTION_BULK_OR_INTERRUPT_TRANSFER (0x0009)
    IRP information: 0x00, Direction: FDO -> PDO
    URB bus id: 3
    Device address: 28
    Endpoint: 0x84, Direction: IN
    URB transfer type: URB_INTERRUPT (0x01)
    Packet Data Length: 0
    [Response in: 187]
    [bInterfaceClass: HID (0x03)]

No.     Time           Source                Destination           Protocol Length Info
    183 22.350415      host                  3.28.4                USB      91     URB_INTERRUPT out

Frame 183: 91 bytes on wire (728 bits), 91 bytes captured (728 bits) on interface \\.\USBPcap3, id 0
USB URB
    [Source: host]
    [Destination: 3.28.4]
    USBPcap pseudoheader length: 27
    IRP ID: 0xffffa387bf6e2660
    IRP USBD_STATUS: USBD_STATUS_SUCCESS (0x00000000)
    URB Function: URB_FUNCTION_BULK_OR_INTERRUPT_TRANSFER (0x0009)
    IRP information: 0x00, Direction: FDO -> PDO
    URB bus id: 3
    Device address: 28
    Endpoint: 0x04, Direction: OUT
    URB transfer type: URB_INTERRUPT (0x01)
    Packet Data Length: 64
    [Response in: 184]
    [bInterfaceClass: HID (0x03)]
HID Data: 876e91ac900001040000000000000000000000000000000000000000000000000000000000000000000000000000000000000000000000000000000000000000

No.     Time           Source                Destination           Protocol Length Info
    184 22.354342      3.28.4                host                  USB      27     URB_INTERRUPT out

Frame 184: 27 bytes on wire (216 bits), 27 bytes captured (216 bits) on interface \\.\USBPcap3, id 0
USB URB
    [Source: 3.28.4]
    [Destination: host]
    USBPcap pseudoheader length: 27
    IRP ID: 0xffffa387bf6e2660
    IRP USBD_STATUS: USBD_STATUS_SUCCESS (0x00000000)
    URB Function: URB_FUNCTION_BULK_OR_INTERRUPT_TRANSFER (0x0009)
    IRP information: 0x01, Direction: PDO -> FDO
    URB bus id: 3
    Device address: 28
    Endpoint: 0x04, Direction: OUT
    URB transfer type: URB_INTERRUPT (0x01)
    Packet Data Length: 0
    [Request in: 183]
    [Time from request: 0.003927000 seconds]
    [bInterfaceClass: HID (0x03)]

No.     Time           Source                Destination           Protocol Length Info
    185 22.356379      3.28.4                host                  USB      91     URB_INTERRUPT in

Frame 185: 91 bytes on wire (728 bits), 91 bytes captured (728 bits) on interface \\.\USBPcap3, id 0
USB URB
    [Source: 3.28.4]
    [Destination: host]
    USBPcap pseudoheader length: 27
    IRP ID: 0xffffa387afb5ca20
    IRP USBD_STATUS: USBD_STATUS_SUCCESS (0x00000000)
    URB Function: URB_FUNCTION_BULK_OR_INTERRUPT_TRANSFER (0x0009)
    IRP information: 0x01, Direction: PDO -> FDO
    URB bus id: 3
    Device address: 28
    Endpoint: 0x84, Direction: IN
    URB transfer type: URB_INTERRUPT (0x01)
    Packet Data Length: 64
    [Request in: 178]
    [Time from request: 3.610090000 seconds]
    [bInterfaceClass: HID (0x03)]
HID Data: 876e91ac9000cc00ac0183665532465f5632684649444f5f325f306c4649444f5f325f315f50524502826b6372656450726f746563746b686d61632d73656372

No.     Time           Source                Destination           Protocol Length Info
    186 22.356398      host                  3.28.4                USB      27     URB_INTERRUPT in

Frame 186: 27 bytes on wire (216 bits), 27 bytes captured (216 bits) on interface \\.\USBPcap3, id 0
USB URB
    [Source: host]
    [Destination: 3.28.4]
    USBPcap pseudoheader length: 27
    IRP ID: 0xffffa387afb5ca20
    IRP USBD_STATUS: USBD_STATUS_SUCCESS (0x00000000)
    URB Function: URB_FUNCTION_BULK_OR_INTERRUPT_TRANSFER (0x0009)
    IRP information: 0x00, Direction: FDO -> PDO
    URB bus id: 3
    Device address: 28
    Endpoint: 0x84, Direction: IN
    URB transfer type: URB_INTERRUPT (0x01)
    Packet Data Length: 0
    [Response in: 189]
    [bInterfaceClass: HID (0x03)]

No.     Time           Source                Destination           Protocol Length Info
    187 22.358379      3.28.4                host                  USB      91     URB_INTERRUPT in

Frame 187: 91 bytes on wire (728 bits), 91 bytes captured (728 bits) on interface \\.\USBPcap3, id 0
USB URB
    [Source: 3.28.4]
    [Destination: host]
    USBPcap pseudoheader length: 27
    IRP ID: 0xffffa387af6daa20
    IRP USBD_STATUS: USBD_STATUS_SUCCESS (0x00000000)
    URB Function: URB_FUNCTION_BULK_OR_INTERRUPT_TRANSFER (0x0009)
    IRP information: 0x01, Direction: PDO -> FDO
    URB bus id: 3
    Device address: 28
    Endpoint: 0x84, Direction: IN
    URB transfer type: URB_INTERRUPT (0x01)
    Packet Data Length: 64
    [Request in: 182]
    [Time from request: 0.007984000 seconds]
    [bInterfaceClass: HID (0x03)]
HID Data: 876e91ac00657403502fc0579f811347eab116bb5a8db9202a04a562726bf5627570f564706c6174f469636c69656e7450696ef57563726564656e7469616c4d

No.     Time           Source                Destination           Protocol Length Info
    188 22.358395      host                  3.28.4                USB      27     URB_INTERRUPT in

Frame 188: 27 bytes on wire (216 bits), 27 bytes captured (216 bits) on interface \\.\USBPcap3, id 0
USB URB
    [Source: host]
    [Destination: 3.28.4]
    USBPcap pseudoheader length: 27
    IRP ID: 0xffffa387af6daa20
    IRP USBD_STATUS: USBD_STATUS_SUCCESS (0x00000000)
    URB Function: URB_FUNCTION_BULK_OR_INTERRUPT_TRANSFER (0x0009)
    IRP information: 0x00, Direction: FDO -> PDO
    URB bus id: 3
    Device address: 28
    Endpoint: 0x84, Direction: IN
    URB transfer type: URB_INTERRUPT (0x01)
    Packet Data Length: 0
    [Response in: 191]
    [bInterfaceClass: HID (0x03)]

No.     Time           Source                Destination           Protocol Length Info
    189 22.360374      3.28.4                host                  USB      91     URB_INTERRUPT in

Frame 189: 91 bytes on wire (728 bits), 91 bytes captured (728 bits) on interface \\.\USBPcap3, id 0
USB URB
    [Source: 3.28.4]
    [Destination: host]
    USBPcap pseudoheader length: 27
    IRP ID: 0xffffa387afb5ca20
    IRP USBD_STATUS: USBD_STATUS_SUCCESS (0x00000000)
    URB Function: URB_FUNCTION_BULK_OR_INTERRUPT_TRANSFER (0x0009)
    IRP information: 0x01, Direction: PDO -> FDO
    URB bus id: 3
    Device address: 28
    Endpoint: 0x84, Direction: IN
    URB transfer type: URB_INTERRUPT (0x01)
    Packet Data Length: 64
    [Request in: 186]
    [Time from request: 0.003976000 seconds]
    [bInterfaceClass: HID (0x03)]
HID Data: 876e91ac01676d7450726576696577f5051904b00682020107080818800982636e6663637573620a82a263616c672664747970656a7075626c69632d6b6579a2

No.     Time           Source                Destination           Protocol Length Info
    190 22.360386      host                  3.28.4                USB      27     URB_INTERRUPT in

Frame 190: 27 bytes on wire (216 bits), 27 bytes captured (216 bits) on interface \\.\USBPcap3, id 0
USB URB
    [Source: host]
    [Destination: 3.28.4]
    USBPcap pseudoheader length: 27
    IRP ID: 0xffffa387afb5ca20
    IRP USBD_STATUS: USBD_STATUS_SUCCESS (0x00000000)
    URB Function: URB_FUNCTION_BULK_OR_INTERRUPT_TRANSFER (0x0009)
    IRP information: 0x00, Direction: FDO -> PDO
    URB bus id: 3
    Device address: 28
    Endpoint: 0x84, Direction: IN
    URB transfer type: URB_INTERRUPT (0x01)
    Packet Data Length: 0
    [Response in: 195]
    [bInterfaceClass: HID (0x03)]

No.     Time           Source                Destination           Protocol Length Info
    191 22.362382      3.28.4                host                  USB      91     URB_INTERRUPT in

Frame 191: 91 bytes on wire (728 bits), 91 bytes captured (728 bits) on interface \\.\USBPcap3, id 0
USB URB
    [Source: 3.28.4]
    [Destination: host]
    USBPcap pseudoheader length: 27
    IRP ID: 0xffffa387af6daa20
    IRP USBD_STATUS: USBD_STATUS_SUCCESS (0x00000000)
    URB Function: URB_FUNCTION_BULK_OR_INTERRUPT_TRANSFER (0x0009)
    IRP information: 0x01, Direction: PDO -> FDO
    URB bus id: 3
    Device address: 28
    Endpoint: 0x84, Direction: IN
    URB transfer type: URB_INTERRUPT (0x01)
    Packet Data Length: 64
    [Request in: 188]
    [Time from request: 0.003987000 seconds]
    [bInterfaceClass: HID (0x03)]
HID Data: 876e91ac0263616c672764747970656a7075626c69632d6b65790d040e1a00050403000000000000000000000000000000000000000000000000000000000000

No.     Time           Source                Destination           Protocol Length Info
    192 22.362397      host                  3.28.4                USB      27     URB_INTERRUPT in

Frame 192: 27 bytes on wire (216 bits), 27 bytes captured (216 bits) on interface \\.\USBPcap3, id 0
USB URB
    [Source: host]
    [Destination: 3.28.4]
    USBPcap pseudoheader length: 27
    IRP ID: 0xffffa387af6daa20
    IRP USBD_STATUS: USBD_STATUS_SUCCESS (0x00000000)
    URB Function: URB_FUNCTION_BULK_OR_INTERRUPT_TRANSFER (0x0009)
    IRP information: 0x00, Direction: FDO -> PDO
    URB bus id: 3
    Device address: 28
    Endpoint: 0x84, Direction: IN
    URB transfer type: URB_INTERRUPT (0x01)
    Packet Data Length: 0
    [Response in: 197]
    [bInterfaceClass: HID (0x03)]

No.     Time           Source                Destination           Protocol Length Info
    193 22.362440      host                  3.28.4                USB      91     URB_INTERRUPT out

Frame 193: 91 bytes on wire (728 bits), 91 bytes captured (728 bits) on interface \\.\USBPcap3, id 0
USB URB
    [Source: host]
    [Destination: 3.28.4]
    USBPcap pseudoheader length: 27
    IRP ID: 0xffffa387bf6e2660
    IRP USBD_STATUS: USBD_STATUS_SUCCESS (0x00000000)
    URB Function: URB_FUNCTION_BULK_OR_INTERRUPT_TRANSFER (0x0009)
    IRP information: 0x00, Direction: FDO -> PDO
    URB bus id: 3
    Device address: 28
    Endpoint: 0x04, Direction: OUT
    URB transfer type: URB_INTERRUPT (0x01)
    Packet Data Length: 64
    [Response in: 194]
    [bInterfaceClass: HID (0x03)]
HID Data: 876e91ac90000606a201020202000000000000000000000000000000000000000000000000000000000000000000000000000000000000000000000000000000

No.     Time           Source                Destination           Protocol Length Info
    194 22.366341      3.28.4                host                  USB      27     URB_INTERRUPT out

Frame 194: 27 bytes on wire (216 bits), 27 bytes captured (216 bits) on interface \\.\USBPcap3, id 0
USB URB
    [Source: 3.28.4]
    [Destination: host]
    USBPcap pseudoheader length: 27
    IRP ID: 0xffffa387bf6e2660
    IRP USBD_STATUS: USBD_STATUS_SUCCESS (0x00000000)
    URB Function: URB_FUNCTION_BULK_OR_INTERRUPT_TRANSFER (0x0009)
    IRP information: 0x01, Direction: PDO -> FDO
    URB bus id: 3
    Device address: 28
    Endpoint: 0x04, Direction: OUT
    URB transfer type: URB_INTERRUPT (0x01)
    Packet Data Length: 0
    [Request in: 193]
    [Time from request: 0.003901000 seconds]
    [bInterfaceClass: HID (0x03)]

No.     Time           Source                Destination           Protocol Length Info
    195 22.368376      3.28.4                host                  USB      91     URB_INTERRUPT in

Frame 195: 91 bytes on wire (728 bits), 91 bytes captured (728 bits) on interface \\.\USBPcap3, id 0
USB URB
    [Source: 3.28.4]
    [Destination: host]
    USBPcap pseudoheader length: 27
    IRP ID: 0xffffa387afb5ca20
    IRP USBD_STATUS: USBD_STATUS_SUCCESS (0x00000000)
    URB Function: URB_FUNCTION_BULK_OR_INTERRUPT_TRANSFER (0x0009)
    IRP information: 0x01, Direction: PDO -> FDO
    URB bus id: 3
    Device address: 28
    Endpoint: 0x84, Direction: IN
    URB transfer type: URB_INTERRUPT (0x01)
    Packet Data Length: 64
    [Request in: 190]
    [Time from request: 0.007990000 seconds]
    [bInterfaceClass: HID (0x03)]
HID Data: 876e91ac90005100a101a501020338182001215820e9dee0cd64f53d1de80a50255f9a18cc6b2fd3fe6dd328783ed40e41f7bc05462258207d82e011f3186afc

No.     Time           Source                Destination           Protocol Length Info
    196 22.368387      host                  3.28.4                USB      27     URB_INTERRUPT in

Frame 196: 27 bytes on wire (216 bits), 27 bytes captured (216 bits) on interface \\.\USBPcap3, id 0
USB URB
    [Source: host]
    [Destination: 3.28.4]
    USBPcap pseudoheader length: 27
    IRP ID: 0xffffa387afb5ca20
    IRP USBD_STATUS: USBD_STATUS_SUCCESS (0x00000000)
    URB Function: URB_FUNCTION_BULK_OR_INTERRUPT_TRANSFER (0x0009)
    IRP information: 0x00, Direction: FDO -> PDO
    URB bus id: 3
    Device address: 28
    Endpoint: 0x84, Direction: IN
    URB transfer type: URB_INTERRUPT (0x01)
    Packet Data Length: 0
    [Response in: 205]
    [bInterfaceClass: HID (0x03)]

No.     Time           Source                Destination           Protocol Length Info
    197 22.370370      3.28.4                host                  USB      91     URB_INTERRUPT in

Frame 197: 91 bytes on wire (728 bits), 91 bytes captured (728 bits) on interface \\.\USBPcap3, id 0
USB URB
    [Source: 3.28.4]
    [Destination: host]
    USBPcap pseudoheader length: 27
    IRP ID: 0xffffa387af6daa20
    IRP USBD_STATUS: USBD_STATUS_SUCCESS (0x00000000)
    URB Function: URB_FUNCTION_BULK_OR_INTERRUPT_TRANSFER (0x0009)
    IRP information: 0x01, Direction: PDO -> FDO
    URB bus id: 3
    Device address: 28
    Endpoint: 0x84, Direction: IN
    URB transfer type: URB_INTERRUPT (0x01)
    Packet Data Length: 64
    [Request in: 192]
    [Time from request: 0.007973000 seconds]
    [bInterfaceClass: HID (0x03)]
HID Data: 876e91ac000fc69a9c1d55e19ebc49bdb18adca6907100dd821ff06c8f0000000000000000000000000000000000000000000000000000000000000000000000

No.     Time           Source                Destination           Protocol Length Info
    198 22.370380      host                  3.28.4                USB      27     URB_INTERRUPT in

Frame 198: 27 bytes on wire (216 bits), 27 bytes captured (216 bits) on interface \\.\USBPcap3, id 0
USB URB
    [Source: host]
    [Destination: 3.28.4]
    USBPcap pseudoheader length: 27
    IRP ID: 0xffffa387af6daa20
    IRP USBD_STATUS: USBD_STATUS_SUCCESS (0x00000000)
    URB Function: URB_FUNCTION_BULK_OR_INTERRUPT_TRANSFER (0x0009)
    IRP information: 0x00, Direction: FDO -> PDO
    URB bus id: 3
    Device address: 28
    Endpoint: 0x84, Direction: IN
    URB transfer type: URB_INTERRUPT (0x01)
    Packet Data Length: 0
    [Response in: 217]
    [bInterfaceClass: HID (0x03)]

No.     Time           Source                Destination           Protocol Length Info
    199 22.370760      host                  3.28.4                USB      91     URB_INTERRUPT out

Frame 199: 91 bytes on wire (728 bits), 91 bytes captured (728 bits) on interface \\.\USBPcap3, id 0
USB URB
    [Source: host]
    [Destination: 3.28.4]
    USBPcap pseudoheader length: 27
    IRP ID: 0xffffa387bf6e2660
    IRP USBD_STATUS: USBD_STATUS_SUCCESS (0x00000000)
    URB Function: URB_FUNCTION_BULK_OR_INTERRUPT_TRANSFER (0x0009)
    IRP information: 0x00, Direction: FDO -> PDO
    URB bus id: 3
    Device address: 28
    Endpoint: 0x04, Direction: OUT
    URB transfer type: URB_INTERRUPT (0x01)
    Packet Data Length: 64
    [Response in: 200]
    [bInterfaceClass: HID (0x03)]
HID Data: 876e91ac90007806a40102020503a501020338182001215820f6063e7d1ce319f49f6e705d2fe3f0bc9bafadc5d4f3a77654c919c9372a599f225820062bf0d0

No.     Time           Source                Destination           Protocol Length Info
    200 22.374341      3.28.4                host                  USB      27     URB_INTERRUPT out

Frame 200: 27 bytes on wire (216 bits), 27 bytes captured (216 bits) on interface \\.\USBPcap3, id 0
USB URB
    [Source: 3.28.4]
    [Destination: host]
    USBPcap pseudoheader length: 27
    IRP ID: 0xffffa387bf6e2660
    IRP USBD_STATUS: USBD_STATUS_SUCCESS (0x00000000)
    URB Function: URB_FUNCTION_BULK_OR_INTERRUPT_TRANSFER (0x0009)
    IRP information: 0x01, Direction: PDO -> FDO
    URB bus id: 3
    Device address: 28
    Endpoint: 0x04, Direction: OUT
    URB transfer type: URB_INTERRUPT (0x01)
    Packet Data Length: 0
    [Request in: 199]
    [Time from request: 0.003581000 seconds]
    [bInterfaceClass: HID (0x03)]

No.     Time           Source                Destination           Protocol Length Info
    201 22.374361      host                  3.28.4                USB      91     URB_INTERRUPT out

Frame 201: 91 bytes on wire (728 bits), 91 bytes captured (728 bits) on interface \\.\USBPcap3, id 0
USB URB
    [Source: host]
    [Destination: 3.28.4]
    USBPcap pseudoheader length: 27
    IRP ID: 0xffffa387bf6e2660
    IRP USBD_STATUS: USBD_STATUS_SUCCESS (0x00000000)
    URB Function: URB_FUNCTION_BULK_OR_INTERRUPT_TRANSFER (0x0009)
    IRP information: 0x00, Direction: FDO -> PDO
    URB bus id: 3
    Device address: 28
    Endpoint: 0x04, Direction: OUT
    URB transfer type: URB_INTERRUPT (0x01)
    Packet Data Length: 64
    [Response in: 202]
    [bInterfaceClass: HID (0x03)]
HID Data: 876e91ac00cae3473a61ba0db704c3b2eac629c04deb8130812f061780641404b30658209a83cc706943377aeecf89a5166367cb19e67eb6b7f5f5f11295fc40

No.     Time           Source                Destination           Protocol Length Info
    202 22.378347      3.28.4                host                  USB      27     URB_INTERRUPT out

Frame 202: 27 bytes on wire (216 bits), 27 bytes captured (216 bits) on interface \\.\USBPcap3, id 0
USB URB
    [Source: 3.28.4]
    [Destination: host]
    USBPcap pseudoheader length: 27
    IRP ID: 0xffffa387bf6e2660
    IRP USBD_STATUS: USBD_STATUS_SUCCESS (0x00000000)
    URB Function: URB_FUNCTION_BULK_OR_INTERRUPT_TRANSFER (0x0009)
    IRP information: 0x01, Direction: PDO -> FDO
    URB bus id: 3
    Device address: 28
    Endpoint: 0x04, Direction: OUT
    URB transfer type: URB_INTERRUPT (0x01)
    Packet Data Length: 0
    [Request in: 201]
    [Time from request: 0.003986000 seconds]
    [bInterfaceClass: HID (0x03)]

No.     Time           Source                Destination           Protocol Length Info
    203 22.378368      host                  3.28.4                USB      91     URB_INTERRUPT out

Frame 203: 91 bytes on wire (728 bits), 91 bytes captured (728 bits) on interface \\.\USBPcap3, id 0
USB URB
    [Source: host]
    [Destination: 3.28.4]
    USBPcap pseudoheader length: 27
    IRP ID: 0xffffa387bf6e2660
    IRP USBD_STATUS: USBD_STATUS_SUCCESS (0x00000000)
    URB Function: URB_FUNCTION_BULK_OR_INTERRUPT_TRANSFER (0x0009)
    IRP information: 0x00, Direction: FDO -> PDO
    URB bus id: 3
    Device address: 28
    Endpoint: 0x04, Direction: OUT
    URB transfer type: URB_INTERRUPT (0x01)
    Packet Data Length: 64
    [Response in: 204]
    [bInterfaceClass: HID (0x03)]
HID Data: 876e91ac0182bcdca200000000000000000000000000000000000000000000000000000000000000000000000000000000000000000000000000000000000000

No.     Time           Source                Destination           Protocol Length Info
    204 22.382342      3.28.4                host                  USB      27     URB_INTERRUPT out

Frame 204: 27 bytes on wire (216 bits), 27 bytes captured (216 bits) on interface \\.\USBPcap3, id 0
USB URB
    [Source: 3.28.4]
    [Destination: host]
    USBPcap pseudoheader length: 27
    IRP ID: 0xffffa387bf6e2660
    IRP USBD_STATUS: USBD_STATUS_SUCCESS (0x00000000)
    URB Function: URB_FUNCTION_BULK_OR_INTERRUPT_TRANSFER (0x0009)
    IRP information: 0x01, Direction: PDO -> FDO
    URB bus id: 3
    Device address: 28
    Endpoint: 0x04, Direction: OUT
    URB transfer type: URB_INTERRUPT (0x01)
    Packet Data Length: 0
    [Request in: 203]
    [Time from request: 0.003974000 seconds]
    [bInterfaceClass: HID (0x03)]

No.     Time           Source                Destination           Protocol Length Info
    205 22.460379      3.28.4                host                  USB      91     URB_INTERRUPT in

Frame 205: 91 bytes on wire (728 bits), 91 bytes captured (728 bits) on interface \\.\USBPcap3, id 0
USB URB
    [Source: 3.28.4]
    [Destination: host]
    USBPcap pseudoheader length: 27
    IRP ID: 0xffffa387afb5ca20
    IRP USBD_STATUS: USBD_STATUS_SUCCESS (0x00000000)
    URB Function: URB_FUNCTION_BULK_OR_INTERRUPT_TRANSFER (0x0009)
    IRP information: 0x01, Direction: PDO -> FDO
    URB bus id: 3
    Device address: 28
    Endpoint: 0x84, Direction: IN
    URB transfer type: URB_INTERRUPT (0x01)
    Packet Data Length: 64
    [Request in: 196]
    [Time from request: 0.091992000 seconds]
    [bInterfaceClass: HID (0x03)]
HID Data: 876e91ac90003500a102583035330e171f1ade29037af1277e43b205bc0a6d09b02153b1d71964c59baa7ac8e3dc2bce15fcbecbdd807165914c37f300000000

No.     Time           Source                Destination           Protocol Length Info
    206 22.460398      host                  3.28.4                USB      27     URB_INTERRUPT in

Frame 206: 27 bytes on wire (216 bits), 27 bytes captured (216 bits) on interface \\.\USBPcap3, id 0
USB URB
    [Source: host]
    [Destination: 3.28.4]
    USBPcap pseudoheader length: 27
    IRP ID: 0xffffa387afb5ca20
    IRP USBD_STATUS: USBD_STATUS_SUCCESS (0x00000000)
    URB Function: URB_FUNCTION_BULK_OR_INTERRUPT_TRANSFER (0x0009)
    IRP information: 0x00, Direction: FDO -> PDO
    URB bus id: 3
    Device address: 28
    Endpoint: 0x84, Direction: IN
    URB transfer type: URB_INTERRUPT (0x01)
    Packet Data Length: 0
    [Response in: 219]
    [bInterfaceClass: HID (0x03)]

No.     Time           Source                Destination           Protocol Length Info
    207 22.460484      host                  3.28.4                USB      91     URB_INTERRUPT out

Frame 207: 91 bytes on wire (728 bits), 91 bytes captured (728 bits) on interface \\.\USBPcap3, id 0
USB URB
    [Source: host]
    [Destination: 3.28.4]
    USBPcap pseudoheader length: 27
    IRP ID: 0xffffa387bf6e2660
    IRP USBD_STATUS: USBD_STATUS_SUCCESS (0x00000000)
    URB Function: URB_FUNCTION_BULK_OR_INTERRUPT_TRANSFER (0x0009)
    IRP information: 0x00, Direction: FDO -> PDO
    URB bus id: 3
    Device address: 28
    Endpoint: 0x04, Direction: OUT
    URB transfer type: URB_INTERRUPT (0x01)
    Packet Data Length: 64
    [Response in: 208]
    [bInterfaceClass: HID (0x03)]
HID Data: 876e91ac90010301a8015820f7e7db87f4eed54ca17f1d63dbeff4bddbccb681f65fa233bdd4d0b71c3c041c02a26269646b776562617574686e2e696f646e61

No.     Time           Source                Destination           Protocol Length Info
    208 22.464347      3.28.4                host                  USB      27     URB_INTERRUPT out

Frame 208: 27 bytes on wire (216 bits), 27 bytes captured (216 bits) on interface \\.\USBPcap3, id 0
USB URB
    [Source: 3.28.4]
    [Destination: host]
    USBPcap pseudoheader length: 27
    IRP ID: 0xffffa387bf6e2660
    IRP USBD_STATUS: USBD_STATUS_SUCCESS (0x00000000)
    URB Function: URB_FUNCTION_BULK_OR_INTERRUPT_TRANSFER (0x0009)
    IRP information: 0x01, Direction: PDO -> FDO
    URB bus id: 3
    Device address: 28
    Endpoint: 0x04, Direction: OUT
    URB transfer type: URB_INTERRUPT (0x01)
    Packet Data Length: 0
    [Request in: 207]
    [Time from request: 0.003863000 seconds]
    [bInterfaceClass: HID (0x03)]

No.     Time           Source                Destination           Protocol Length Info
    209 22.464373      host                  3.28.4                USB      91     URB_INTERRUPT out

Frame 209: 91 bytes on wire (728 bits), 91 bytes captured (728 bits) on interface \\.\USBPcap3, id 0
USB URB
    [Source: host]
    [Destination: 3.28.4]
    USBPcap pseudoheader length: 27
    IRP ID: 0xffffa387bf6e2660
    IRP USBD_STATUS: USBD_STATUS_SUCCESS (0x00000000)
    URB Function: URB_FUNCTION_BULK_OR_INTERRUPT_TRANSFER (0x0009)
    IRP information: 0x00, Direction: FDO -> PDO
    URB bus id: 3
    Device address: 28
    Endpoint: 0x04, Direction: OUT
    URB transfer type: URB_INTERRUPT (0x01)
    Packet Data Length: 64
    [Response in: 210]
    [bInterfaceClass: HID (0x03)]
HID Data: 876e91ac006d656b776562617574686e2e696f03a362696453776562617574686e696f2d776f6f66776f6f66646e616d6568776f6f66776f6f666b646973706c

No.     Time           Source                Destination           Protocol Length Info
    210 22.468341      3.28.4                host                  USB      27     URB_INTERRUPT out

Frame 210: 27 bytes on wire (216 bits), 27 bytes captured (216 bits) on interface \\.\USBPcap3, id 0
USB URB
    [Source: 3.28.4]
    [Destination: host]
    USBPcap pseudoheader length: 27
    IRP ID: 0xffffa387bf6e2660
    IRP USBD_STATUS: USBD_STATUS_SUCCESS (0x00000000)
    URB Function: URB_FUNCTION_BULK_OR_INTERRUPT_TRANSFER (0x0009)
    IRP information: 0x01, Direction: PDO -> FDO
    URB bus id: 3
    Device address: 28
    Endpoint: 0x04, Direction: OUT
    URB transfer type: URB_INTERRUPT (0x01)
    Packet Data Length: 0
    [Request in: 209]
    [Time from request: 0.003968000 seconds]
    [bInterfaceClass: HID (0x03)]

No.     Time           Source                Destination           Protocol Length Info
    211 22.468362      host                  3.28.4                USB      91     URB_INTERRUPT out

Frame 211: 91 bytes on wire (728 bits), 91 bytes captured (728 bits) on interface \\.\USBPcap3, id 0
USB URB
    [Source: host]
    [Destination: 3.28.4]
    USBPcap pseudoheader length: 27
    IRP ID: 0xffffa387bf6e2660
    IRP USBD_STATUS: USBD_STATUS_SUCCESS (0x00000000)
    URB Function: URB_FUNCTION_BULK_OR_INTERRUPT_TRANSFER (0x0009)
    IRP information: 0x00, Direction: FDO -> PDO
    URB bus id: 3
    Device address: 28
    Endpoint: 0x04, Direction: OUT
    URB transfer type: URB_INTERRUPT (0x01)
    Packet Data Length: 64
    [Response in: 212]
    [bInterfaceClass: HID (0x03)]
HID Data: 876e91ac0161794e616d6568776f6f66776f6f660483a263616c672764747970656a7075626c69632d6b6579a263616c672664747970656a7075626c69632d6b

No.     Time           Source                Destination           Protocol Length Info
    212 22.472342      3.28.4                host                  USB      27     URB_INTERRUPT out

Frame 212: 27 bytes on wire (216 bits), 27 bytes captured (216 bits) on interface \\.\USBPcap3, id 0
USB URB
    [Source: 3.28.4]
    [Destination: host]
    USBPcap pseudoheader length: 27
    IRP ID: 0xffffa387bf6e2660
    IRP USBD_STATUS: USBD_STATUS_SUCCESS (0x00000000)
    URB Function: URB_FUNCTION_BULK_OR_INTERRUPT_TRANSFER (0x0009)
    IRP information: 0x01, Direction: PDO -> FDO
    URB bus id: 3
    Device address: 28
    Endpoint: 0x04, Direction: OUT
    URB transfer type: URB_INTERRUPT (0x01)
    Packet Data Length: 0
    [Request in: 211]
    [Time from request: 0.003980000 seconds]
    [bInterfaceClass: HID (0x03)]

No.     Time           Source                Destination           Protocol Length Info
    213 22.472364      host                  3.28.4                USB      91     URB_INTERRUPT out

Frame 213: 91 bytes on wire (728 bits), 91 bytes captured (728 bits) on interface \\.\USBPcap3, id 0
USB URB
    [Source: host]
    [Destination: 3.28.4]
    USBPcap pseudoheader length: 27
    IRP ID: 0xffffa387bf6e2660
    IRP USBD_STATUS: USBD_STATUS_SUCCESS (0x00000000)
    URB Function: URB_FUNCTION_BULK_OR_INTERRUPT_TRANSFER (0x0009)
    IRP information: 0x00, Direction: FDO -> PDO
    URB bus id: 3
    Device address: 28
    Endpoint: 0x04, Direction: OUT
    URB transfer type: URB_INTERRUPT (0x01)
    Packet Data Length: 64
    [Response in: 214]
    [bInterfaceClass: HID (0x03)]
HID Data: 876e91ac026579a263616c6739010064747970656a7075626c69632d6b657906a16b6372656450726f746563740207a162726bf5085820fcea7540a5c917016b

No.     Time           Source                Destination           Protocol Length Info
    214 22.476363      3.28.4                host                  USB      27     URB_INTERRUPT out

Frame 214: 27 bytes on wire (216 bits), 27 bytes captured (216 bits) on interface \\.\USBPcap3, id 0
USB URB
    [Source: 3.28.4]
    [Destination: host]
    USBPcap pseudoheader length: 27
    IRP ID: 0xffffa387bf6e2660
    IRP USBD_STATUS: USBD_STATUS_SUCCESS (0x00000000)
    URB Function: URB_FUNCTION_BULK_OR_INTERRUPT_TRANSFER (0x0009)
    IRP information: 0x01, Direction: PDO -> FDO
    URB bus id: 3
    Device address: 28
    Endpoint: 0x04, Direction: OUT
    URB transfer type: URB_INTERRUPT (0x01)
    Packet Data Length: 0
    [Request in: 213]
    [Time from request: 0.003999000 seconds]
    [bInterfaceClass: HID (0x03)]

No.     Time           Source                Destination           Protocol Length Info
    215 22.476385      host                  3.28.4                USB      91     URB_INTERRUPT out

Frame 215: 91 bytes on wire (728 bits), 91 bytes captured (728 bits) on interface \\.\USBPcap3, id 0
USB URB
    [Source: host]
    [Destination: 3.28.4]
    USBPcap pseudoheader length: 27
    IRP ID: 0xffffa387bf6e2660
    IRP USBD_STATUS: USBD_STATUS_SUCCESS (0x00000000)
    URB Function: URB_FUNCTION_BULK_OR_INTERRUPT_TRANSFER (0x0009)
    IRP information: 0x00, Direction: FDO -> PDO
    URB bus id: 3
    Device address: 28
    Endpoint: 0x04, Direction: OUT
    URB transfer type: URB_INTERRUPT (0x01)
    Packet Data Length: 64
    [Response in: 216]
    [bInterfaceClass: HID (0x03)]
HID Data: 876e91ac03b97c48f13d8ecbf817da4567b30e2c1611ba4b3b7dfa8f090200000000000000000000000000000000000000000000000000000000000000000000

No.     Time           Source                Destination           Protocol Length Info
    216 22.480348      3.28.4                host                  USB      27     URB_INTERRUPT out

Frame 216: 27 bytes on wire (216 bits), 27 bytes captured (216 bits) on interface \\.\USBPcap3, id 0
USB URB
    [Source: 3.28.4]
    [Destination: host]
    USBPcap pseudoheader length: 27
    IRP ID: 0xffffa387bf6e2660
    IRP USBD_STATUS: USBD_STATUS_SUCCESS (0x00000000)
    URB Function: URB_FUNCTION_BULK_OR_INTERRUPT_TRANSFER (0x0009)
    IRP information: 0x01, Direction: PDO -> FDO
    URB bus id: 3
    Device address: 28
    Endpoint: 0x04, Direction: OUT
    URB transfer type: URB_INTERRUPT (0x01)
    Packet Data Length: 0
    [Request in: 215]
    [Time from request: 0.003963000 seconds]
    [bInterfaceClass: HID (0x03)]

No.     Time           Source                Destination           Protocol Length Info
    217 22.686392      3.28.4                host                  USB      91     URB_INTERRUPT in

Frame 217: 91 bytes on wire (728 bits), 91 bytes captured (728 bits) on interface \\.\USBPcap3, id 0
USB URB
    [Source: 3.28.4]
    [Destination: host]
    USBPcap pseudoheader length: 27
    IRP ID: 0xffffa387af6daa20
    IRP USBD_STATUS: USBD_STATUS_SUCCESS (0x00000000)
    URB Function: URB_FUNCTION_BULK_OR_INTERRUPT_TRANSFER (0x0009)
    IRP information: 0x01, Direction: PDO -> FDO
    URB bus id: 3
    Device address: 28
    Endpoint: 0x84, Direction: IN
    URB transfer type: URB_INTERRUPT (0x01)
    Packet Data Length: 64
    [Request in: 198]
    [Time from request: 0.316012000 seconds]
    [bInterfaceClass: HID (0x03)]
HID Data: 876e91acbb0001020000000000000000000000000000000000000000000000000000000000000000000000000000000000000000000000000000000000000000

No.     Time           Source                Destination           Protocol Length Info
    218 22.686414      host                  3.28.4                USB      27     URB_INTERRUPT in

Frame 218: 27 bytes on wire (216 bits), 27 bytes captured (216 bits) on interface \\.\USBPcap3, id 0
USB URB
    [Source: host]
    [Destination: 3.28.4]
    USBPcap pseudoheader length: 27
    IRP ID: 0xffffa387af6daa20
    IRP USBD_STATUS: USBD_STATUS_SUCCESS (0x00000000)
    URB Function: URB_FUNCTION_BULK_OR_INTERRUPT_TRANSFER (0x0009)
    IRP information: 0x00, Direction: FDO -> PDO
    URB bus id: 3
    Device address: 28
    Endpoint: 0x84, Direction: IN
    URB transfer type: URB_INTERRUPT (0x01)
    Packet Data Length: 0
    [Response in: 221]
    [bInterfaceClass: HID (0x03)]

No.     Time           Source                Destination           Protocol Length Info
    219 22.974403      3.28.4                host                  USB      91     URB_INTERRUPT in

Frame 219: 91 bytes on wire (728 bits), 91 bytes captured (728 bits) on interface \\.\USBPcap3, id 0
USB URB
    [Source: 3.28.4]
    [Destination: host]
    USBPcap pseudoheader length: 27
    IRP ID: 0xffffa387afb5ca20
    IRP USBD_STATUS: USBD_STATUS_SUCCESS (0x00000000)
    URB Function: URB_FUNCTION_BULK_OR_INTERRUPT_TRANSFER (0x0009)
    IRP information: 0x01, Direction: PDO -> FDO
    URB bus id: 3
    Device address: 28
    Endpoint: 0x84, Direction: IN
    URB transfer type: URB_INTERRUPT (0x01)
    Packet Data Length: 64
    [Request in: 206]
    [Time from request: 0.514005000 seconds]
    [bInterfaceClass: HID (0x03)]
HID Data: 876e91acbb0001020000000000000000000000000000000000000000000000000000000000000000000000000000000000000000000000000000000000000000

No.     Time           Source                Destination           Protocol Length Info
    220 22.974429      host                  3.28.4                USB      27     URB_INTERRUPT in

Frame 220: 27 bytes on wire (216 bits), 27 bytes captured (216 bits) on interface \\.\USBPcap3, id 0
USB URB
    [Source: host]
    [Destination: 3.28.4]
    USBPcap pseudoheader length: 27
    IRP ID: 0xffffa387afb5ca20
    IRP USBD_STATUS: USBD_STATUS_SUCCESS (0x00000000)
    URB Function: URB_FUNCTION_BULK_OR_INTERRUPT_TRANSFER (0x0009)
    IRP information: 0x00, Direction: FDO -> PDO
    URB bus id: 3
    Device address: 28
    Endpoint: 0x84, Direction: IN
    URB transfer type: URB_INTERRUPT (0x01)
    Packet Data Length: 0
    [Response in: 223]
    [bInterfaceClass: HID (0x03)]

No.     Time           Source                Destination           Protocol Length Info
    221 23.262405      3.28.4                host                  USB      91     URB_INTERRUPT in

Frame 221: 91 bytes on wire (728 bits), 91 bytes captured (728 bits) on interface \\.\USBPcap3, id 0
USB URB
    [Source: 3.28.4]
    [Destination: host]
    USBPcap pseudoheader length: 27
    IRP ID: 0xffffa387af6daa20
    IRP USBD_STATUS: USBD_STATUS_SUCCESS (0x00000000)
    URB Function: URB_FUNCTION_BULK_OR_INTERRUPT_TRANSFER (0x0009)
    IRP information: 0x01, Direction: PDO -> FDO
    URB bus id: 3
    Device address: 28
    Endpoint: 0x84, Direction: IN
    URB transfer type: URB_INTERRUPT (0x01)
    Packet Data Length: 64
    [Request in: 218]
    [Time from request: 0.575991000 seconds]
    [bInterfaceClass: HID (0x03)]
HID Data: 876e91acbb0001020000000000000000000000000000000000000000000000000000000000000000000000000000000000000000000000000000000000000000

No.     Time           Source                Destination           Protocol Length Info
    222 23.262425      host                  3.28.4                USB      27     URB_INTERRUPT in

Frame 222: 27 bytes on wire (216 bits), 27 bytes captured (216 bits) on interface \\.\USBPcap3, id 0
USB URB
    [Source: host]
    [Destination: 3.28.4]
    USBPcap pseudoheader length: 27
    IRP ID: 0xffffa387af6daa20
    IRP USBD_STATUS: USBD_STATUS_SUCCESS (0x00000000)
    URB Function: URB_FUNCTION_BULK_OR_INTERRUPT_TRANSFER (0x0009)
    IRP information: 0x00, Direction: FDO -> PDO
    URB bus id: 3
    Device address: 28
    Endpoint: 0x84, Direction: IN
    URB transfer type: URB_INTERRUPT (0x01)
    Packet Data Length: 0
    [Response in: 225]
    [bInterfaceClass: HID (0x03)]

No.     Time           Source                Destination           Protocol Length Info
    223 23.550414      3.28.4                host                  USB      91     URB_INTERRUPT in

Frame 223: 91 bytes on wire (728 bits), 91 bytes captured (728 bits) on interface \\.\USBPcap3, id 0
USB URB
    [Source: 3.28.4]
    [Destination: host]
    USBPcap pseudoheader length: 27
    IRP ID: 0xffffa387afb5ca20
    IRP USBD_STATUS: USBD_STATUS_SUCCESS (0x00000000)
    URB Function: URB_FUNCTION_BULK_OR_INTERRUPT_TRANSFER (0x0009)
    IRP information: 0x01, Direction: PDO -> FDO
    URB bus id: 3
    Device address: 28
    Endpoint: 0x84, Direction: IN
    URB transfer type: URB_INTERRUPT (0x01)
    Packet Data Length: 64
    [Request in: 220]
    [Time from request: 0.575985000 seconds]
    [bInterfaceClass: HID (0x03)]
HID Data: 876e91acbb0001020000000000000000000000000000000000000000000000000000000000000000000000000000000000000000000000000000000000000000

No.     Time           Source                Destination           Protocol Length Info
    224 23.550436      host                  3.28.4                USB      27     URB_INTERRUPT in

Frame 224: 27 bytes on wire (216 bits), 27 bytes captured (216 bits) on interface \\.\USBPcap3, id 0
USB URB
    [Source: host]
    [Destination: 3.28.4]
    USBPcap pseudoheader length: 27
    IRP ID: 0xffffa387afb5ca20
    IRP USBD_STATUS: USBD_STATUS_SUCCESS (0x00000000)
    URB Function: URB_FUNCTION_BULK_OR_INTERRUPT_TRANSFER (0x0009)
    IRP information: 0x00, Direction: FDO -> PDO
    URB bus id: 3
    Device address: 28
    Endpoint: 0x84, Direction: IN
    URB transfer type: URB_INTERRUPT (0x01)
    Packet Data Length: 0
    [Response in: 227]
    [bInterfaceClass: HID (0x03)]

No.     Time           Source                Destination           Protocol Length Info
    225 23.838424      3.28.4                host                  USB      91     URB_INTERRUPT in

Frame 225: 91 bytes on wire (728 bits), 91 bytes captured (728 bits) on interface \\.\USBPcap3, id 0
USB URB
    [Source: 3.28.4]
    [Destination: host]
    USBPcap pseudoheader length: 27
    IRP ID: 0xffffa387af6daa20
    IRP USBD_STATUS: USBD_STATUS_SUCCESS (0x00000000)
    URB Function: URB_FUNCTION_BULK_OR_INTERRUPT_TRANSFER (0x0009)
    IRP information: 0x01, Direction: PDO -> FDO
    URB bus id: 3
    Device address: 28
    Endpoint: 0x84, Direction: IN
    URB transfer type: URB_INTERRUPT (0x01)
    Packet Data Length: 64
    [Request in: 222]
    [Time from request: 0.575999000 seconds]
    [bInterfaceClass: HID (0x03)]
HID Data: 876e91acbb0001020000000000000000000000000000000000000000000000000000000000000000000000000000000000000000000000000000000000000000

No.     Time           Source                Destination           Protocol Length Info
    226 23.838448      host                  3.28.4                USB      27     URB_INTERRUPT in

Frame 226: 27 bytes on wire (216 bits), 27 bytes captured (216 bits) on interface \\.\USBPcap3, id 0
USB URB
    [Source: host]
    [Destination: 3.28.4]
    USBPcap pseudoheader length: 27
    IRP ID: 0xffffa387af6daa20
    IRP USBD_STATUS: USBD_STATUS_SUCCESS (0x00000000)
    URB Function: URB_FUNCTION_BULK_OR_INTERRUPT_TRANSFER (0x0009)
    IRP information: 0x00, Direction: FDO -> PDO
    URB bus id: 3
    Device address: 28
    Endpoint: 0x84, Direction: IN
    URB transfer type: URB_INTERRUPT (0x01)
    Packet Data Length: 0
    [Response in: 229]
    [bInterfaceClass: HID (0x03)]

No.     Time           Source                Destination           Protocol Length Info
    227 24.126424      3.28.4                host                  USB      91     URB_INTERRUPT in

Frame 227: 91 bytes on wire (728 bits), 91 bytes captured (728 bits) on interface \\.\USBPcap3, id 0
USB URB
    [Source: 3.28.4]
    [Destination: host]
    USBPcap pseudoheader length: 27
    IRP ID: 0xffffa387afb5ca20
    IRP USBD_STATUS: USBD_STATUS_SUCCESS (0x00000000)
    URB Function: URB_FUNCTION_BULK_OR_INTERRUPT_TRANSFER (0x0009)
    IRP information: 0x01, Direction: PDO -> FDO
    URB bus id: 3
    Device address: 28
    Endpoint: 0x84, Direction: IN
    URB transfer type: URB_INTERRUPT (0x01)
    Packet Data Length: 64
    [Request in: 224]
    [Time from request: 0.575988000 seconds]
    [bInterfaceClass: HID (0x03)]
HID Data: 876e91acbb0001020000000000000000000000000000000000000000000000000000000000000000000000000000000000000000000000000000000000000000

No.     Time           Source                Destination           Protocol Length Info
    228 24.126444      host                  3.28.4                USB      27     URB_INTERRUPT in

Frame 228: 27 bytes on wire (216 bits), 27 bytes captured (216 bits) on interface \\.\USBPcap3, id 0
USB URB
    [Source: host]
    [Destination: 3.28.4]
    USBPcap pseudoheader length: 27
    IRP ID: 0xffffa387afb5ca20
    IRP USBD_STATUS: USBD_STATUS_SUCCESS (0x00000000)
    URB Function: URB_FUNCTION_BULK_OR_INTERRUPT_TRANSFER (0x0009)
    IRP information: 0x00, Direction: FDO -> PDO
    URB bus id: 3
    Device address: 28
    Endpoint: 0x84, Direction: IN
    URB transfer type: URB_INTERRUPT (0x01)
    Packet Data Length: 0
    [Response in: 231]
    [bInterfaceClass: HID (0x03)]

No.     Time           Source                Destination           Protocol Length Info
    229 24.414436      3.28.4                host                  USB      91     URB_INTERRUPT in

Frame 229: 91 bytes on wire (728 bits), 91 bytes captured (728 bits) on interface \\.\USBPcap3, id 0
USB URB
    [Source: 3.28.4]
    [Destination: host]
    USBPcap pseudoheader length: 27
    IRP ID: 0xffffa387af6daa20
    IRP USBD_STATUS: USBD_STATUS_SUCCESS (0x00000000)
    URB Function: URB_FUNCTION_BULK_OR_INTERRUPT_TRANSFER (0x0009)
    IRP information: 0x01, Direction: PDO -> FDO
    URB bus id: 3
    Device address: 28
    Endpoint: 0x84, Direction: IN
    URB transfer type: URB_INTERRUPT (0x01)
    Packet Data Length: 64
    [Request in: 226]
    [Time from request: 0.575988000 seconds]
    [bInterfaceClass: HID (0x03)]
HID Data: 876e91acbb0001020000000000000000000000000000000000000000000000000000000000000000000000000000000000000000000000000000000000000000

No.     Time           Source                Destination           Protocol Length Info
    230 24.414458      host                  3.28.4                USB      27     URB_INTERRUPT in

Frame 230: 27 bytes on wire (216 bits), 27 bytes captured (216 bits) on interface \\.\USBPcap3, id 0
USB URB
    [Source: host]
    [Destination: 3.28.4]
    USBPcap pseudoheader length: 27
    IRP ID: 0xffffa387af6daa20
    IRP USBD_STATUS: USBD_STATUS_SUCCESS (0x00000000)
    URB Function: URB_FUNCTION_BULK_OR_INTERRUPT_TRANSFER (0x0009)
    IRP information: 0x00, Direction: FDO -> PDO
    URB bus id: 3
    Device address: 28
    Endpoint: 0x84, Direction: IN
    URB transfer type: URB_INTERRUPT (0x01)
    Packet Data Length: 0
    [Response in: 233]
    [bInterfaceClass: HID (0x03)]

No.     Time           Source                Destination           Protocol Length Info
    231 24.702445      3.28.4                host                  USB      91     URB_INTERRUPT in

Frame 231: 91 bytes on wire (728 bits), 91 bytes captured (728 bits) on interface \\.\USBPcap3, id 0
USB URB
    [Source: 3.28.4]
    [Destination: host]
    USBPcap pseudoheader length: 27
    IRP ID: 0xffffa387afb5ca20
    IRP USBD_STATUS: USBD_STATUS_SUCCESS (0x00000000)
    URB Function: URB_FUNCTION_BULK_OR_INTERRUPT_TRANSFER (0x0009)
    IRP information: 0x01, Direction: PDO -> FDO
    URB bus id: 3
    Device address: 28
    Endpoint: 0x84, Direction: IN
    URB transfer type: URB_INTERRUPT (0x01)
    Packet Data Length: 64
    [Request in: 228]
    [Time from request: 0.576001000 seconds]
    [bInterfaceClass: HID (0x03)]
HID Data: 876e91acbb0001020000000000000000000000000000000000000000000000000000000000000000000000000000000000000000000000000000000000000000

No.     Time           Source                Destination           Protocol Length Info
    232 24.702466      host                  3.28.4                USB      27     URB_INTERRUPT in

Frame 232: 27 bytes on wire (216 bits), 27 bytes captured (216 bits) on interface \\.\USBPcap3, id 0
USB URB
    [Source: host]
    [Destination: 3.28.4]
    USBPcap pseudoheader length: 27
    IRP ID: 0xffffa387afb5ca20
    IRP USBD_STATUS: USBD_STATUS_SUCCESS (0x00000000)
    URB Function: URB_FUNCTION_BULK_OR_INTERRUPT_TRANSFER (0x0009)
    IRP information: 0x00, Direction: FDO -> PDO
    URB bus id: 3
    Device address: 28
    Endpoint: 0x84, Direction: IN
    URB transfer type: URB_INTERRUPT (0x01)
    Packet Data Length: 0
    [Response in: 235]
    [bInterfaceClass: HID (0x03)]

No.     Time           Source                Destination           Protocol Length Info
    233 24.990453      3.28.4                host                  USB      91     URB_INTERRUPT in

Frame 233: 91 bytes on wire (728 bits), 91 bytes captured (728 bits) on interface \\.\USBPcap3, id 0
USB URB
    [Source: 3.28.4]
    [Destination: host]
    USBPcap pseudoheader length: 27
    IRP ID: 0xffffa387af6daa20
    IRP USBD_STATUS: USBD_STATUS_SUCCESS (0x00000000)
    URB Function: URB_FUNCTION_BULK_OR_INTERRUPT_TRANSFER (0x0009)
    IRP information: 0x01, Direction: PDO -> FDO
    URB bus id: 3
    Device address: 28
    Endpoint: 0x84, Direction: IN
    URB transfer type: URB_INTERRUPT (0x01)
    Packet Data Length: 64
    [Request in: 230]
    [Time from request: 0.575995000 seconds]
    [bInterfaceClass: HID (0x03)]
HID Data: 876e91acbb0001020000000000000000000000000000000000000000000000000000000000000000000000000000000000000000000000000000000000000000

No.     Time           Source                Destination           Protocol Length Info
    234 24.990475      host                  3.28.4                USB      27     URB_INTERRUPT in

Frame 234: 27 bytes on wire (216 bits), 27 bytes captured (216 bits) on interface \\.\USBPcap3, id 0
USB URB
    [Source: host]
    [Destination: 3.28.4]
    USBPcap pseudoheader length: 27
    IRP ID: 0xffffa387af6daa20
    IRP USBD_STATUS: USBD_STATUS_SUCCESS (0x00000000)
    URB Function: URB_FUNCTION_BULK_OR_INTERRUPT_TRANSFER (0x0009)
    IRP information: 0x00, Direction: FDO -> PDO
    URB bus id: 3
    Device address: 28
    Endpoint: 0x84, Direction: IN
    URB transfer type: URB_INTERRUPT (0x01)
    Packet Data Length: 0
    [Response in: 237]
    [bInterfaceClass: HID (0x03)]

No.     Time           Source                Destination           Protocol Length Info
    235 25.278459      3.28.4                host                  USB      91     URB_INTERRUPT in

Frame 235: 91 bytes on wire (728 bits), 91 bytes captured (728 bits) on interface \\.\USBPcap3, id 0
USB URB
    [Source: 3.28.4]
    [Destination: host]
    USBPcap pseudoheader length: 27
    IRP ID: 0xffffa387afb5ca20
    IRP USBD_STATUS: USBD_STATUS_SUCCESS (0x00000000)
    URB Function: URB_FUNCTION_BULK_OR_INTERRUPT_TRANSFER (0x0009)
    IRP information: 0x01, Direction: PDO -> FDO
    URB bus id: 3
    Device address: 28
    Endpoint: 0x84, Direction: IN
    URB transfer type: URB_INTERRUPT (0x01)
    Packet Data Length: 64
    [Request in: 232]
    [Time from request: 0.575993000 seconds]
    [bInterfaceClass: HID (0x03)]
HID Data: 876e91acbb0001020000000000000000000000000000000000000000000000000000000000000000000000000000000000000000000000000000000000000000

No.     Time           Source                Destination           Protocol Length Info
    236 25.278480      host                  3.28.4                USB      27     URB_INTERRUPT in

Frame 236: 27 bytes on wire (216 bits), 27 bytes captured (216 bits) on interface \\.\USBPcap3, id 0
USB URB
    [Source: host]
    [Destination: 3.28.4]
    USBPcap pseudoheader length: 27
    IRP ID: 0xffffa387afb5ca20
    IRP USBD_STATUS: USBD_STATUS_SUCCESS (0x00000000)
    URB Function: URB_FUNCTION_BULK_OR_INTERRUPT_TRANSFER (0x0009)
    IRP information: 0x00, Direction: FDO -> PDO
    URB bus id: 3
    Device address: 28
    Endpoint: 0x84, Direction: IN
    URB transfer type: URB_INTERRUPT (0x01)
    Packet Data Length: 0
    [Response in: 239]
    [bInterfaceClass: HID (0x03)]

No.     Time           Source                Destination           Protocol Length Info
    237 25.566460      3.28.4                host                  USB      91     URB_INTERRUPT in

Frame 237: 91 bytes on wire (728 bits), 91 bytes captured (728 bits) on interface \\.\USBPcap3, id 0
USB URB
    [Source: 3.28.4]
    [Destination: host]
    USBPcap pseudoheader length: 27
    IRP ID: 0xffffa387af6daa20
    IRP USBD_STATUS: USBD_STATUS_SUCCESS (0x00000000)
    URB Function: URB_FUNCTION_BULK_OR_INTERRUPT_TRANSFER (0x0009)
    IRP information: 0x01, Direction: PDO -> FDO
    URB bus id: 3
    Device address: 28
    Endpoint: 0x84, Direction: IN
    URB transfer type: URB_INTERRUPT (0x01)
    Packet Data Length: 64
    [Request in: 234]
    [Time from request: 0.575985000 seconds]
    [bInterfaceClass: HID (0x03)]
HID Data: 876e91acbb0001020000000000000000000000000000000000000000000000000000000000000000000000000000000000000000000000000000000000000000

No.     Time           Source                Destination           Protocol Length Info
    238 25.566484      host                  3.28.4                USB      27     URB_INTERRUPT in

Frame 238: 27 bytes on wire (216 bits), 27 bytes captured (216 bits) on interface \\.\USBPcap3, id 0
USB URB
    [Source: host]
    [Destination: 3.28.4]
    USBPcap pseudoheader length: 27
    IRP ID: 0xffffa387af6daa20
    IRP USBD_STATUS: USBD_STATUS_SUCCESS (0x00000000)
    URB Function: URB_FUNCTION_BULK_OR_INTERRUPT_TRANSFER (0x0009)
    IRP information: 0x00, Direction: FDO -> PDO
    URB bus id: 3
    Device address: 28
    Endpoint: 0x84, Direction: IN
    URB transfer type: URB_INTERRUPT (0x01)
    Packet Data Length: 0
    [Response in: 241]
    [bInterfaceClass: HID (0x03)]

No.     Time           Source                Destination           Protocol Length Info
    239 25.856467      3.28.4                host                  USB      91     URB_INTERRUPT in

Frame 239: 91 bytes on wire (728 bits), 91 bytes captured (728 bits) on interface \\.\USBPcap3, id 0
USB URB
    [Source: 3.28.4]
    [Destination: host]
    USBPcap pseudoheader length: 27
    IRP ID: 0xffffa387afb5ca20
    IRP USBD_STATUS: USBD_STATUS_SUCCESS (0x00000000)
    URB Function: URB_FUNCTION_BULK_OR_INTERRUPT_TRANSFER (0x0009)
    IRP information: 0x01, Direction: PDO -> FDO
    URB bus id: 3
    Device address: 28
    Endpoint: 0x84, Direction: IN
    URB transfer type: URB_INTERRUPT (0x01)
    Packet Data Length: 64
    [Request in: 236]
    [Time from request: 0.577987000 seconds]
    [bInterfaceClass: HID (0x03)]
HID Data: 876e91acbb0001010000000000000000000000000000000000000000000000000000000000000000000000000000000000000000000000000000000000000000

No.     Time           Source                Destination           Protocol Length Info
    240 25.856488      host                  3.28.4                USB      27     URB_INTERRUPT in

Frame 240: 27 bytes on wire (216 bits), 27 bytes captured (216 bits) on interface \\.\USBPcap3, id 0
USB URB
    [Source: host]
    [Destination: 3.28.4]
    USBPcap pseudoheader length: 27
    IRP ID: 0xffffa387afb5ca20
    IRP USBD_STATUS: USBD_STATUS_SUCCESS (0x00000000)
    URB Function: URB_FUNCTION_BULK_OR_INTERRUPT_TRANSFER (0x0009)
    IRP information: 0x00, Direction: FDO -> PDO
    URB bus id: 3
    Device address: 28
    Endpoint: 0x84, Direction: IN
    URB transfer type: URB_INTERRUPT (0x01)
    Packet Data Length: 0
    [Response in: 243]
    [bInterfaceClass: HID (0x03)]

No.     Time           Source                Destination           Protocol Length Info
    241 25.882462      3.28.4                host                  USB      91     URB_INTERRUPT in

Frame 241: 91 bytes on wire (728 bits), 91 bytes captured (728 bits) on interface \\.\USBPcap3, id 0
USB URB
    [Source: 3.28.4]
    [Destination: host]
    USBPcap pseudoheader length: 27
    IRP ID: 0xffffa387af6daa20
    IRP USBD_STATUS: USBD_STATUS_SUCCESS (0x00000000)
    URB Function: URB_FUNCTION_BULK_OR_INTERRUPT_TRANSFER (0x0009)
    IRP information: 0x01, Direction: PDO -> FDO
    URB bus id: 3
    Device address: 28
    Endpoint: 0x84, Direction: IN
    URB transfer type: URB_INTERRUPT (0x01)
    Packet Data Length: 64
    [Request in: 238]
    [Time from request: 0.315978000 seconds]
    [bInterfaceClass: HID (0x03)]
HID Data: 876e91ac9003e600a301667061636b656402589f74a6ea9213c99c2f74b22492b320cf40262a94c1a950a0397f29250b60841ef0c5000000032fc0579f811347

No.     Time           Source                Destination           Protocol Length Info
    242 25.882479      host                  3.28.4                USB      27     URB_INTERRUPT in

Frame 242: 27 bytes on wire (216 bits), 27 bytes captured (216 bits) on interface \\.\USBPcap3, id 0
USB URB
    [Source: host]
    [Destination: 3.28.4]
    USBPcap pseudoheader length: 27
    IRP ID: 0xffffa387af6daa20
    IRP USBD_STATUS: USBD_STATUS_SUCCESS (0x00000000)
    URB Function: URB_FUNCTION_BULK_OR_INTERRUPT_TRANSFER (0x0009)
    IRP information: 0x00, Direction: FDO -> PDO
    URB bus id: 3
    Device address: 28
    Endpoint: 0x84, Direction: IN
    URB transfer type: URB_INTERRUPT (0x01)
    Packet Data Length: 0
    [Response in: 245]
    [bInterfaceClass: HID (0x03)]

No.     Time           Source                Destination           Protocol Length Info
    243 25.884461      3.28.4                host                  USB      91     URB_INTERRUPT in

Frame 243: 91 bytes on wire (728 bits), 91 bytes captured (728 bits) on interface \\.\USBPcap3, id 0
USB URB
    [Source: 3.28.4]
    [Destination: host]
    USBPcap pseudoheader length: 27
    IRP ID: 0xffffa387afb5ca20
    IRP USBD_STATUS: USBD_STATUS_SUCCESS (0x00000000)
    URB Function: URB_FUNCTION_BULK_OR_INTERRUPT_TRANSFER (0x0009)
    IRP information: 0x01, Direction: PDO -> FDO
    URB bus id: 3
    Device address: 28
    Endpoint: 0x84, Direction: IN
    URB transfer type: URB_INTERRUPT (0x01)
    Packet Data Length: 64
    [Request in: 240]
    [Time from request: 0.027973000 seconds]
    [bInterfaceClass: HID (0x03)]
HID Data: 876e91ac00eab116bb5a8db9202a0030f60f520448cd89ecdf44ac4562f2eb01b1bf3fb6747e3a5272dce956b2f5b2be83b14e5aa8bc14bd59f5bcde9f7bf1d9

No.     Time           Source                Destination           Protocol Length Info
    244 25.884474      host                  3.28.4                USB      27     URB_INTERRUPT in

Frame 244: 27 bytes on wire (216 bits), 27 bytes captured (216 bits) on interface \\.\USBPcap3, id 0
USB URB
    [Source: host]
    [Destination: 3.28.4]
    USBPcap pseudoheader length: 27
    IRP ID: 0xffffa387afb5ca20
    IRP USBD_STATUS: USBD_STATUS_SUCCESS (0x00000000)
    URB Function: URB_FUNCTION_BULK_OR_INTERRUPT_TRANSFER (0x0009)
    IRP information: 0x00, Direction: FDO -> PDO
    URB bus id: 3
    Device address: 28
    Endpoint: 0x84, Direction: IN
    URB transfer type: URB_INTERRUPT (0x01)
    Packet Data Length: 0
    [Response in: 247]
    [bInterfaceClass: HID (0x03)]

No.     Time           Source                Destination           Protocol Length Info
    245 25.886469      3.28.4                host                  USB      91     URB_INTERRUPT in

Frame 245: 91 bytes on wire (728 bits), 91 bytes captured (728 bits) on interface \\.\USBPcap3, id 0
USB URB
    [Source: 3.28.4]
    [Destination: host]
    USBPcap pseudoheader length: 27
    IRP ID: 0xffffa387af6daa20
    IRP USBD_STATUS: USBD_STATUS_SUCCESS (0x00000000)
    URB Function: URB_FUNCTION_BULK_OR_INTERRUPT_TRANSFER (0x0009)
    IRP information: 0x01, Direction: PDO -> FDO
    URB bus id: 3
    Device address: 28
    Endpoint: 0x84, Direction: IN
    URB transfer type: URB_INTERRUPT (0x01)
    Packet Data Length: 64
    [Request in: 242]
    [Time from request: 0.003990000 seconds]
    [bInterfaceClass: HID (0x03)]
HID Data: 876e91ac01a4010103272006215820f60f520448cd89ecdf44ac4562e25ffdd28173315614cc633b35b14db9cf4adaa16b6372656450726f746563740203a363

No.     Time           Source                Destination           Protocol Length Info
    246 25.886479      host                  3.28.4                USB      27     URB_INTERRUPT in

Frame 246: 27 bytes on wire (216 bits), 27 bytes captured (216 bits) on interface \\.\USBPcap3, id 0
USB URB
    [Source: host]
    [Destination: 3.28.4]
    USBPcap pseudoheader length: 27
    IRP ID: 0xffffa387af6daa20
    IRP USBD_STATUS: USBD_STATUS_SUCCESS (0x00000000)
    URB Function: URB_FUNCTION_BULK_OR_INTERRUPT_TRANSFER (0x0009)
    IRP information: 0x00, Direction: FDO -> PDO
    URB bus id: 3
    Device address: 28
    Endpoint: 0x84, Direction: IN
    URB transfer type: URB_INTERRUPT (0x01)
    Packet Data Length: 0
    [Response in: 249]
    [bInterfaceClass: HID (0x03)]

No.     Time           Source                Destination           Protocol Length Info
    247 25.888466      3.28.4                host                  USB      91     URB_INTERRUPT in

Frame 247: 91 bytes on wire (728 bits), 91 bytes captured (728 bits) on interface \\.\USBPcap3, id 0
USB URB
    [Source: 3.28.4]
    [Destination: host]
    USBPcap pseudoheader length: 27
    IRP ID: 0xffffa387afb5ca20
    IRP USBD_STATUS: USBD_STATUS_SUCCESS (0x00000000)
    URB Function: URB_FUNCTION_BULK_OR_INTERRUPT_TRANSFER (0x0009)
    IRP information: 0x01, Direction: PDO -> FDO
    URB bus id: 3
    Device address: 28
    Endpoint: 0x84, Direction: IN
    URB transfer type: URB_INTERRUPT (0x01)
    Packet Data Length: 64
    [Request in: 244]
    [Time from request: 0.003992000 seconds]
    [bInterfaceClass: HID (0x03)]
HID Data: 876e91ac02616c67266373696758483046022100dba4eb68d6d3cfdbee9ffed386c03a6f9f533a9e2da7bea8ed9abff90682b397022100aba31e2dbd0569474f

No.     Time           Source                Destination           Protocol Length Info
    248 25.888479      host                  3.28.4                USB      27     URB_INTERRUPT in

Frame 248: 27 bytes on wire (216 bits), 27 bytes captured (216 bits) on interface \\.\USBPcap3, id 0
USB URB
    [Source: host]
    [Destination: 3.28.4]
    USBPcap pseudoheader length: 27
    IRP ID: 0xffffa387afb5ca20
    IRP USBD_STATUS: USBD_STATUS_SUCCESS (0x00000000)
    URB Function: URB_FUNCTION_BULK_OR_INTERRUPT_TRANSFER (0x0009)
    IRP information: 0x00, Direction: FDO -> PDO
    URB bus id: 3
    Device address: 28
    Endpoint: 0x84, Direction: IN
    URB transfer type: URB_INTERRUPT (0x01)
    Packet Data Length: 0
    [Response in: 251]
    [bInterfaceClass: HID (0x03)]

No.     Time           Source                Destination           Protocol Length Info
    249 25.890464      3.28.4                host                  USB      91     URB_INTERRUPT in

Frame 249: 91 bytes on wire (728 bits), 91 bytes captured (728 bits) on interface \\.\USBPcap3, id 0
USB URB
    [Source: 3.28.4]
    [Destination: host]
    USBPcap pseudoheader length: 27
    IRP ID: 0xffffa387af6daa20
    IRP USBD_STATUS: USBD_STATUS_SUCCESS (0x00000000)
    URB Function: URB_FUNCTION_BULK_OR_INTERRUPT_TRANSFER (0x0009)
    IRP information: 0x01, Direction: PDO -> FDO
    URB bus id: 3
    Device address: 28
    Endpoint: 0x84, Direction: IN
    URB transfer type: URB_INTERRUPT (0x01)
    Packet Data Length: 64
    [Request in: 246]
    [Time from request: 0.003985000 seconds]
    [bInterfaceClass: HID (0x03)]
HID Data: 876e91ac037d0279d3c70814b1e98e2974fab0f19cf739fca6d74d9563783563815902dd308202d9308201c1a003020102020900df92d9c4e2ed660a300d0609

No.     Time           Source                Destination           Protocol Length Info
    250 25.890478      host                  3.28.4                USB      27     URB_INTERRUPT in

Frame 250: 27 bytes on wire (216 bits), 27 bytes captured (216 bits) on interface \\.\USBPcap3, id 0
USB URB
    [Source: host]
    [Destination: 3.28.4]
    USBPcap pseudoheader length: 27
    IRP ID: 0xffffa387af6daa20
    IRP USBD_STATUS: USBD_STATUS_SUCCESS (0x00000000)
    URB Function: URB_FUNCTION_BULK_OR_INTERRUPT_TRANSFER (0x0009)
    IRP information: 0x00, Direction: FDO -> PDO
    URB bus id: 3
    Device address: 28
    Endpoint: 0x84, Direction: IN
    URB transfer type: URB_INTERRUPT (0x01)
    Packet Data Length: 0
    [Response in: 253]
    [bInterfaceClass: HID (0x03)]

No.     Time           Source                Destination           Protocol Length Info
    251 25.892465      3.28.4                host                  USB      91     URB_INTERRUPT in

Frame 251: 91 bytes on wire (728 bits), 91 bytes captured (728 bits) on interface \\.\USBPcap3, id 0
USB URB
    [Source: 3.28.4]
    [Destination: host]
    USBPcap pseudoheader length: 27
    IRP ID: 0xffffa387afb5ca20
    IRP USBD_STATUS: USBD_STATUS_SUCCESS (0x00000000)
    URB Function: URB_FUNCTION_BULK_OR_INTERRUPT_TRANSFER (0x0009)
    IRP information: 0x01, Direction: PDO -> FDO
    URB bus id: 3
    Device address: 28
    Endpoint: 0x84, Direction: IN
    URB transfer type: URB_INTERRUPT (0x01)
    Packet Data Length: 64
    [Request in: 248]
    [Time from request: 0.003986000 seconds]
    [bInterfaceClass: HID (0x03)]
HID Data: 876e91ac042a864886f70d01010b0500302e312c302a0603550403132359756269636f2055324620526f6f742043412053657269616c20343537323030363331

No.     Time           Source                Destination           Protocol Length Info
    252 25.892481      host                  3.28.4                USB      27     URB_INTERRUPT in

Frame 252: 27 bytes on wire (216 bits), 27 bytes captured (216 bits) on interface \\.\USBPcap3, id 0
USB URB
    [Source: host]
    [Destination: 3.28.4]
    USBPcap pseudoheader length: 27
    IRP ID: 0xffffa387afb5ca20
    IRP USBD_STATUS: USBD_STATUS_SUCCESS (0x00000000)
    URB Function: URB_FUNCTION_BULK_OR_INTERRUPT_TRANSFER (0x0009)
    IRP information: 0x00, Direction: FDO -> PDO
    URB bus id: 3
    Device address: 28
    Endpoint: 0x84, Direction: IN
    URB transfer type: URB_INTERRUPT (0x01)
    Packet Data Length: 0
    [Response in: 255]
    [bInterfaceClass: HID (0x03)]

No.     Time           Source                Destination           Protocol Length Info
    253 25.894472      3.28.4                host                  USB      91     URB_INTERRUPT in

Frame 253: 91 bytes on wire (728 bits), 91 bytes captured (728 bits) on interface \\.\USBPcap3, id 0
USB URB
    [Source: 3.28.4]
    [Destination: host]
    USBPcap pseudoheader length: 27
    IRP ID: 0xffffa387af6daa20
    IRP USBD_STATUS: USBD_STATUS_SUCCESS (0x00000000)
    URB Function: URB_FUNCTION_BULK_OR_INTERRUPT_TRANSFER (0x0009)
    IRP information: 0x01, Direction: PDO -> FDO
    URB bus id: 3
    Device address: 28
    Endpoint: 0x84, Direction: IN
    URB transfer type: URB_INTERRUPT (0x01)
    Packet Data Length: 64
    [Request in: 250]
    [Time from request: 0.003994000 seconds]
    [bInterfaceClass: HID (0x03)]
HID Data: 876e91ac053020170d3134303830313030303030305a180f32303530303930343030303030305a306f310b300906035504061302534531123010060355040a0c

No.     Time           Source                Destination           Protocol Length Info
    254 25.894486      host                  3.28.4                USB      27     URB_INTERRUPT in

Frame 254: 27 bytes on wire (216 bits), 27 bytes captured (216 bits) on interface \\.\USBPcap3, id 0
USB URB
    [Source: host]
    [Destination: 3.28.4]
    USBPcap pseudoheader length: 27
    IRP ID: 0xffffa387af6daa20
    IRP USBD_STATUS: USBD_STATUS_SUCCESS (0x00000000)
    URB Function: URB_FUNCTION_BULK_OR_INTERRUPT_TRANSFER (0x0009)
    IRP information: 0x00, Direction: FDO -> PDO
    URB bus id: 3
    Device address: 28
    Endpoint: 0x84, Direction: IN
    URB transfer type: URB_INTERRUPT (0x01)
    Packet Data Length: 0
    [Response in: 257]
    [bInterfaceClass: HID (0x03)]

No.     Time           Source                Destination           Protocol Length Info
    255 25.896463      3.28.4                host                  USB      91     URB_INTERRUPT in

Frame 255: 91 bytes on wire (728 bits), 91 bytes captured (728 bits) on interface \\.\USBPcap3, id 0
USB URB
    [Source: 3.28.4]
    [Destination: host]
    USBPcap pseudoheader length: 27
    IRP ID: 0xffffa387afb5ca20
    IRP USBD_STATUS: USBD_STATUS_SUCCESS (0x00000000)
    URB Function: URB_FUNCTION_BULK_OR_INTERRUPT_TRANSFER (0x0009)
    IRP information: 0x01, Direction: PDO -> FDO
    URB bus id: 3
    Device address: 28
    Endpoint: 0x84, Direction: IN
    URB transfer type: URB_INTERRUPT (0x01)
    Packet Data Length: 64
    [Request in: 252]
    [Time from request: 0.003982000 seconds]
    [bInterfaceClass: HID (0x03)]
HID Data: 876e91ac060959756269636f20414231223020060355040b0c1941757468656e74696361746f72204174746573746174696f6e3128302606035504030c1f5975

No.     Time           Source                Destination           Protocol Length Info
    256 25.896478      host                  3.28.4                USB      27     URB_INTERRUPT in

Frame 256: 27 bytes on wire (216 bits), 27 bytes captured (216 bits) on interface \\.\USBPcap3, id 0
USB URB
    [Source: host]
    [Destination: 3.28.4]
    USBPcap pseudoheader length: 27
    IRP ID: 0xffffa387afb5ca20
    IRP USBD_STATUS: USBD_STATUS_SUCCESS (0x00000000)
    URB Function: URB_FUNCTION_BULK_OR_INTERRUPT_TRANSFER (0x0009)
    IRP information: 0x00, Direction: FDO -> PDO
    URB bus id: 3
    Device address: 28
    Endpoint: 0x84, Direction: IN
    URB transfer type: URB_INTERRUPT (0x01)
    Packet Data Length: 0
    [Response in: 259]
    [bInterfaceClass: HID (0x03)]

No.     Time           Source                Destination           Protocol Length Info
    257 25.898459      3.28.4                host                  USB      91     URB_INTERRUPT in

Frame 257: 91 bytes on wire (728 bits), 91 bytes captured (728 bits) on interface \\.\USBPcap3, id 0
USB URB
    [Source: 3.28.4]
    [Destination: host]
    USBPcap pseudoheader length: 27
    IRP ID: 0xffffa387af6daa20
    IRP USBD_STATUS: USBD_STATUS_SUCCESS (0x00000000)
    URB Function: URB_FUNCTION_BULK_OR_INTERRUPT_TRANSFER (0x0009)
    IRP information: 0x01, Direction: PDO -> FDO
    URB bus id: 3
    Device address: 28
    Endpoint: 0x84, Direction: IN
    URB transfer type: URB_INTERRUPT (0x01)
    Packet Data Length: 64
    [Request in: 254]
    [Time from request: 0.003973000 seconds]
    [bInterfaceClass: HID (0x03)]
HID Data: 876e91ac076269636f205532462045452053657269616c20313135353130393539393059301306072a8648ce3d020106082a8648ce3d030107034200040a186c

No.     Time           Source                Destination           Protocol Length Info
    258 25.898469      host                  3.28.4                USB      27     URB_INTERRUPT in

Frame 258: 27 bytes on wire (216 bits), 27 bytes captured (216 bits) on interface \\.\USBPcap3, id 0
USB URB
    [Source: host]
    [Destination: 3.28.4]
    USBPcap pseudoheader length: 27
    IRP ID: 0xffffa387af6daa20
    IRP USBD_STATUS: USBD_STATUS_SUCCESS (0x00000000)
    URB Function: URB_FUNCTION_BULK_OR_INTERRUPT_TRANSFER (0x0009)
    IRP information: 0x00, Direction: FDO -> PDO
    URB bus id: 3
    Device address: 28
    Endpoint: 0x84, Direction: IN
    URB transfer type: URB_INTERRUPT (0x01)
    Packet Data Length: 0
    [Response in: 261]
    [bInterfaceClass: HID (0x03)]

No.     Time           Source                Destination           Protocol Length Info
    259 25.900468      3.28.4                host                  USB      91     URB_INTERRUPT in

Frame 259: 91 bytes on wire (728 bits), 91 bytes captured (728 bits) on interface \\.\USBPcap3, id 0
USB URB
    [Source: 3.28.4]
    [Destination: host]
    USBPcap pseudoheader length: 27
    IRP ID: 0xffffa387afb5ca20
    IRP USBD_STATUS: USBD_STATUS_SUCCESS (0x00000000)
    URB Function: URB_FUNCTION_BULK_OR_INTERRUPT_TRANSFER (0x0009)
    IRP information: 0x01, Direction: PDO -> FDO
    URB bus id: 3
    Device address: 28
    Endpoint: 0x84, Direction: IN
    URB transfer type: URB_INTERRUPT (0x01)
    Packet Data Length: 64
    [Request in: 256]
    [Time from request: 0.003990000 seconds]
    [bInterfaceClass: HID (0x03)]
HID Data: 876e91ac086e4d0a6a528a44909a7a2423687028d4c57eccb717ba1280b85c2fc1e4e061668c3c20aef33350d19645238a2c390bf5dffa34ff25502f470f3d40

No.     Time           Source                Destination           Protocol Length Info
    260 25.900481      host                  3.28.4                USB      27     URB_INTERRUPT in

Frame 260: 27 bytes on wire (216 bits), 27 bytes captured (216 bits) on interface \\.\USBPcap3, id 0
USB URB
    [Source: host]
    [Destination: 3.28.4]
    USBPcap pseudoheader length: 27
    IRP ID: 0xffffa387afb5ca20
    IRP USBD_STATUS: USBD_STATUS_SUCCESS (0x00000000)
    URB Function: URB_FUNCTION_BULK_OR_INTERRUPT_TRANSFER (0x0009)
    IRP information: 0x00, Direction: FDO -> PDO
    URB bus id: 3
    Device address: 28
    Endpoint: 0x84, Direction: IN
    URB transfer type: URB_INTERRUPT (0x01)
    Packet Data Length: 0
    [Response in: 263]
    [bInterfaceClass: HID (0x03)]

No.     Time           Source                Destination           Protocol Length Info
    261 25.902476      3.28.4                host                  USB      91     URB_INTERRUPT in

Frame 261: 91 bytes on wire (728 bits), 91 bytes captured (728 bits) on interface \\.\USBPcap3, id 0
USB URB
    [Source: 3.28.4]
    [Destination: host]
    USBPcap pseudoheader length: 27
    IRP ID: 0xffffa387af6daa20
    IRP USBD_STATUS: USBD_STATUS_SUCCESS (0x00000000)
    URB Function: URB_FUNCTION_BULK_OR_INTERRUPT_TRANSFER (0x0009)
    IRP information: 0x01, Direction: PDO -> FDO
    URB bus id: 3
    Device address: 28
    Endpoint: 0x84, Direction: IN
    URB transfer type: URB_INTERRUPT (0x01)
    Packet Data Length: 64
    [Request in: 258]
    [Time from request: 0.004007000 seconds]
    [bInterfaceClass: HID (0x03)]
HID Data: 876e91ac09b888a38181307f3013060a2b0601040182c40a0d0104050403050403302206092b0601040182c40a020415312e332e362e312e342e312e34313438

No.     Time           Source                Destination           Protocol Length Info
    262 25.902488      host                  3.28.4                USB      27     URB_INTERRUPT in

Frame 262: 27 bytes on wire (216 bits), 27 bytes captured (216 bits) on interface \\.\USBPcap3, id 0
USB URB
    [Source: host]
    [Destination: 3.28.4]
    USBPcap pseudoheader length: 27
    IRP ID: 0xffffa387af6daa20
    IRP USBD_STATUS: USBD_STATUS_SUCCESS (0x00000000)
    URB Function: URB_FUNCTION_BULK_OR_INTERRUPT_TRANSFER (0x0009)
    IRP information: 0x00, Direction: FDO -> PDO
    URB bus id: 3
    Device address: 28
    Endpoint: 0x84, Direction: IN
    URB transfer type: URB_INTERRUPT (0x01)
    Packet Data Length: 0
    [Response in: 265]
    [bInterfaceClass: HID (0x03)]

No.     Time           Source                Destination           Protocol Length Info
    263 25.904464      3.28.4                host                  USB      91     URB_INTERRUPT in

Frame 263: 91 bytes on wire (728 bits), 91 bytes captured (728 bits) on interface \\.\USBPcap3, id 0
USB URB
    [Source: 3.28.4]
    [Destination: host]
    USBPcap pseudoheader length: 27
    IRP ID: 0xffffa387afb5ca20
    IRP USBD_STATUS: USBD_STATUS_SUCCESS (0x00000000)
    URB Function: URB_FUNCTION_BULK_OR_INTERRUPT_TRANSFER (0x0009)
    IRP information: 0x01, Direction: PDO -> FDO
    URB bus id: 3
    Device address: 28
    Endpoint: 0x84, Direction: IN
    URB transfer type: URB_INTERRUPT (0x01)
    Packet Data Length: 64
    [Request in: 260]
    [Time from request: 0.003983000 seconds]
    [bInterfaceClass: HID (0x03)]
HID Data: 876e91ac0a322e312e373013060b2b0601040182e51c0201010404030204303021060b2b0601040182e51c010104041204102fc0579f811347eab116bb5a8db9

No.     Time           Source                Destination           Protocol Length Info
    264 25.904475      host                  3.28.4                USB      27     URB_INTERRUPT in

Frame 264: 27 bytes on wire (216 bits), 27 bytes captured (216 bits) on interface \\.\USBPcap3, id 0
USB URB
    [Source: host]
    [Destination: 3.28.4]
    USBPcap pseudoheader length: 27
    IRP ID: 0xffffa387afb5ca20
    IRP USBD_STATUS: USBD_STATUS_SUCCESS (0x00000000)
    URB Function: URB_FUNCTION_BULK_OR_INTERRUPT_TRANSFER (0x0009)
    IRP information: 0x00, Direction: FDO -> PDO
    URB bus id: 3
    Device address: 28
    Endpoint: 0x84, Direction: IN
    URB transfer type: URB_INTERRUPT (0x01)
    Packet Data Length: 0
    [Response in: 267]
    [bInterfaceClass: HID (0x03)]

No.     Time           Source                Destination           Protocol Length Info
    265 25.906467      3.28.4                host                  USB      91     URB_INTERRUPT in

Frame 265: 91 bytes on wire (728 bits), 91 bytes captured (728 bits) on interface \\.\USBPcap3, id 0
USB URB
    [Source: 3.28.4]
    [Destination: host]
    USBPcap pseudoheader length: 27
    IRP ID: 0xffffa387af6daa20
    IRP USBD_STATUS: USBD_STATUS_SUCCESS (0x00000000)
    URB Function: URB_FUNCTION_BULK_OR_INTERRUPT_TRANSFER (0x0009)
    IRP information: 0x01, Direction: PDO -> FDO
    URB bus id: 3
    Device address: 28
    Endpoint: 0x84, Direction: IN
    URB transfer type: URB_INTERRUPT (0x01)
    Packet Data Length: 64
    [Request in: 262]
    [Time from request: 0.003979000 seconds]
    [bInterfaceClass: HID (0x03)]
HID Data: 876e91ac0b202a300c0603551d130101ff04023000300d06092a864886f70d01010b0500038201010082acaf1130a99bd14327d2f8f9b041a2a04a6685272422

No.     Time           Source                Destination           Protocol Length Info
    266 25.906479      host                  3.28.4                USB      27     URB_INTERRUPT in

Frame 266: 27 bytes on wire (216 bits), 27 bytes captured (216 bits) on interface \\.\USBPcap3, id 0
USB URB
    [Source: host]
    [Destination: 3.28.4]
    USBPcap pseudoheader length: 27
    IRP ID: 0xffffa387af6daa20
    IRP USBD_STATUS: USBD_STATUS_SUCCESS (0x00000000)
    URB Function: URB_FUNCTION_BULK_OR_INTERRUPT_TRANSFER (0x0009)
    IRP information: 0x00, Direction: FDO -> PDO
    URB bus id: 3
    Device address: 28
    Endpoint: 0x84, Direction: IN
    URB transfer type: URB_INTERRUPT (0x01)
    Packet Data Length: 0
    [Response in: 269]
    [bInterfaceClass: HID (0x03)]

No.     Time           Source                Destination           Protocol Length Info
    267 25.908467      3.28.4                host                  USB      91     URB_INTERRUPT in

Frame 267: 91 bytes on wire (728 bits), 91 bytes captured (728 bits) on interface \\.\USBPcap3, id 0
USB URB
    [Source: 3.28.4]
    [Destination: host]
    USBPcap pseudoheader length: 27
    IRP ID: 0xffffa387afb5ca20
    IRP USBD_STATUS: USBD_STATUS_SUCCESS (0x00000000)
    URB Function: URB_FUNCTION_BULK_OR_INTERRUPT_TRANSFER (0x0009)
    IRP information: 0x01, Direction: PDO -> FDO
    URB bus id: 3
    Device address: 28
    Endpoint: 0x84, Direction: IN
    URB transfer type: URB_INTERRUPT (0x01)
    Packet Data Length: 64
    [Request in: 264]
    [Time from request: 0.003992000 seconds]
    [bInterfaceClass: HID (0x03)]
HID Data: 876e91ac0ce57b14b0b8f83b6f1545664bbf55681eaf0158722abfced2e4ac633cec0959564524b0f2e517dd971098b9891517ecd0c553a2e4739f9de13dafd0

No.     Time           Source                Destination           Protocol Length Info
    268 25.908481      host                  3.28.4                USB      27     URB_INTERRUPT in

Frame 268: 27 bytes on wire (216 bits), 27 bytes captured (216 bits) on interface \\.\USBPcap3, id 0
USB URB
    [Source: host]
    [Destination: 3.28.4]
    USBPcap pseudoheader length: 27
    IRP ID: 0xffffa387afb5ca20
    IRP USBD_STATUS: USBD_STATUS_SUCCESS (0x00000000)
    URB Function: URB_FUNCTION_BULK_OR_INTERRUPT_TRANSFER (0x0009)
    IRP information: 0x00, Direction: FDO -> PDO
    URB bus id: 3
    Device address: 28
    Endpoint: 0x84, Direction: IN
    URB transfer type: URB_INTERRUPT (0x01)
    Packet Data Length: 0
    [Response in: 271]
    [bInterfaceClass: HID (0x03)]

No.     Time           Source                Destination           Protocol Length Info
    269 25.910468      3.28.4                host                  USB      91     URB_INTERRUPT in

Frame 269: 91 bytes on wire (728 bits), 91 bytes captured (728 bits) on interface \\.\USBPcap3, id 0
USB URB
    [Source: 3.28.4]
    [Destination: host]
    USBPcap pseudoheader length: 27
    IRP ID: 0xffffa387af6daa20
    IRP USBD_STATUS: USBD_STATUS_SUCCESS (0x00000000)
    URB Function: URB_FUNCTION_BULK_OR_INTERRUPT_TRANSFER (0x0009)
    IRP information: 0x01, Direction: PDO -> FDO
    URB bus id: 3
    Device address: 28
    Endpoint: 0x84, Direction: IN
    URB transfer type: URB_INTERRUPT (0x01)
    Packet Data Length: 64
    [Request in: 266]
    [Time from request: 0.003989000 seconds]
    [bInterfaceClass: HID (0x03)]
HID Data: 876e91ac0dd5d7b8ac4a37f4f2cc30ef25cb00652d19db69d7da57bd1a9c1d8ed87d46d80d2b3bdfd1d9ef9d2b6832d4ad5bcd74214ce6a6141d16b2e93acb2c

No.     Time           Source                Destination           Protocol Length Info
    270 25.910481      host                  3.28.4                USB      27     URB_INTERRUPT in

Frame 270: 27 bytes on wire (216 bits), 27 bytes captured (216 bits) on interface \\.\USBPcap3, id 0
USB URB
    [Source: host]
    [Destination: 3.28.4]
    USBPcap pseudoheader length: 27
    IRP ID: 0xffffa387af6daa20
    IRP USBD_STATUS: USBD_STATUS_SUCCESS (0x00000000)
    URB Function: URB_FUNCTION_BULK_OR_INTERRUPT_TRANSFER (0x0009)
    IRP information: 0x00, Direction: FDO -> PDO
    URB bus id: 3
    Device address: 28
    Endpoint: 0x84, Direction: IN
    URB transfer type: URB_INTERRUPT (0x01)
    Packet Data Length: 0
    [Response in: 273]
    [bInterfaceClass: HID (0x03)]

No.     Time           Source                Destination           Protocol Length Info
    271 25.912462      3.28.4                host                  USB      91     URB_INTERRUPT in

Frame 271: 91 bytes on wire (728 bits), 91 bytes captured (728 bits) on interface \\.\USBPcap3, id 0
USB URB
    [Source: 3.28.4]
    [Destination: host]
    USBPcap pseudoheader length: 27
    IRP ID: 0xffffa387afb5ca20
    IRP USBD_STATUS: USBD_STATUS_SUCCESS (0x00000000)
    URB Function: URB_FUNCTION_BULK_OR_INTERRUPT_TRANSFER (0x0009)
    IRP information: 0x01, Direction: PDO -> FDO
    URB bus id: 3
    Device address: 28
    Endpoint: 0x84, Direction: IN
    URB transfer type: URB_INTERRUPT (0x01)
    Packet Data Length: 64
    [Request in: 268]
    [Time from request: 0.003981000 seconds]
    [bInterfaceClass: HID (0x03)]
HID Data: 876e91ac0e88f60a3eb6d5f61471975909373bc677902324571a573f60f07bbed17b92c8b59fa28210bfa8c6012293001b39efe57bf9cb1e3aca8a4130f83af8

No.     Time           Source                Destination           Protocol Length Info
    272 25.912476      host                  3.28.4                USB      27     URB_INTERRUPT in

Frame 272: 27 bytes on wire (216 bits), 27 bytes captured (216 bits) on interface \\.\USBPcap3, id 0
USB URB
    [Source: host]
    [Destination: 3.28.4]
    USBPcap pseudoheader length: 27
    IRP ID: 0xffffa387afb5ca20
    IRP USBD_STATUS: USBD_STATUS_SUCCESS (0x00000000)
    URB Function: URB_FUNCTION_BULK_OR_INTERRUPT_TRANSFER (0x0009)
    IRP information: 0x00, Direction: FDO -> PDO
    URB bus id: 3
    Device address: 28
    Endpoint: 0x84, Direction: IN
    URB transfer type: URB_INTERRUPT (0x01)
    Packet Data Length: 0
    [bInterfaceClass: HID (0x03)]

No.     Time           Source                Destination           Protocol Length Info
    273 25.914463      3.28.4                host                  USB      91     URB_INTERRUPT in

Frame 273: 91 bytes on wire (728 bits), 91 bytes captured (728 bits) on interface \\.\USBPcap3, id 0
USB URB
    [Source: 3.28.4]
    [Destination: host]
    USBPcap pseudoheader length: 27
    IRP ID: 0xffffa387af6daa20
    IRP USBD_STATUS: USBD_STATUS_SUCCESS (0x00000000)
    URB Function: URB_FUNCTION_BULK_OR_INTERRUPT_TRANSFER (0x0009)
    IRP information: 0x01, Direction: PDO -> FDO
    URB bus id: 3
    Device address: 28
    Endpoint: 0x84, Direction: IN
    URB transfer type: URB_INTERRUPT (0x01)
    Packet Data Length: 64
    [Request in: 270]
    [Time from request: 0.003982000 seconds]
    [bInterfaceClass: HID (0x03)]
HID Data: 876e91ac0f668f73def2711b20dc99e8a804eea3f7427197b6b451b3735c23bc9b1be274c26d3bf9196f8c4a4b715f4b95c4db7b97e7594eb465648c1c000000

No.     Time           Source                Destination           Protocol Length Info
    274 25.914478      host                  3.28.4                USB      27     URB_INTERRUPT in

Frame 274: 27 bytes on wire (216 bits), 27 bytes captured (216 bits) on interface \\.\USBPcap3, id 0
USB URB
    [Source: host]
    [Destination: 3.28.4]
    USBPcap pseudoheader length: 27
    IRP ID: 0xffffa387af6daa20
    IRP USBD_STATUS: USBD_STATUS_SUCCESS (0x00000000)
    URB Function: URB_FUNCTION_BULK_OR_INTERRUPT_TRANSFER (0x0009)
    IRP information: 0x00, Direction: FDO -> PDO
    URB bus id: 3
    Device address: 28
    Endpoint: 0x84, Direction: IN
    URB transfer type: URB_INTERRUPT (0x01)
    Packet Data Length: 0
    [bInterfaceClass: HID (0x03)]
